id 값,제목,분류,프로젝트 시작,프로젝트 종류,상세 내용,제안의 시작,주요제안(문제정의),해결방안,링크,미추진 사유,공감투표 참여안내,참고자료
jejudsi_10A7,제주 이웃 도움 요청 어플리케이션,기타,2021-07-21,기간종료,,"		코로나 사태로 인해 우리는 게을러 졌습니다. 외출을 자제하게 됨으로써 집 앞에 나가서 쓰레기를 버리거나 장을 보는 것도 귀찮게 되었죠. 마스크도 써야하고 실내 출입시 명부를 작성해야 합니다. 한마디로 말하자면 일상의 모든 사소한 일들이 하기 싫어졌습니다. 이렇다 보니 단순 심부름, 배달, 펫케어, 청소, 인테리어 설치 등 생활속의 할일을 해결해줄 사람이 필요합니다.최근에 에피소드를 말씀드리자면 제 친구가 벌레를 무서워합니다. 하지만 집에 벌레를 잡아줄 사람이 없어 밤에 저를 부르더군요. 제가 만약 가지 않았더라면 제 친구는 다음날까지 방에 갇혀 마루에 있는 벌레를 잡지 못했을 겁니다. 근데 이때 이웃이나 근처에 도움을 청할 수 있었더라면 먼 거리에 있던 저를 부를 이유가 있었을까요? 제가 제안할 이 플랫폼이 존재했다면 번거로움을 감수해야 할 이유가 없었을 것 입니다.제주는 지역상 치명적인 단점이 있습니다. 타 심부름/도우미 플랫폼들을 이용해 보니 대부분 서울 지역만 활성화 되어있었고 제주 지역을 지원하더라도 간단한 심부름을 매칭하는데 너무 긴 시간이 소요되었습니다. 이때 의문이 들었던 것은 '당근마켓 같은 경우에는 사용자가 많은데 왜 다른 유명한 플랫폼들에서는 제주 이용자가 별로 없을까?' 였습니다. 답은 제주도민 대부분이 이와 같은 앱들은 제주에서 상용화되지 않을 거란 것을 알고 있었기 때문이었습니다. 따라서 제주에 국한된, 지역을 넓혀가더라도 제주에서 초기 운영되는 플랫폼이 필요하다는 생각을 했습니다.수도권에서는 대표적으로 '김집사', '애니맨' 이라는 플랫폼을 이용합니다. 이에 따라 보완점과 시장 반응을 알아보기 쉬웠고 간략하게 설명드리겠습니다.김집사라는 플랫폼에서는 이용 가능 지역이 매우 한정적이었지만 10만 단위의 이용자들을 유치하며 빠른 성장세를 보여주었습니다. 애니맨은 모든 지역이 이용 가능 했지만 육지에서만 실질적으로 활용되고 있었고요.국내 자택방문형 O2O ('Online To Offline'의 줄임말로 온라인에서 주문하고 오프라인에서 받는 서비스) 시장규모도 매년 꾸준히 증가하고 있으며 이외에도 많은 어플리케이션의 사용자들은 편리하다는 입장과 부수입으로 쏠쏠하다는 입장으로 각종 생활 도움을 제공하는 사람들과 받는 사람들 모두가 만족하는 모습을 보이고 있습니다. 중국에서도 자택방문형 O2O 서비스 열풍이 불고 있어 이러한 플랫폼들에 대한 시장의 반응은 검증이 되었습니다.제주에서의 실현 가능성을 살펴보자면 70만(2020년 4월 기준) 인구에 육박하고 있고 빅데이터를 이용한 사람들의 활동 패턴을 분석한 결과 일부 지역에 분포도가 집중되어 있다는 것을 알게 되었습니다. 즉, 인근에서 빠르게 도움을 제공할 사람들이 있으며 어플리케이션의 사용자 수가 기하급수적으로 증가할 수 있다는 성장성을 내포하고 있는 것입니다. 집중되어있는 곳부터 시작되어 제주 전역으로 펼쳐나갈 수 있을 거라 생각합니다.또한, 주로 20, 30대의 젊은 층의 스마트폰 보급률 확대와 더불어 음식배달 등 앱으로 일상 심부름을 시키는 대학생들까지 가세하고 있음에 따라 거부감 없이 편리하게 사용되고 제주도민 모두에게 아주 요긴한 필수 플랫폼이 되리라 예상합니다.",,,https://jejudsi.kr/issue/10a7,,,
jejudsi_LBPW,신분증을 인식하여 미성년자의 출입을 막는 인공지능 무인출입 시스템,기타,2020-09-24,기간종료,,"		.[핵심내용]신분증을 인식하여 미성년자의 출입을 막는 인공지능 무인출입 시스템•무인시장의 급성장 → 무인업장 내 감시 허술 → 청소년 탈선장소로 전락•무인업장 입구에 본 제품을 설치하여 무인으로 미성년자 출입을 제한•딥러닝(CNN)기반 OCR엔진으로 신분증을 인식하여 성인 여부 확인(자사가 보유한 핵심기술로 한글·영문 인식률 99.9%, 신세계I&C, 우체국 도입완료)•신분증 뒷면의 지문정보와 출입자의 지문을 대조하여 신분증 도용 차단•일반 RGB 광원 외에 IR, UV 광원을 이용하여 신분증 위변조 판별[차별성]•업계 유일 중앙서버 구축으로 전국 매장에서 신분증 없이 지문으로 성인인증•CCD방식의 카메라를 적용하여 모바일 운전면허증, 개정 주민등록증 완벽대비•별도의 컴퓨터가 필요했던 기존 제품과 달리 유/무인형의 다양한 일체형 기기•손님입장 알림, 통계관리 등 맞춤형 현장기능을 탑재한 점주용 모바일 앱 제공		",,,https://jejudsi.kr/issue/LBPW,,,
jejudsi_LGXY,안전귀가,기타,2020-09-21,기간종료,,"제안 취지(제안에 관심을 가지게 된 이유, 계기)가로등이 있지만 너무 어두운 집가는길- 제안의 중요성(제안한 사회문제가 중요한 이유) 안전한 귀가를 위하여- 기대효과안전한 귀가를 할 수 있음",,,https://jejudsi.kr/issue/LGxY,,"안전귀가2100공감투표기간 :2020-09-21 ~ 2020-10-21※ 제안등록일로부터 30일 이내, 100표 도달 후 해결방안을 등록하면 공감투표로 진행됩니다. 공감 달성 기간 경과",
jejudsi_17MN,전기차 보급에 대한 의견,기타,2020-07-07,기간종료,,"제안 취지(제안에 관심을 가지게 된 이유, 계기)최근 제주뉴스에 전기차 보급율이 목표에 미달되고 있다는 기사들이 많습니다. 왜 보급율이 낮을까 생각하며 찾아보니 전기차 보급대수를 늘리다보니 제주의 전기차 구매보조금이 년도가 지날수록 낮아지고 있다는겁니다.  전기차는 일반내연기관 차보다 가격이 높습니다. 보조금이 뒷받침되지 않으면 일반구매자가 구매하기는 어렵습니다. 이러다보니 전기차 차 보급율이 목표치에 닿을수없을수 밖에 없다 생각합니다.- 제안의 중요성(제안한 사회문제가 중요한 이유)제주도입장에서는 전기차 보급대수를 늘리는것도 중요하지만 구매하는 도민의 입장으로서 부담을 줄여주는것도 중요하다고 생각합니다. 2017년도에만 해도 전기차 구매보조금이 많았을때는 선착순마감이 빠르게 진행되었습니다. 지금도 많은대수에 적게 보조금을 지급하는것보다 목표대수를 줄여 그만큼 보조금을 늘리는게 어떨까하는 짧은생각을 올립니다.- 기대효과목표보급대수를 낮추고 그만큼 전기차 보조금을 올려 전기차구매를 하고자하는 도민들에게 부담을 더줄여주면 그만큼 전기차를 구매하는 도민은 늘어날겁니다. 그러면 제주도에는 전기차대수는 늘어날것이고, 전기차 선도하는 제주도가 되지않을까싶습니다.		",,,https://jejudsi.kr/issue/17mn,,,
jejudsi_R3DE,실종견 찾는 지역 어플,기타,2020-06-25,기간종료,,"제안 취지(제안에 관심을 가지게 된 이유, 계기)종종 길을 돌아다니다보면 잃어버린 반려견을 찾는 전단지를 쉽게 볼 수 있습니다. '찾으면 본인이 회수하겠습니다'라고 적힌 전단지는 회수되는 일 없이 방치되는 경우가 대다수입니다.실제로 잃어버린 개가 주인에게 돌아올 확률은 8%로 많은 실종견들이 거리에서 쓸슬한 죽음을 맞이합니다.그래서 이런 문제를 해결하기 위해 실종견을 찾을 수 있도록 동네 주민들이 도와주는 어플이 있으면 좋겠다고 생각했습니다. 실종 사건에서 가장 중요한 건  초기 골든타임으로 하루에 10km를 이동할 수 있는 반려견의 반경에 맞추어 실종견이 발생했을 때 근처에 있는 주민에게 바로 알려줄 수 있는 어플입니다.사용자는 평소에 당근마켓처럼 자신의 동네를 등록해고 실종견이 발생했을 때 바로 알림을 받을 수 있습니다. 또한 동네를 돌아다니다가 주인 잃은 개를 발견하면 사진을 찍어 어플에 등록하여 주인을 찾을 수 있도록 도와줍니다.도내의 견주들과 동물병원 유기견 보호소에만 배포하여도 실종견이 집에 돌아오는데 큰 도움이 될 것입니다.",,,https://jejudsi.kr/issue/R3DE,,,
jejudsi_RWER,★제주도 지자체운영 공공배달앱 으로 ★재능기부 관련★ 상담 미팅 신청,기타,2020-05-04,기간종료,,"제안 취지(제안에 관심을 가지게 된 이유, 계기)  안녕하세요몇년전 제주도 도민 및 관광객 에게 필요한""앱(혼디모당)""을 만들어서 보유하고있는 제주도민 일반사업자입니다.“혼디모당”은 제가 제주도 상표권 등록 보유 및 음원제작 보유 중이며..만들어놓고.. 운영 조금 하다가 개인적 다른사업이 바빠서..홍보 및 유지관련 문제로.. 현재는 중지시켜 놓은 상태입니다.제가 가지고 있는 “앱”을 ★재능기부★ 할수있는지 상담여부 문의 드립니다.""앱(혼디모당)"" 보유기능 서비스는 모두 무료이며.. 주요앱기능은 아래와 같습니다.도내 배달/음식점 주문 및 검색(배달의민족기능)생활편의기능, 제주도내 모든 공공기관 및 일반업체를 네이버 검색기능처럼 검색 가능(예시. 근처주유소, 소방서, 가까운 소아과. 시청. 이런식으로 검색하면 해당정보가 모두 검색)누구나 무료 구인.구직 업로드 가능(알바천국 기능)누구나 무료 사고,팔고, 나누고 업로드 가능(당근 앱 기능)렌트카 및 항공권 예약, 예매(추진중)그밖의 기타 기능위내용을 ★제주도 지자체운영 공공배달앱 으로 ★재능기부 관련★ 상담 미팅 신청하고 싶습니다.- 제안의 중요성(제안한 사회문제가 중요한 이유)YTN 뉴스 글에서 퍼왔습니다.●**수수료 없는 '공공배달앱' 도입...당신의 생각은?*매우 찬성한다 32%, 찬성하는 편 28%로 나타났고 반대 입장 쪽에선 매우 반대 11.3%, 반대하는 편 12.5%-모른다거나 답하지 않은 경우는 16.1% .정치성향과 상관없이-찬성 여론이 우세했습니다.이번 여론조사는 YTN이 리얼미터에 의뢰해 지난 4월 10일 전국 만 18세 이상 남녀 500명을 대상으로 진행됐으며 표본오차는 95% 신뢰 수준에 ±4.4%포인트입니다.아래 링크 주소로 인터넷에서 확인하실수 있으십니다.★https://www.ytn.co.kr/_ln/0103_202004131438208348★- 기대효과제주도내 모든 공공시설 및 소상공인 뿐만아니라..제주도를 찾아오시는 관광객들에게 많은 도움이 될 것을 확신합니다.또한 국내 자금이 해외로 빠져나가는 것(배민.요기요 등)을 일부 막을수 있으리라 봅니다.“앱”이미지 사진     제 명함 입니다.",,,https://jejudsi.kr/issue/RwEr,,,
jejudsi_15OM,시외 거주 도민을 위한 공공 사진스튜디오,기타,2019-09-05,기간종료,,외지역의 편의시설 및 생활인프라 부족 인지</li></ul><br /><ul><li>사진촬영 위한 공공스튜디오 등 저예산・단기적 문제해결이 가능한 영역에 대한 노력 필요</li></ul><br /><ul><li>단기적 해결이 가능한 공공서비스 수요 추가발굴 및 서비스별 연계방안 도출 등</li></ul>		,". 제안 취지(제안에 관심을 가지게 된 이유, 계기) <문제 제기>- 구좌읍에 거주 당시 이력서 첨부를 위한 증명사진 촬영 수요 발생구좌읍 김녕~하도리까지 사진촬영을 위한 스튜디오를 네이버로 검색, 하지만 단 한 군데도 없었음                   (검색되는 3~4개의 스튜디오는 관광객을 위한 웨딩촬영 스튜디오가 전부 / 증명사진 촬영 거부)결국 약 30km 거리의 성산읍에 위치한 스튜디오까지 이동・촬영                                                                         (비용도 반명함 6컷에 약 2만원 상당으로 비쌈)시외지역에 거주하며 구직준비 등을 하는 청년 또는 취업준비자들은 사진촬영 하나 할 만한 곳이 없을 정도로  너무 열악한 인프라에서 생활하고 있다는 것을 깨달음향후 지역(거점)별 경로당 등을 순회하며 영정사진, 가족사진 등을 촬영・보급하는 형태로 사업 고도화 가능<문제해결 방안>- 시외지역 거주민을 위한 공공 사진스튜디오 운영을 제안함지역 주민자치센터(읍면사무소), 경로당, 농협사무소 등에 간이 스튜디오 집기 비치                                            ※ 큰 공간, 고액의 장비가 아닌 뒷배경용 화이트보드 수준으로서 접이식 등 보관이 용이한 형태의 집기사진촬영은 카메라를 소지한 민간 프리랜서 용역 or 재능기부 등을 통해 진행주민자치센터 홈페이지 및 SNS, 어플 등을 통한 지역(거점)별 수요 접수  주 2~3회 주기로 지역(거점)별 주민자치센터 등 공공 사진스튜디오에서 촬영 진행 현장에서 인화기 통한 사진 인화 / 사진파일 제공 서비스   ※ 비용은 공공에서 일정 부분 부담함으로서 자부담금 최소화2. 제안의 중요성(제안한 사회문제가 중요한 이유)제주도 내에서도 시내권과 달리 청년층 인구 유출 등으로 인한 문제가 심각한 시외권 여러 가지 원인이 있지만 기본적으로 생활인프라 부족에서 오는 불편함이 큰 이유일 것으로 사료됨단순한 사진촬영 수요에 대한 공공부문의 케어라는 측면을 넘어서 보다 적극적인 공공서비스 보급을 위한       주위환기와 노력의 시발점이 될 수 있는 사업이라고 판단됨3. 기대효과시외 생활인프라 소외지역의 사진촬영 수요・공급 미스매칭 해소찾아가는 적극적 공공서비스를 통한 對행정 신뢰도 제고 등","220500※ 해결방안 등록일로부터 60일 이내, 누적 500표 도달한 경우 프로젝트화에 도전합니다. 해결방안 요약서 다운로드  공감투표기간 : 2019-09-05 ~ 2019-12-04공감투표 달성 기간 경과",https://jejudsi.kr/issue/15om,," 공감투표 참여안내  				step1: 제안step2: 문제정의step3: 해결방안제안 내용 참고바라며, 문제정의요약서 및 해결방안요약서는 각 step에서 확인하실 수 있습니다.		",
