id 값,제목,분류,프로젝트 시작,프로젝트 종류,상세 내용,제안의 시작,주요제안(문제정의),해결방안,링크,미추진 사유,공감투표 참여안내,참고자료
jejudsi_1DGN,블록체인 기반 스마트 관광 플랫폼,기타,,프로젝트미추진," 상세 내용[문제정의]  - 코로나 19상황에도 불구하고 많은 관광객들이 제주를 찾는다. 따라서 안전함과 보안을 둘 다 잡은 시스템이 필요하다.  - 관광객 중 확진자의 동선이 공개되면 특정인에 대한 유추가 가능해 개인정보 유출 피해 사례가 속출한다.   - 관광객의 정보를 안전하게 저장할 방법과 동시간대 접촉자들에게만 정보를 제공하는 기능이 필요하다.[해결방안]  - 블록체인 기술을 이용해 보안성을 높인 출입명부를 구현하고, 정보를 지자체나 정부와 공유함으로써      개인에게 정보가 유출되지 않는 플랫폼을 개발한다.  - 코로나 상황 이후에도 제주도민과 관광객이 행복할 수 있게 지역문제와 관광개발을 해결할 수 있는 플랫폼을 구현한다.  - 관광지 및 지역 경제를 활성화할 수 있는 플랫폼을 구축한다.",,,,https://jejudsi.kr/issue/1dgN,,, 관련 자료 
