id 값,제목,분류,프로젝트 시작,프로젝트 종류,상세 내용,제안의 시작,주요제안(문제정의),해결방안,링크,미추진 사유,공감투표 참여안내,참고자료
jejudsi_LJK5,제주 스포츠에 새로운 가치를 제공해줄 제주스포츠배틀 어플리케이션(feat. 배틀박스),기타,,프로젝트완료," 상세 내용프로젝트명 : 제주스포츠배틀 앱 플랫폼 구축 및 컨텐츠 개발 추진 내용 및 성과■ 제주배틀박스 런칭○ 프로토타입 제주배틀박스 개발 및 런칭 - 다운로드 링크 : https://linktr.ee/jejubattlebox○ 주요기능- 제주 스포츠시설 정보 제공(위치기반, 지도, 리스트)- 함께 스포츠할 상대팀 및 용병 찾기- 스포츠배틀 완료 시 기획랜덤박스 리워드 제공■  제휴시설 전용 앱 제주배틀박스 For Members 개발○ 제주 체육시설의 데이터를 즉각 수집 가능한 툴○ 주요기능- 제주체육시설 데이터 수집- 실시간 체육시설 데이터 수정- 랜덤박스 상품 신청 기능                    [구글플레이]                                              [앱스토어] ■ 제주 스포츠시설 데이터 1, 230곳 수집○ 공공체육시설 의 경우 체육공원 ,학교운동장, 체육관 등 각종 구기종목를 즐길 수 있는 시설 데이터를 수집함.○ 사설체육시설의 경우 농구, 축구, 풋살, 족구, 헬스, 야구, 테니스, 탁구, 볼랑, 골프, 헬스, 필라테스, 요가 등 다양한 종목의 데이터를 수집함○ 시설명, 시설사진, 시설오픈마감시간, 휴일 등 도민에게 필요한 정보를 수집함.■ 도내 체육시설 약 20곳과 업무협약 진행○ 제주체육시설 데이터 제공, 이벤트 협업, 향후 서비스 고도화 리워드 협업 등 ○ 제주시, 서귀포시에 구기종목 및 건강운동 사설업체와 협업중- 제주시 : 마인드휘트니스, 신제주유소년풋살클럽, 아르나요가, 코리아펜싱클럽, 일도팀 무에타이킥복싱, 태윤탁구, 팀고리아, 등- 서귀포시 : 리더스풋살구장, 몬스터짐, 더조아짐, 서귀포 FC , 팀루츠코리아, 필라테스폼, 우주헬스타운, 뉴복싱휘트니스, 프로그크린골프 등 ■ 제주도민을 위한 스포츠배틀 컨텐츠 기획 및 추친○ 시범 제주도민 스포츠배틀 (풋살) - 참가신청률 187.5% -약 100명 현장방문-참가팀 모집 하루만에 모집 마감○ 1차 제주도민 스포츠배틀 (풋살)- 만족도 90.6%- 재참여 의사 93% - 참가팀 모집 1시간만에 모집 마감- 참가신청률 225%- 약 80명 현장방문- 신제주 유소년 FC후원 15만원 상당의 *상품 후원○ 2차 서귀포시 거주자 스포츠배틀 (풋살)- 만족도 100%- 재참여 의사 100% - 참가팀 모집 3시간만에 모집 마감- 참가신청률 200%- 약 90명 현장방문- 서귀포 리더스 FC 15만원 상당의 상품 후원- 최초 학교대표출전 (서귀포산업과학고등학교)○ 3차 제주시 거주자 스포츠배틀 (풋살)- 만족도 98.2%- 재참여 의사 96.5% - 참가팀 모집 하루만의 모집마감- 참가신청률 200%- 약 80명 현장방문- 신제주 유소년 FC후원 15만원 상당의 *상품 후원○ 4차 학생 족구배틀 (족구)- 만족도 100%- 재참여 의사 100% - 참가팀 모집 하루만의 모집마감- 참가신청률 150%- 약 60명 현장방문■ 코로나 시기 어려운 스포츠시장을 활성화 시키기 위한 공모전 주최○ 비대면, 소규모 스포츠배틀 컨텐츠 아이디어 공모전○ 우리동네 체육시설 알리기 공모전○ 내 체육시설 매력 소개하기 공모전■ 향후 계획❍ 스포츠배틀 게임화- 가상등급 기능 추가 : 앱 사용자들의 승률에 따라 가상 등급을 부여하고 시각적으로 자신의 실력을 확인할 수 있는 기능- 버튼 하나로 비슷한 등급끼리 배틀할 수 있는 기능- 앱 내 팀을 생성하고 관리할 수 있는 기능- 지역별, 종목별 랭킹을 볼 수 있는 기능- 자신의 등급에 따라 다양한 배틀코인, 포인트를 분배받고 이를 통해 앱 내 상품을 구매할 수 있는 기능❍ 체육시설 예약 기능 및 관리 서비스 추가- 시설을 이용할 수 있고 없는지에 대한 현황파악 기능 추가- 스포츠시설 예약 기능 추가- 제휴시설의 고객관리 서비스■ 기대 효과❍ 제주주민의 스포츠정보의 불편 해결 ,예약에 대한 불편 해결- 기존 제주의 체육시설을 이용하려면 전화, 직접방문, 추첨을 통해서만 예약이 가능하다.이 이슈에 대해서 정말 많은 사람들이 불편함을 느끼고 있다. 이에 레스포제주는 향후[제주배틀박스 For Members]를 활용하여 전화, 직접방문 ,추첨의 과정을 없애고 간단히 앱을 통해 예약도 하고 주휴시설도 파악하고 쉽게 스포츠정보를 접근할 수 있는 환경을 만들어 주민들의 불편을 해결할 것이다.❍ 사회적 비용 감소- 제주는 전국에서 손가락 안에 들 정도로 우수한 체육시설을 가지고 있고 열정적인 생활스포츠 문화를 가진곳이다. 하지만 사람들은 제주의 스포츠적 모습을 잘 알지 못한다. 이에 레스포제주는 제주의 스포츠시설의 우수함을 전국, 전세계에 알리기 위해 다양한 스포츠배틀 컨텐츠 (ex. 풋살, 농구, 서핑 등)를 홍보하고자 하는 스포츠시설에 주최하여 직접적으로 제주의 체육시설을 체험할 수 있는 환경을 만들려고 한다.❍ 지역경제 활성화- 레스포제주는 추구하는 사업은 스포츠에 가치를 더하는 일이다. 제주도민과 제주여행객이 함께 스포츠배틀이라는 주제를 통해 긍정적인 경쟁을 하게 유도하고 그 리워드로 배틀박스라는 랜덤박스를 제공하려 한다. 배틀박스 안에는 제주의 소상공인들의 상품을 체험할 수 있는 체험권 ,할인권 그리고 레스포제주가 기획한 상품들로 구성되어 있다. 이제 스포츠배틀의 참여자는 경기에 대한 보상으로 배틀박스를 받고 스포츠활동 이후에 다양한 제주경험을 느낄 수 있다.❍ 주민만족도 증대- 사람들은 스포츠경기를 매우 원한다. 하지만 현재 제주에는 그들의 욕구를 충족시킬만큼 경기가 많지 않다. 이에 레스포제주는 다양한 스포츠배틀컨텐츠를 연구하여 그들의 욕구를 충촉시킬 수 있는 컨텐츠를 지속적으로 개발하고 추진하려한다. 또한 레스포제주는 향후 승률에 따라 아마추어, 세미프로, 프로페셔널 등 가상의 등급을 넣을 예정이다. 이를 통해 비슷한 가상 등급끼리 스포츠매칭을 도와주고 이에 따른 랭킹, 승급 등 다양한 게임적 경험을 제공한다. 레스포제주는 제주도 뿐만 아니라 국내까지 해당 서비스를 확장하여 전국의 스포츠 동호회, 비동호회, 동아리를 유치하여 국내 생활스포츠를 활성화할 계획이다.",,,,https://jejudsi.kr/issue/LjK5,,, 관련 자료 
jejudsi_17EP,서귀포 청년 뭐하멘?,기타,2022-09-18,기간종료,,"서귀포에 머무는 청년에겐  자기의 고민을 툭 터놓고 이야기 할 수 있는 장이 필요하다 > ""서귀포 청소년들은 왜  부모 형제가 있는 제주도가 아닌 타지에서 생활하기를 희망할까요?""""서귀포 대학생들은 왜 버스를 타고 한 시간이 넘게 걸리는 제주시까지 가서 놀까요?""       서귀포 청년들은혹시라도 나쁘게 비춰져 소문이라도 나면 부모님께 폐가 될까 걱정입니다.주변의 시선으로부터 규정된 나를 가꾸느라, 진짜 속마음을 이야기 할 곳이 없다고 말합니다. 행정이나 기관에서는""스스로 목소리를 내거나 동네 문제를 해결하려고 시도하지 않는 서귀포 청년들""을 답답해 합니다.활동가로 역할하지 않으니, “요즘 청년들은 마을에 대한 애정이나 열정이 부족해”하며 안타까워합니다. 하지만 MZ세대라 불리는 요즘 청년들은스스로의 문제를 모를 때가 있고, 혼자이기에 해결 못 할 때도 있고, 문제가 생기면 어디에 이야기해야 하는지 모를 뿐입니다.기성 세대와 달리 오프라인보다는 온라인 모임을 즐기고, 그 곳에서 친구가 되어 오프라인에서 만나며 네트워킹하기를 선호합니다.**MZ세대 : 1980년대 초~2000년대 초 출생한 밀레니얼 세대와 1990년대 중반~2000년대 초반 출생한 Z세대를 통칭하는 말이다. 디지털 환경에 익숙하고, 최신 트렌드와 남과 다른 이색적인 경험을 추구하는 특징을 보인다.그래서 요즘 서귀포시 청년에게는누구나 쉽게 고민을 이야기하고 서로 응원하며, 더불어 정보를 얻고 즐길만한 콘텐츠를 공유할 수 있는 - ‘서귀포 청년 맞춤형 온라인 공간’이 필요합니다. 청년들이 기관과 행정에 나타나 목소리를 내주길 기다리기보다는,여러 청년들의 이야기를 콘텐츠로 모아볼 수 있는~다양한 청년들의 열정을 끌어낼 수 있는~청년만의 문제를 넘어 사회 문제를 함께 해결하고자 시도하는 계기가 되는~ 그런 공간!!!지금 여러분들의 투표로 시작됩니다. 서귀포시 청년들 좋못사~! ❤️갓생을 저희가 응원합니다!❤️",,,https://jejudsi.kr/issue/17EP,,,
jejudsi_LQY6,마을 소식 너도 알고 나도 알자!,기타,2022-09-02,기간종료,," 우리동네에서 유튜버 무료 교육이 있네? 엇! 지난글이구나”“ 비료지원 사업이 있었다고? 나는 지금 알았는데 벌써 마감이네”“ 지금 마을방송이 나오고 있는데 뭐라고 하는거지 ? ” 이런 경험 누구나 있으실꺼에요.- 나중에 알고보면, 기관 사이트처럼 오픈된곳의 정보인 경우도 있지만, 학부모카페, 마을밴드처럼존재자체를 알지 못하기도 하고, 폐쇄된 채널의 존재를 알아도 내가 가입할 수 없다면 소외감을 느끼기도 합니다. -행정에서 제공되는 정보를 확인하기 위해서는 여러 행정 기관의 홈페이지를 정기적으로 확인해야 합니다.서귀포 시청, 대정읍사무소 공지사항, 행정 기관에서 발송한 문자 등, 마을 주민의 입장에서 마을의 행사,교육 기회, 지원사업 신청 등 마을 정보를 적시에 알지 못해 기간을 놓치거나, 선착순 마감 등으로 불편할때가 있습니다. 정보를 발송하는 곳은 여러 곳이지만 정보가 필요한 사람에게 전달되지 않는 경우가 많이 있습니다. -마을 주민들에게 정보를 전달해야 하는 기관 입장에서도 어려움이 있습니다. 마을 공동체를 기반으로활동하고 있는 대정도시재생현장지원센터에서도 마을 미디어 운영, 문자 송신, 현수막 등 다양한방식으로 주민들에게 소식을 알리고 있지만, 제한된 주민들에게만 한정적 정보가 전달되는 어려움을 제기하고 있습니다.  ○ 대정읍 행정단체 게시판 현황 -대정읍만 하더라도 여러 행정기관에서 정보가 제공되고 있지만, 마을단위 정보는 관리되지 않은 채방치되어 있는 경우가 대부분입니다. 설령 운영된다 하더라도 기관의 활동과 주민 대상 정보가 혼재되어 있어주민 입장에서는 원하는 정보만 찾기란 쉽지 않습니다.방치되어 관리가 되지 않지만 분명 운영은 하고 있습니다.  기관명(위치)공지현황세부 사항 (업로딩 빈도)서귀포 시청시정소식(알림마당)게시판다양한 기관담당자들이 게시판에 작성하는듯함.평일기준 - 1일 적은날은 2건 정도 / 많은 날은 20건이상의 정보가 작성됨.대정읍사무소공지사항특별조치법 관련, 공개자료, 공고글들이 올라오며, 참여자모집등등 다양한 정보 월 10건 이하,대정읍주민자치사이버주민자치센터제주도내 주민자치센터들이 모여있는 사이트마을회으의록 / 운영프로그램 신청이 가능- 운영프로그램->대정읍선택상반기(6개) / 하반기(9개) 프로그램이 있으므로, 2월, 7월 수시로 확인필요신도1리사무소관리 X공지사항 – 마지막글 2011운영프로그램 게시판클릭시->사이버주민자치센터 연결신도2리사무소관리 X“신도3리사무소관리 X공지사항 – 마지막글 2013운영프로그램 게시판클릭시->사이버주민자치센터 연결무릉1리사무소관리 X공지사항 – 마지막글 2014운영프로그램 게시판클릭시->사이버주민자치센터 연결무릉2리사무소정보화마을사이트 연결되어 있음마을알림 2022년 총 21건영락리사무소관리 X공지사항 – 마지막글 2020운영프로그램 게시판클릭시->사이버주민자치센터 연결일과1리사무소관리 X공지사항 – 마지막글 2014운영프로그램 게시판클릭시->사이버주민자치센터 연결일과2리사무소관리 X공지사항 – 마지막글 2016운영프로그램 게시판클릭시->사이버주민자치센터 연결상모1리사무소관리 X공지사항 – 마지막글 2014운영프로그램 게시판클릭시->사이버주민자치센터 연결상모2리사무소관리 X공지사항 – 마지막글 2015운영프로그램 게시판클릭시->사이버주민자치센터 연결상모3리사무소관리 X공지사항 – 마지막글 2016운영프로그램 게시판클릭시->사이버주민자치센터 연결하모1리,하모2리,하모3리, 보성리, 안성리, 신평리, 안성리 등등 비슷한 상황으로 보임.리마다 사이트가 있긴 하지만, 업데이트가 멈춘 상태로 방치되어 있는듯함.대정농협공지사항, 고객게시판, 경조사공지사항 – 매달 2~5건의 정보 있음.고객게시판 – 저금리대출안내, 수강생모집등의 정보가 게시되어 있음.경조사 – 수시로 업데이트 (기존자료 열람X)서부보건소새소식월 10건이상서부 치매 안심센터 알림마당2022년 채용공고 3건 있음대정도시재생현장지원센터공지사항대정센터의 소식과 타기관 소식이 같이 게재되며, 매월 2~4건의 소식 있음 ○ 대정 마을 주민 정보 수신(필요) 현황 (인터뷰 결과)- 마을축제등 마을의 큰 소식인 경우는 현수막, 게시판 등에 장기간 노출하며, 대대적으로 홍보를 하지만 그외의 자잘한 마을 정보들은 그 지역에 오래 거주한 주민, 마을에 관심 있는 주민, 학부모모임, 농부모임 등등의소규모 그룹에서 누가 먼저 정보를 접하게 되면, 지인들에게 정보를 전달하다 보니, 자연스럽게 정보의 공유가한계성을 가지며, 주변에 그런 사람이 없는 사람들에게는 정보가 공유되지 않을 수 밖에 없습니다.  (OOO 센터 담당자) -마을방송 같은 경우 누구나 들어야 하는 내용으로 방송을 하지만, 외출을 하거나, 실내에서 다른일을 하고 있다면 소식을전달 받을수 없으며, 방송이 나왔다는걸 늦게 인지한 경우에도 정보를 전달 받을 수 없습니다(대정읍 마을 주민 A씨)  ○ 해결해야 하는 문제 - 마을 정보가 행정기관별로 파편화되어 있어, 정보를 일일이 찾아야 하는 문제가 있습니다.  - 주민들이 원하는 정보는 교육(주민자치프로그램), 지원금 신청, 마을 내 경조사, 지역 행사 등 주민들이 적시에 알아야 하는 정보입니다. - 다양한 마을 정보를 주민의 정보 우선 순위에 따라 모두에게 전달할 수 있도록 해야 합니다.- 인터넷 검색이 어려운 주민에게도 필요한 정보를 전달 해야 합니다. “어떻게 하면 다양한 기관과 행정에서 여러 채널을 통해 제공되는 마을 소식을 주민들이 편리하고 쉽게 발견할 수 있을까요?  """,,,https://jejudsi.kr/issue/LQy6,,,
jejudsi_RLJP,보이스피싱 예방앱,기타,2022-07-05,기간종료,,"난해  보이스피싱 7744억원에 이른다.  https://newsis.com/view/?id=NISX20220629_0001925246&cID=10401&pID=10400하지만 더욱 교묘해지는  보이스피싱은 검찰, 경찰은 사전예방 보다는 사후 수사에 치중 할 수 밖에 없다.따라서 사전예방을 위해 AI기술과 거짓말탐지 기법 등 그 동안 수집되어온 음성메세지 등 데이터를 활용해  걸려오는 보이스피싱 전화를 구분하는 앱을 깔아서 사전에 예방할 수 있을 것이다. ",,,https://jejudsi.kr/issue/RlJp,,,
jejudsi_103Y,제주도민의 인터넷(스마트폰)을 활용한 국민투표 실시,기타,2022-02-15,기간종료,,"		현재 제주는 제주안심앱을 독자적으로 개발공급하여 코로나19 방역활동에 있어소상공인 분만아니라 방문고객들에게 지대한 편익을 제공하고 있습니다.3월9일 제20대 대통령선거가 실시될 예정입니다.이번 대선에 제주도민은 스마트폰(인터넷)으로 투표할 수 있도록 하여서투표소 설치,투표지 제작,투표소 소방문 기표,검표 등 여러가지 공수를제거함은 물론 인터넷이나 스마트폰으로 본인 공인인증서를 이용한편리한 투표를 실시로 투표참여율을 제고함으로써,제주가 디지탈시대를 선도하는 선진 특별자치도가 되었으면 해서 제안합니다.사회환경은 이미 아날로그시대에서 디지털시대로 전환되었으나,아직도 대통령,국회의원,지방자치단체장 선거는 기존의 투표방식을고수하고 있습니다.현재 스마트폰 보급율이 100%에 이르고 있고,인터넷상 공인인증서로 개개인식별과 안전이 확증되어 금융거래 또한 인터넷거래 위주로 바뀌고 있습니다.이번 대선 국민투표에서  제주도민은 제주특별자치도 국민투표사이트에 인터넷(스마트폰)으로 접속하여 투표할 수 있도록 하였으면 합니다.		",,,https://jejudsi.kr/issue/103y,,,
jejudsi_RP0B,공모전 통합 플랫폼 구축,기타,2021-11-18,기간종료,,"		o 각종 공모전에서 10번의 상을 받은 손모 씨의 무더기 표절 스캔들    베낀 작품으로 ‘공모전 싹쓸이’ 논란    권익위, 제도 개선 위해 대국민 설문    “기관들, 타 공모전 베껴서 진행 문제 표절 검사 프로그램 개발 필요” 지적o 반복적으로 제기되는 공모전 표절, 위변조, 중복응모 문제   (2021년 7월) 77개 행정기관을 대상으로 실시한 조사에서 최근 3년간 공모전 개최 수는 1306건, 응모작은 61만여 건에 달하고 부상금액은 115억원이 넘는다고 밝힘   이 중에서 절반이 넘는 698건의 공모전이 수상 후보작에 대한 표절, 도용, 중복응모 등을 검증하지 않았고   수상 결과를 대외적으로 공개하지 않은 공모전도 163건(12.5%)에 달한다고 함o 문제점은 인식하고 있으나 여전히 부실한 검증 체계     이미 예전부터 공모전 부정 방지 강화를 위한 DB 구축, 플랫폼 도입, 제도 마련에 대해 거론되고 있으나    여전히 검증에 어려움을 겪거나 시도조차 하지 않고 있음o 공모전 통합 플랫폼 구축   - 여러 기관, 민간에서 공모전을 온오프라인으로 진행하고 있음     담당자가 부정 행위에 대한 검증을 하고 싶어도 전국적으로 진행하는 공모전을 검토하는 것은 현실적으로 불가능함   - 공모전 통합 플랫폼을 구축하여 공공기관에서 주관하는 공모전의 경우 필수로 이용할 수 있도록 하고     참가자의 아이디어를 공개, 비공개 형식으로 구분하여 접수를 받되 접수기간이 종료되면 시스템 상에서 자동으로 표절, 중복성에 대한 비율이 표시되는 형태     담당자는 해당 수치를 확인하여 세부 내용을 확인하는 등의 추가 검증 진행   - 유사한 기능을 하는 논문 검증 시스템 등을 참고하여 검증 기능 도입o 공모전 제도 마련   - 제안하는 플랫폼이 제기능을 하기위해서는 공모전 운영안 등을 마련해야 효과적일 것임",,,https://jejudsi.kr/issue/Rp0B,,,
jejudsi_LEJG,무신 걸 먹으코?,기타,2021-09-11,기간종료,,"		√ COVID-19가 지속되면서 직원간의 회식, 가족간의 집안행사, 외식 등 제한이 많아지면서, 배달음식에 많이 의존하는 가정들이 늘고 있다.√ 배달음식도 한계가 있고 더구나 아이들이 있는 집안에서 배달음식이란 뭔가 미안하다.√ 각종 레시피 어플에 의존, 하지만 제주 향토음식을 다룬 어플은 찾아보기 힘들다.√ 이에 제주향토음식레시피를 다룬 어플이 있었으면 좋겠다고 생각하게 되었다.1. 2021. 09월 현재 제주 사회적 거리두기 4단계가 지속이 되면서, 저녁 6시 이후 사적모임 인원 제한으로 외식이 불편해짐2. 배달음식의 한계를 느껴 각종 레시피 어플를 이용하여 직접 요리하게 됨3. 제주의 향토음식(예: 말고기국, 옥돔미역국, 물회, 호박잎국 등) 레시피 어플 찾아보기 힘듬4. 제주만의 향토음식 레시피를 담은 어플로 도내 뿐만 아니라. 도외 에서도 이용가능한 어플을 만들어 제주의 향토음식이 홍보가 되었으면 함5.  제주 내에서도 동일한 향토음식이지만 지역별로 레시피가 다른 점도 흥미로워 나아가서는 지역별 레시피를 넣은것도 좋을 듯하며, 가끔 어플 이용자들이 직접 만들어본 향토음식 인증샷을 통한 이벤트를 실시하여도 좋을 듯 함. ●  ""제주""란 단어로 검색한 경우(a.k.a 앱스토어, 플레이스토어)● ""제주향토음식"" 소개 웹사이트    ",,,https://jejudsi.kr/issue/LeJG,,,
jejudsi_1OXP,식음료 주문시 사용하는 키오스크의 음성지원시스템,기타,2021-08-03,기간종료,,"		⦁인건비 절약 등을 위해 식음료 주문을 키오스크로 전환하는 식당들이 많고 점점 늘어나는데 디지털 약자(노인이나 장애인)들은 키오스크 사용에 어려움을 겪음⦁사회가 점점 고령화 되어 가고 있고, 노인들은 주요 고객층이므로 구매할 때 불편하지 않게 구매자의 입장에서 개발 보급되어야 함.⦁기존의 키오스크는 젊은 사람도 처음엔 어리둥절하니 디지털 약자들은 사용이 어렵고, 그럼에도 키오스크는 대세이기 때문에 더 늘어날 것이므로 음성지원을 개발 보급된다면 디지털 약자들도 어렵지 않게 사용할 수 있을 것임.",,,https://jejudsi.kr/issue/1OxP,,,
jejudsi_AMWQ,장애인 및 소수자 소개팅 플랫폼,기타,2021-07-29,기간종료,,"		제주의 장애인 인구가 매년 증가함에 따라 도내 장애인 수가 올해 제주 인구대비 5.41%인 것으로 밝혀졌습니다.정부의 복지 정책과 봉사단체의 꾸준한 노력으로 장애인들의 생활 불편함이 감소하고 있지만, 비장애인과 결정적인 차이가 있었습니다.바로 자존감이 현저히 낮았다는 점이었습니다. 자신이 장애를 가지고 있다는 사실 때문에 배우자를 만날 수 없는, 즉 자신이 사랑을 나눌 수 없는 존재로 단정 짓는 경우가 허다하기 때문입니다.문제 인식:최근 대한민국 정책브리핑의 보도자료에 따르면 장애인들 중 51.3%만 배우자가 있었고 그중 대부분은 결혼 이후 장애를 가지게 된 경우였습니다.이혼이나 별거 중인 분들도 10%가 넘었습니다.주관적 건강 상태 또한 부정적인 비율이 높은 것으로 밝혀졌습니다.제안:대다수의 장애인은 낮은 자존감으로 인해 연애나 소개팅 경험이 비장애인에 비해 현저히 낮습니다.따라서 장애인들을 위한 소개팅 플랫폼을 만들고자 합니다. 자신의 장애를 의식하지 않고 자신감을 가질 수 있도록 지원하여 더 많은 연애와 결혼의 기회를 제공하고자 합니다. 이후에는 이외의 소수자들도 포함한 서비스로 확장할 계획입니다.필요성:아직도 장애를 가지고 계신 분들이 연애나 결혼을 목적으로 소통할 수 있는 수단이 한정적입니다. '사랑'욕구의 니즈는 분명히 존재합니다.실현 가능성:장애인들을 타겟팅한 소개팅 서비스들이 미국을 포함한 여러 나라에서 호의적인 반응을 얻어내고 있습니다. Whispers4U, Dating4Disabled, Special Bridge 등 대표적인 플랫폼들이 외국에 존재하고 매년 수백에서 수천만 명의 장애인들이 짝을 찾아가고 있습니다.누구든 자신의 결점을 상관하지 않고 사랑을 나눌 수 있는 ""오픈마인드""의 사회를 형성하는 것이 이 프로젝트의 궁극적인 목표입니다.		",,,https://jejudsi.kr/issue/Amwq,,,
