id 값,제목,분류,프로젝트 시작,프로젝트 종류,상세 내용,제안의 시작,주요제안(문제정의),해결방안,링크,미추진 사유,공감투표 참여안내,참고자료
jejudsi_RLOV,제주 맞춤형 중소상공인 살리기 플랫폼,산업・경제,,프로젝트미추진," 상세 내용 플랫폼의 취지   -> 온라인을 통한 홍보를 원하는 많은 중소상공인을 위한 플랫폼 제작.    -> 방문고객을 위한 상품 및 서비스를 파는 것과 더불어 모바일을 통한 구매 판매 서비스 제공.   -> 도민의 불편함과 중소상공인의 문제를 함께 해결하는 서비스.  중소상공인을 위해 온라인 홍보마케팅 제공    -> 온라인 홍보는 도민 뿐만 아니라 타지의 사람들과 연계되어 홍보되는 시스템.   -> 홍보를 하기 위한 인원 외에도 홍보가 진행되어 불필요한 지출발생.   -> 광범위한 지역 혹은 배송을 하는 매장의 경우 혜택을 볼 수 있으나, 제주판매가 기반인 매장에게 손해.   -> 'OMO'는 매장 근처, 단골고객, 원하는 도지역을 선택하여 마케팅홍보 가능. 제주도의 택배문제 해결   -> 'OMO'는 물류 지출이 큰 도외 배송이 아닌, 도민들에게 물건을 제공하는 도내배송 지향.    ->  도내 배송이 가능한 온라인 시장을 중소상공인들에게 제공.   -> 도내 배송이 가능한 환경을 통해 시간소모가 큰 육지물건배송문제 해결.    -> 온라인판매 물품을 제주도 오프라인매매장 물품으로의 대체를 통해 빠른 배송을 지향하는 1일 상권형성.    -> 도내 배송을 통한 추가 택배비의 지출문제 해소. 가맹점의 통합 포인트 형성  대형기업은 자신들의 다양한 브랜드에서 사용가능한 통합포인트를 이용한 마케팅 가능.    -> 브랜드와 대형 기업들에 비하여 다방면으로 사용이 불가능한 단일 포인트제를 사용하는 오프라인 매장.   -> 중소상공인의 연합한 포인트를 통해 다양한 매장의 서비스를 하나의 포인트로 사용가능한 환경 마련.        옷을 산 뒤, 포인트로 커피를 마실 수 있으며, 커피와 음식을 지출로 생긴 포인트로 영화관람가능.    -> 중소상공인 연합 포인트는 중소상공인 뿐만 아니라 도민과 도에 필요한 지역 특화 서비스.  기대효과 3가지   1) 매장이 온라인을 통해 홍보할 수 있는 환경 제공     -> 중소상공인들은 보다 쉽게 온라인 플랫폼을 활용.     -> 도민을 대상으로한 홍보진행을 통해 단골 고객 확보   2) 제주도의 1일 상권 형성     -> 중소상공인들은 제주만의 온라인 시장을 대상으로 사업을 확장.     -> 도민들은 추가 택배비가 없는 제주도의 1일 상권을 이용가능.   3) 제주 통합 포인트 제공     -> 통합된 오프라인 매장의 포인트는 제주도 내에서는 어디서, 무엇을 하더라도 이용가능한 포인트가 될 것     -> 통합된 포인트는 대형 매장과 다른 오프라인 매장만의 차별점으로 작용할 것입니다.",,,,https://jejudsi.kr/issue/RloV,,, 관련 자료 
jejudsi_1OWN,"탐나는전 지류상품권, 모바일 충전까지!!",산업・경제,2022-10-31,기간종료,,"지역 화폐, 탐나는전!! 카드 충전 시 10% 추가 적립 또는 할인과 현금영수증 발행 등 여러 혜택을 제공해 유용하게 사용했지만 예산소진으로 할인혜택이 사라져 안타깝게도 존재감이 많이 약해졌죠 하지만 다음달 부터 다시 여러가지 혜택이 지원된다고 하니 도민으로써 굉장히 반가운 일입니다.   다만 여기서 한가지만 더 추가되면 너무나 좋지 않을까하여 제안합니다.  탐나는 전은 지폐상품권으로도 존재하는데 모바일 충전을 할 수 없다는 점이 아쉬웠습니다.  신세계 상품권의 경우  5만원권 이상부터는 온라인에서 등록하여 사용할 수 있도록  핀번호를 제공하는데 탐나는 전도 이 부분은 도입하면 만족도가 더 높아지지 않을까 생각됩니다.    ",,,https://jejudsi.kr/issue/1owN,,,
jejudsi_RBXJ,관광객과 함께하는 플로깅과 비치코밍 2% 캠페인,산업・경제,2021-11-30,기간종료,,"		천혜의 자연을 가진 우리나라 NO.1 관광지 제주도가 국민들의 많은 사랑을 받고 있습니다.하지만 제주로 유입되는 관광객과 상품이 증가함에 따라 쓰레기 문제가 심각해지고 있습니다.Ⅰ. 문제정의1. 지난 10년간 제주도의 인지도와 선호도가 꾸준히 상승함2. 제주로 유입되는 관광객, 항공편수, 상품이 증가함3. 쓰레기 문제가 심각해지고 있습니다.4. 섬 특성 상 쓰레기를 처리과정이 어렵고 포화상태에 빠짐5. 천혜의 자연을 가진 제주도의 자연을 지키고 지역경제를 계속 성장하기 위한 방법이 필요함6. 지난 6월 제주특별자치도는 '2030 Waste Free IslandWFI' 비전 선포7. 이어서 11월에 출자․출연 10개 기관과 청사 내 '1회용품 플라스틱 제로'에 도전Ⅱ. 해결 방안1. 제주도는 연간 1,000만명 이상의 관광객이 방문합니다. 2. 이들을 활용하여 쓰레기를 일부만 줄여도 수 만톤의 쓰레기를 감소 시키나 폐기물 처리 효율을 높일 수 있습니다.3. 플로깅과 비치코밍을 활용한 쓰레기를 줄이기 입니다.4. 조깅을 하면서 쓰레기를 줍는 플로깅과 비치코밍의 인기가 MZ세대에게 높습니다.5. 자연과 건강을 챙기면서 사회에 기여하는 보람을 느낄 수 있기 때문입니다.6. 인스타그램에 7만건 이상의 해시태크가 올라와 있습니다.7. 제주도와 산하기관이 합동하여 보도자료와 SNS를 통해 캠페인을 시작8. 관광객에게 미션과 경품으로 참여 유도9. 국내 유명 플로깅 인플런서와 유튜브와 캠페인 진행10. 관광객이 캠페인을 보고 자발적으로 플로깅과 비치코밍  후 인증11. 줍줍한 쓰레기 중 깨끗한 쓰레기나 재활용품 선별 → 선별한 깨끗한 쓰레기 중 2%는 자신의 고향으로 들고가서 처리12. 서브 캠페인 : 관광객이 플로깅에 참여하지 않더라도 자신이 제주도에서 소비한 생활폐기물 중 2%는 들고 가기13. 1000만명의 관광객 중 2%만 참여하여도 제주도의 쓰레기 고민을 크게 줄일 수 있습니다.",,,https://jejudsi.kr/issue/RbxJ,,,
jejudsi_A67O,GPS 위치기반데이터를 이용한 자동 상점정보 푸시 광고서비스,산업・경제,2020-09-03,기간종료,,"		※ 제안하신 아이디어에 대한 공감투표 모집을 위해 아이디어 제안서 요약내용을 등록해 주세요.1. 아이디어의 개요[제안배경]▶현재 문제점-현재 오프라인 외식업 자영업자  대다수는 매월 지출되는 마케팅 비용이 부담 됨-지속적 광고 불가-마케팅을 하고 싶어도 못하고 있는 상황 -할 수 없이,블로그 상위노출 광고 주로 이용 비용부담과 효율적이지 못한 부분으로 2개월 3개월 진행 후 해지 지속적으로 반족 되고있는 실정(현재 외식업 자영업자 사장님들의 홍보에 목마른  가장 큰 고민) 1) 외식업 시장에 알맞은 광고 상품 미흡2) 광고료 부담으로 꾸준한 홍보를 하지 못함3) 자기 매장만 우선적으로 노출시켜 주는 광고 시스템 부재[핵심내용]-가맹점 제공시스템: 매장 사진 및 매장상세정보와 메뉴 가격 등 할인 정보를 상세페이지로 제작하고 매장상세주소를 GPS위치기반 시스템에 등록, 등록된 매장주소 10M안에 근접한 거리로 소비자(유저)가 접근할 시 자동알림 (푸시)가 발송 되어 내 매장 홍보를 실시간 자동으로 알려주는 시스템-소비자(유저) : 등록된 음식점(가맹점) 매장정보와 메뉴 가격 할인 혜택 등을 검색하지 않고 또는 앱에 접속하지 않아도 가맹점 등록된 주소에 10M근접한 거리에 접근하면 자동으로 푸시알림서비스 받음, 정확한 매장정보를 찾을 수 있는 편리한 시스템 활용◎자동 푸시 시스템 : 1)지역푸시  2)근접푸시▶문제해결 사항- 매장에서 사용하기 쉬운 광고 시스템 개발- 기존 광고 방식 대비 가장선호 하는 자기 매장 단독 노출시스템을 저렴한 광고료 서비스로 지속적인 광고,홍보 - 저렴한 가맹비로 인하여 소비자(유저)를 내 매장으로 방문 유도 하는 할인 혜택을 상세페이지에 등록마케팅을 진행하여 매출 상승기대 효과 - 외식업 특성상 음식준비 손님 대응 등 여러 가지 바쁜 업무 때문에 홍보에 신경을 쓰지 못하는 부분을 자동 광고 시스템으로 고민 해결-외식업을 하는 영세자영업자에게는 상세페이지 제작시 매출이 올라갈 수 있게 추가 컨설팅을 통하여 가맹점으로 등록 (하단 예시)예시)여러가지 음식들 중에서 이거 하나는 정말 맛있게 잘할 수 있다 하는 메뉴 한가지를 상세페이지에 대표 메뉴를 소비자(유저)에게 눈에 뛰게 부각시켜서 올려주고 나머지 메뉴는 서브메뉴로 자연스럽게 판매가 될 수 있게 상세페이지를 제작하여 광고지원 - 소비자(유저)소비자(유저) 내가 원하지 않는 업종들은 설정 선택을 하여 자동 정보알림 시스템를 내가 원하는 업종만을 푸시 알림서비스 받을 수 있음으로 편리한 시스템으로 제공(하단 예시) 예시)한식 ( ) 중식 ( ) 일식 ( ) 횟집 ( ) 고기집 ( V ) 분식 ( V ) 호프 ( V ) 백반 ( ) 감자탕 ( V ) 등등 다양한 외식업종 중에서 내가 정보를 받기 싫은 업종은 설정 선택 하여 자동 푸시 알림 차단 [차별성]▶서비스의 차별성○ 서비스 관련 BM 특허등록 완료- 특허등록번호: 제10-1935661호- 특허명칭: 위치기반 상점정보 제공시스템 및 방법- 특허등록일: 2018년12월28일- LBS 기반 기술: 위치 처리 플랫폼, 위치 응용 프로그램- LBS 응용서비스 기술: 위치 기반 정보의 제공 기술 및 위치기반 상점정보 제공시스템 및 방법- 사용자가(유저) 가맹점(앞)을 지날 때 실시간 자동푸시 알림기능으로 상점정보와 할인 혜택 정보 제공- 사용자 단말이 이동에 따른 행정구역 내에 진입하는 경우, 이를 사용자 단말에 푸시형태로 진입정보를 알리고,푸시 실행 시 사용자 단말이 위치한 구역 내의 상점정보를 사용자 단말의 위치와 가까운 거리 순으로정렬된 상태로 제공되도록 한 위치기반 상점정보 제공시스템 및 방법2. 실현가능성 및 기대효과[실현가능성]가. 초기 시장진입 전략○ 가입자 유치 및 마케팅 전략- 영업사원에게 인센티브를 부여하여 네트워킹 마케팅방식으로 초기 가맹점 유치- 유통 전략은 초기 순수 영업 사원으로 가맹점 유치 및 소기업 소상공인연합회와 협업- 네이버 파워링크 : 요기두루와 홈페이지를 통한 전국 소상공인 인바운드 상담 유치(매장 사진과 메뉴 등 상세페이지에 들어갈 간단한 자료를 파일로 받아 가맹점 개설)- 직접 전화 영업 : 다음과 네이버 등록 된 소상공인 매장에 전화 상담을 통한 유치(매장 사진과 메뉴 등 상세페이지에 들어갈 간단한 자료를 파일로 받아 가맹점 개설)- 가맹점 유치를 위한 사업설명회 및 온라인(동영상 홍보 유치), 오프라인 세미나 진행 나. 모바일 푸싱 광고 서비스 개발 현황- 현재 앱초기 개발 완료 후 플레이스토어 가등록 테스트 상태- 외주개발사에서 인수인계 후 개발소스 분석을 하여 추가 보완과 앱디자인을 완성 한 후 가맹점 모집을 시작 예정- 외주 개발사에서 인수인계 받은 내용을 내부인력으로 구성된 개발팀에서 인수인계 기술이전 예정- 개발소스 분석 후 추가 보완 및 대용량 서비스를 위한 추가 설계/확장 개발 다. 타켓시장- 소비자 타켓팅 : 20대~50대 소비자들(직장인/일반인)의 일상 생활속에서 점심식사로 인한 오프라인 외식업을 매일 이용 - 목표시장 분석 : 회사 근처에 식당들은 직장인 외에도 일반인들 방문으로 매출 증가를 목표로 매장 홍보에 집중 업종 다양(한식,일식.중식.분식.등등) - 배달업종20만개 을 제외한 외식업 시장 : 60만개 - 시장진입 : 초기5개월간 필드 영업을 통하여 시장확보 영업사원 일인당 일일 신규 가맹점 5개~10개 수월 예상 - 소비자(유저) : 무료 사용 / 가맹점 : 월 가맹비 5만원 동결 부가세별도 (중개수수료 무)▶현재 서울시 영등포 지역 외식업 100군대 매장 방문 하여  삼품 출시 할시 광고만족도 와 가맹점 가입 의사 실제 피드백 받은 결과 70여군대 가맹점 가입 하겠다  30여군대 배민처럼 수수료 올릴 것 같다.출시 하면 다시와라,광고사기 많이 당해서 믿을 수가 없다 ,등등 답변[파급효과]1) (사회/경제 측면) 영세자영업자들의 매출 신장에 기여불경기의 지속으로 폐업률이 증가하고 있는 자영업 시장에 활력소를 제공 합니다. [가맹점에 근접한 거리, 10M에 유저가 접근 할 시, 푸시 알림서비스 100% 실시간 상점 정보 노출] 이라는 신개념 마케팅 광고 기술을 도입, 수수료를 받지 않음으로, 음식점 상점들의 매출 활성화를 실현 할 수 있습니다1인 기업 형태의 고용 창출 실현 가능 2) (고용 측면) 지속적인 사업 확대를 통한 일자리 창출 시대에 부흥 빅데이터 기술을 활용하여, 지식 경쟁력을 통한 일자리를 만들어, 경력단절 청년등의 새로운 지식노동형 일자리 창출을 통해, 사회 공공의 문제인 취업난을 해소하고, 미래지향적 직업분야의 새로운 고용창출을 실현할 수 있습니다. 3) (기술측면) 위치기반 플랫폼 신기술 개발과 기술 활용4차 산업혁명 시대에 걸맞은 푸드테크 기술(실시간 위치기반 기술)을 모바일 앱에 응용한 기술로 국내 및 해외 관련 산업에 기술을 활용하여 국가 경쟁력을 높일 수 있습니다",,,https://jejudsi.kr/issue/A67O,,,
jejudsi_1N9W,중소형호텔 온라인지원및 건물임대관리,산업・경제,2020-04-13,기간종료,,"제안 취지(제안에 관심을 가지게 된 이유, 계기)호텔및원룸 그리고 건물공급 확대에의한 관리및수요맟춤- 제안의 중요성(제안한 사회문제가 중요한 이유)호텔과 펜션들의 공급확대에의한 수요부족과 인건비확대에 의한 경영관리악화그 모든걸 한곳에서 집중관리와 온라인업무담당- 기대효과인건비절약 및 온라인오프라인 집중홍보",,,https://jejudsi.kr/issue/1n9w,,,
jejudsi_ANZ2,소상공인들의 홍보와 지역맟춤 정보제공의 새로운 방안,산업・경제,2020-01-02,기간종료,,"제안 취지(제안에 관심을 가지게 된 이유, 계기)대기업(이마트, gs25등) 에서 타사 광고를 매장의 TV나 모니터로 홍보를 해주는 방식에서 착안.*신문기사. 이마트·삼성전자 손잡고 ‘디지털 사이니지’ 도입 (2017.8.28 경향신문기사)http://news.khan.co.kr/kh_news/khan_art_view.html?art_id=201708281147001대기업들은 계약을 통해, 오프라인으로 송출할 모니터에 타사의 광고나 정보를 송출하는 방식인 방면, 소상공인과 관청이 지역별로 필요한 정보 등을 제공할 수 있는 플랫폼을 만들어 서로 WinWin하는 시스템을 만들 수 있다.소형 PC를 TV뒷면에 부착, 매장마다 대부분 있는 와이파이망을 통하여 각 지역 소상공인들의 매장에 이미 설치되어 있는 TV나 신규설치 TV를 통한 송출이 가능하다. (기존 대기업의 사이니지 상품보다 훨씬 저가의 현실적인 비용으로 시스템 구축을 할 수 있다. 업체당 월 5~7만원 수준으로 업체부담:지원금 비율을 맞춰서  자부담을 낮춰서 지원할 수도 있다.)소상공인의 자사광고는 블로그, 유튜브, 지도앱 등과 연계해서 업장 외 온라인 상에서도 홍보가 가능하게 할 수 있다.소상공인의 홍보영상 + 네트워크 송출용 영상의 결합(예시, 예능프로그램 신서유기에서 사용되는 광고 방법)전체 자사의 영상에 + 추가로 타사의 영상을 넣는다.(오프라인상에 TV를 설치할 소상공인의 참여를 유도할 수 있다.)또는 10~30초 등 영상 플레이 시간을 조절하여 소상공인과 +타사(관청)의 영상을 번갈아가면서 송출할 수 있다.- 제안의 중요성(제안한 사회문제가 중요한 이유)1. 지역마다 다른 정보의 필요성(예,농촌지역에 필요한 정보, 관광지역에 필요한 정보, 도내 전반적인 정보 등)현재 설치된 구형 시민게시대의 포스터와 현수막만으로는 정보전달이 어렵다.보다 구체적이고, 이해가 쉬운 방식으로 정보가 전달되어야 한다.리플렛과 책자를 통한 정보 전달의 방법도 있지만, 소모적이고 그 내용을 전달하는데 시간과 인력이 필요하다.2. 관광객들은 인터넷 검색을 통한 주변관광정보 검색 방법을 주로 사용하므로, 홍보된 상업적인 컨텐츠를 주로 접하게 된다. (축제정보, 마을정보, 숨겨진 명소 등을 상업적이지 않게 알릴 수 있다.)3. 지역 소상공인들의 열악한 홍보수단. 컨텐츠 제작 의뢰, 유지/관리(고비용의 상업적 블로그를 통한 홍보를 많이하나, 그 또한 일부 업체에 한하며, 꾸준히 유지하기가 쉽지 않고, 변형이 어렵다.) 자사 광고를 포함한 정보 전달로 소상공인의 참여를 유도할 수 있다.4. 정보의 사각지대에 있는 이들을 위한 새로운 전달방법- 기대효과업소(식당, 의료시설, 각종 판매점 등)에 홍보용 TV, 모니터를 설치, 송출용 소형PC설치, 사이니지프로그램 통한 송출방식은1. 정보의 넘쳐나는 현재에, 필요한 정보만을 적극적으로 내보낼 수 있고,2. 열악한 홍보환경의 소상공인의 홍보방안이 될 수 있으며, 디지털 송출내용을 웹이나 영상으로 변경이 용이하다.(QR코드 및 다음지도 링크활용)공익적 이미지 향상.3. 지역주민, 관광객들의 관청의 정보를 빠르게 전파할 수 있다.(예, 실종미아 찾기, 태풍경보, 전염병 경보, 교통공사 정보, 주변 관광축제 정보 등 공익을 위한 정보를 제공할 수 있다.) 정보의 사각지대에 있는 이들에게도 정보를 쉽게 전달할 수 있다. 너무 넓지 않은 지역인 제주도의 지역적 특성에 적합한 정보 전달 방식		",,,https://jejudsi.kr/issue/ANZ2,,,
jejudsi_R275,재일동포에게 제주 중소기업·소상공인 제품 보내기,산업・경제,2019-11-12,기간종료,,"제안 취지(제안에 관심을 가지게 된 이유, 계기) 배경  - 제주도 발전에 기여하고 아픈 역사를 간직하는 재일동포에게 고향애를 느낄 수 있는 감성적 정책 실행으로 도민과 함께하는 제주도정 이미지 구축문제점  - 제주 재외동포를 위한 행사(예: 2019 세계 제주인 대회)를 통해 제주 경쟁력 강화에 애쓰고 있으나 고국을 방문하지 못하는 재외동포를 위한 온라인 행사 필요  - 특히 제일동포는 제주 발전에 기여한 역사적(감귤 나무 등) 사실이 많고 일본이라는 지리적 근접성을 이용한 다양한 제주만의 특색을 느낄 수 있는 행사를 진행할 수 있음- 제안의 중요성(제안한 사회문제가 중요한 이유)제일동포의 고향애를 느끼게 해줌과 동시에 제주 제품을 홍보하는 등 제주 경제 활성화에 기여하는 공익사업의 일환으로 제주지역 중소·소상공인의 다양한 제주 특색 상품(마유 및 유자차 등)을 패키지(여러 제품 묶음 상품)로 일본 재일동포에 발송제주도지사 명의로 발송하여 역사적인 기여에 대한 제일동포들의 고마움을 표현하고 한일 관계 개선을 위한 노력에 기여제주제품 홍보 및 수출 판로구축 등 제주지역 기업활동을 위해 제주도정이 적극적으로 노력하여 일자리 창출 등 제주도민에게 실질적으로 필요한 사업 구축에 기여- 기대효과제일동포에게 제주인으로의 자긍심을 느끼는 기회 제공도내 중소·소상공인들의 수출 경쟁력 확보에 기여",,,https://jejudsi.kr/issue/R275,,,
jejudsi_RYZY,2020년 제주 풍력자원 공유화 기금사업에 여러분의 참신한 아이디어를 모집합니다.,산업・경제,2019-08-21,기간종료,,"20년 제주 풍력자원 공유화 기금사업에 여러분의 참신한 아이디어를 모집합니다. 풍력자원 공유화 기금은 제주의 공공자원인 바람을 활용하는 풍력발전사업자의 개발 이익 일부를 기부금으로 받아 지역 에너지 자립과 에너지 복지 활성화 등에 활용되고 있습니다. 청정에너지 분야에 관심 있는 도민 누구나 참여할 수 있으며, ▲재생에너지 개발ㆍ이용ㆍ보급을 장려하기 위한 사업 ▲취약계층에 대한 에너지 지원 사업 ▲재생에너지 교육 및 홍보 지원 사업 등에 대한 다양한 생각을 댓글로 남겨 주세요.(또는, 제주도청 홈페이지 공고 게시판에서 관련 서식을 다운 받아 제안서를 작성해 제출도 가능합니다.) 공공자원인 바람을 활용해 발생한 이익을 도민들이 공유할 수 있도록 조성한 제주 풍력자원 공유화 기금사업에 많은 관심과 참여 바랍니다.",,,https://jejudsi.kr/issue/Ryzy,,,
jejudsi_LB7E,전통시장만 가면 여긴 어디... 나는 누구...,산업・경제,2019-06-28,기간종료,,"제안 취지(제안에 관심을 가지게 된 이유, 계기)전통시장은 물건이 싸고 다양해서 자주 이용하지만 종종 불편한 점이 있습니다. 만약 오늘 저녁으로 꽁치를 먹고 싶다면 수산시장 전체를 돌아다니거나 호박을 사고 싶다면 호박을 파는 점포를 일일이 찾아야합니다. 그리고 어떤 가게나 식당이 문을 닫아도 미리 확인할 방법이 없습니다. 이마트나 홈플러스같은 대형마트들의 어플리케이션을 통해 물건의 위치, 유무, 가격 등의 정보를 실시간으로 제공합니다. 거기다 행사나 할인도 정기적으로 알려주어 소비자의 구매를 돕고있습니다. 만약 전통시장도 대형마트처럼 가게나 물건에 대한 정보를 전달하고 홍보하는 서비스가 있다면 더욱 활성화가 될 것이라 생각합니다. 이를 위해 전통 시장 내에 위치와 가격 정보를 담은 데이터베이스의 구축이 필요합니다.		",,,https://jejudsi.kr/issue/LB7E,,,
