id 값,제목,분류,프로젝트 시작,프로젝트 종류,상세 내용,제안의 시작,주요제안(문제정의),해결방안,링크,미추진 사유,공감투표 참여안내,참고자료
jejudsi_1OVO,게임 요소가 접목된 환경정화활동 디지털 플랫폼 개발 및 운영,환경,,프로젝트완료," 상세 내용    추진 내용 및 성과■ 환경정화활동플랫폼 '제주를 그리다' 개발   -다운로드 링크 :       * 구글 플레이스토어 버전:    https://play.google.com/store/apps/details?id=com.jejubadang     * ios 버전(애플) :    https://apps.apple.com/kr/app/%EC%A0%9C%EC%A3%BC%EB%A5%BC%EA%B7%B8%EB%A6%AC%EB%8B%A4/id1542568598 <로그인 화면> <메인 화면> <미션 등록> <자원봉사 실적 인증을 위한 정보 등록><활동 실적별 등급> <클린하우스 검색 및 길안내 기능> ○ 개발 목적환경정화 활동과 자원봉사를 접목한 어플리케이션 개발일반인들이 자율적으로 환경정화 활동 미션을 수핼 할 수 있는 환경 구축활동한 실적을 확인하고 자원봉사 실적으로 인증하는 시스템 구축 ○ 주요 기능어플리케이션을 통한 환경 관련 자원 봉사 활동 일정 등록참여자 모집 및 소통 기능자원봉사 활동 실적 인증을 위한 비대면 실적 확인 정보 등록 기능 ( 활동 사진,위치정보,시간 데이터 확인 가능)사용자 인근 클린하우스,재활용 도움센터 검색 및 길안내 기능어플리케이션 사용자간 소통 기능그룹 생성, 관리,그룹활동 관리 기능  ■ 향후 계획자원봉사 수요처 등록 진행 하여 원활한 자원봉사 실적 인증 지원 (5월 수요처 등록 진행)단체,학교 대상 홍보 활동을 진행 하여 가입자 수 확보기업 CSR을 연계 하여 사용자를 위한 다양한 지원 및 활동 지원 ■ 기대 효과○ 정량적 측면지역에 방치된 쓰레기 수거 효과 : 1인 1시간 평균 수거량 10kg(예상)×1일 100명 활동 (가정)시 연간 365t의 쓰레기 수거 효과 기대(참여 인원이 많아 질 수록 수거량 증가)방치된 쓰레기 수거로 인한 사회적비용 및 예산 절감의 효과 기대자원봉사 참여 인구 증가 및 활동율 증가 효과, 20~30대 참여율이 높아질 것으로 기대(제주의 자원봉사자 등록 현황은 전체 인구의 22.5%에 달하며, 활동율은 53%로 타지역 대비 2배 높은 활동은 하고 있으나 고령의 활동 인원이 많은 편. 2017년 조사 기준)○ 정성적 측면기존에 수요처의 정해진 시간,장소에서만 가능 했던 자원봉사 활동을 보다 쉽게 참여 할 수 있어 소규모 정화활동의 활성화 도모소규모 정화활동 활성화를 통한 지역 내 쓰레기 문제 해소에 도움이 되며 관광객과 지역 주민들이 함께 하는 활동을 통한 상생하는 사회적 분위기 조성관광객 뿐만 아니라 지역사회에서도 환경에 대한 문제 인식과 인식개선 효과를 기대  ",,,,https://jejudsi.kr/issue/1OVO,,, 관련 자료 
jejudsi_1PME,나의 제주 사랑법 - 블록체인 텀블러 사용,환경,,프로젝트완료," 상세 내용프로젝트명 : 나의 제주사랑법 - 블록체인 텀블러 사용 추진 내용 및 성과 ■ 블록체인 텀블러 제작 및 시스템 개발○ 개인별 텀블러 사용횟수 및 마일리지를 확인할 수 있는 블록체인 텀블러 제작○ 텀블러의 사용 횟수 및 적립, 할인혜택과 마일리지를 사용할 수 있는 시스템 개발블록체인텀블러개인별 사용횟수및 마일리지 확인개인별 블록체인 기록 확인 ■ 도내 카페 20곳과 협약을 맺어 블록체인텀블러 운영○ 블록체인 텀블러를 사용할 수 있게 협약한 카페로, 도내 20곳에 결제시스템을 설치하여 텀블러 사용을 용이하게 함○ 제주시 19곳, 서귀포시 1곳 총 20곳 운영- 제주시 : 어반르토아, 카페띠아모 제주중앙점, 위즈커피,, 백년귤화다, 아꼬앙, 온정떡방, 인샵카페, 콤플렉스, 커피순, 두남자이야기, 르토아베이스먼트, 제로스테이션, 카페다제주, 카페다조천점, 저지에, 토토네, 바이티티카카, 망원동티라미수, N109- 서귀포시 : 카페 메이비* 코로나 19로 인해 폐업 및 임시휴업 등 협약진행 중이던 서귀포 3곳이 참여가 불가능하게 됨  ■ 도내 기관과 블록체인텀블러 운영 활성화○ 도내 기관(스타트업베이, 동문시장 청년몰, 휴플, 에이브레인(w360), 일로와, 제주항공 콜센터)을 대상으로 블록체인 텀블러 사용법에 대한 설명과 협약카페 안내 및 텀블러 배포 ■ 블록체인 텀블러 온・오프라인 홍보물 제작 및 진행○ 포스터, X배너, 전단지(거치대), 인증스티커를 제공하여, 블록체인텀블러에 대한 홍보물을 협약카페별과 도내 기관 등에 부착하여 블록체인텀블러 프로젝트 홍보○ 가치더함, 블록체인텀블러, 제주환경보호, 협약카페 소개 및 협약카페 인터뷰 등 블록체인텀블러 사업과 관련한 다양한 정보를 제공함- 네이버블로그 (https://blog.naver.com/valueadd_jeju), 인스타그램(@howtolovejeju), 페이스북(https://www.facebook.com/valueaddjeju) ■ 시범체험단 운영 및 도민 참여형 이벤트를 통한 참여 활성화○ 블록체인텀블러 시범체험단 운영- 블록체인텀블러 SNS채널(블로그, 인스타그램, 페이스북) 및 타 홍보채널을 통해 진행○ SNS 도민 참여형 이벤트 추진- 블록체인 텀블러 사용 후기 이벤트, 플라스틱제로 선언, 의견수렴 이벤트 등을 진행   ■ 블록체인 텀블러 사용 데이터 축적◯ 블록체인 텀블러 사용횟수는 시범운영기간동안 1,148회를 사용함 기대 효과■ 도민 중심의 1회용품 사용량 감소와 환경보보효과◯ 이번 블록체인텀블러 프로젝트를 진행하면서 텀블러 사용횟수는 1,418회로, 프로젝트기간동안 카페당 약 80회의 텀블러를 사용함◯ 카페별로 1달에 사용하는 1회용 플라스틱용품 사용이 평균 2~300개 내외 사용될 때, 1회용컵, 뚜껑, 빨대, 슬리브, 쓰레기 처리비용, 그에 따른 인건비 비용 등이 감소됨◯ 또한 이만큼 1회용품 쓰레기가 감소하므로 그에 따른 사회적 비용도 절약하게 되며, 이를 제주 전역으로 확대한다면 더 유의미한 효과를 볼 수 있음 ■ 텀블러 사용자의 인식변화 및 생활 개선◯ 사용자의 의견수렴 결과, 텀블러를 평소 사용하지 않았다가, 이번 프로젝트를 통해 텀블러를 사용하게 된 경우가 많음◯ 실제 텀블러를 사용할 때 불편함도 있었지만, 환경보호 등에 대한 인식의 변화와 참여자의 생활에서 텀블러 사용 이후 텀블러 사용량이 증가함을 알 수 있음◯ 기존의 생활방식을 변화한다는 것은 쉽지 않은 일이나, 관심을 갖고 노력을 한다면 가능할 수 있으며, 이러한 변화를 통해 제주 환경에 도움이 될 수 있음 ■ 텀블러 사용을 도내 전역으로 확산하고, 제주의 환경문화로 정착◯ 이번 프로젝트를 통해 텀블러에 대한 불편함을 감수하고서라도 사용하는 제주도민과 제주환경을 위해 텀블러 할인을 제공하는 협약카페들이 증가하는 것을 통해 향후 제주에서는 텀블러를 사용하는 것이 당연하게 하는 분위기가 된다면, 제주만의 환경보호 문화로 자리매김할 것이라 기대함",,,,https://jejudsi.kr/issue/1PmE,,, 관련 자료 
jejudsi_A6OO,"관광객 대상 친환경, 친사회 행동 보상 시스템 구축",환경,,프로젝트완료," 상세 내용1. 사업 주요내용■ 빅게임을 활용한 친환경 행동 보상 게임, 제주 최초 아웃도어 미션형게임, 플레이더 제주“붉은 산호의 수수께끼” 개발“ https://www.jejuolle.org/playthejeju/”“붉은 산호의 수수께끼”는 제주 사람의 발길도 많이 닿지 않았던 길을 걷고 즐기며 퀘스트를 풀어내는 아웃도어 미션 게임모바일 페이지, 미션 키트, 게임이 이뤄지는 장소내의 다양한 지형지물을 활용하여 제시된 퀘스트를 해결함제주 바다를 대표하는 생태 지표의 하나인 붉은 산호를 등장시켜 제주 바다의 환경을 지켰을 때 우리의 보물을 찾을 수 있다는 내용으로 구성함. 세부 시나리오에는 제주 문화를 기반으로 구성, 참여자들이 환경에 대해 다시 생각해볼 수 있도록 구성함.관광객 대상 친환경, 친사회 행동을 제안하고, 관광 프로그램 중에서도 이를 행동으로 유도하기 위해 1) 친환경 관광의 행동 요건 제시(정보 제공 2) 게임 참여시 게임 점수 보상(인지 전환) 3) 게임 중 쓰레기 수거(행동 실행)을 포함함.■ 총 3차(5회)에 걸친 프로토타입 테스트를 초반부터 진행, 사용자 경험 기반의 시나리오 및 게임 동선, 난이도, 게임 몰입도를 확인하여 반영함.■ 네이버 예약 페이지를 연동해, 게임 모객 진행 현재, 무료 프로모션300건과 판매 동시 진행.구매 사이트 “ https://booking.naver.com/booking/5/bizes/329736”원가 19,000 원 => 할인 판매가 9,000 원 적용사업 종료 후에도 KIT 추가 제작을 통해 지속적 운영 계획■ 온라인 및 오프라인 홍보물 제작 및 홍보 진행온라인 홍보용 영상 30초, 1분 제작홍보물 전체 사용할 사진 촬영블로그, 페이스북 카드뉴스 제작관광지 배포용 포스터 및 리플렛 제작■ 고객의 안심 서비스를 위해 제주올레 여행자 센터 안내 담당자 및 콜센터 교육 진행제주 올레 여행자 센터 방문시, 안내 시그니지(TV 홍보물) 노출제주 올레 여행자 센터 담당자 응대 표준화게임 참가 중 안전 사고 발생시, 콜센터 통화 응대 가능■ 서비스 참여 플로우 전반에 친환경 메시지 노출 및 행동 촉구 장치참여전, 관광 준비를 위한 친환경 관광 행위 안내게임 참여시, 친환경 준비에 따른 게임 점수 반영게임 중, 해변가 쓰레기를 주워 클린 하우스 쓰레기통에 버리는 미션 포함게임 종료 후, 설문 연동하여 게임의 의향과 친환경 관광에 대한 공감 설문 기대효과■ 제주지역 첫 시도하는 “아웃도어 방탈출 체험 게임”으로 융복합친환경 관광 프로그램의 첫 시도관광객 행동 변화 친환경 관광 커뮤니케이션을 기반으로 한 관광 프로그램재미와 색다른 경험을 추구하는 20-30대를 주타겟으로 하는 체험형 게임으로, 다양한 제주 문화와의 결합한 컨텐츠 확대의 가능성 확인게임 참여자 대상의 설문 결과, 게임의 만족도도 높을 뿐 아니라 게임 참여후 친환경 관광 정보 제공의 필요와 여행지에서도 쓰레기는 내가 되가져야 가야겠다는 공감이 가장 높게 나타남.친환경 관광에 대한 정보를 관광객에게 제공하는 것은 상당히 긍정적인 효과가 있을 것이라 기대함. 향후, 제주 관광 정책에서도 제주 관광을 안내할 때 이러한 메시지 확대가 동반하는 방침을 정책적으로 실행하기 위한 시범 사례로 고려됨.덧붙여 게임 코스에 속해 있는 #유토피아 갤러리 #솔빛 카페 #60Beans의 협업을 통해 인근 상권이 게임 참여자들로 인해 방문 및 매출 증가가 부수적인 효과로 따라올 것으로 기대함.단, 코로나 19로 인해 관광 시장 위축으로 인해 모객 활성화가 이뤄지지 않아 참여자의 확대는 시간이 소요될 것으로 고려되어, 전반적인 성과 효과는 이후에 발생할 것으로 예상함.",,,,https://jejudsi.kr/issue/A6oO,,, 관련 자료 
jejudsi_1WP3,"마그넷 피싱을 활용한 ""우리 동네 생태낚시방""",환경,2023-01-13,기간종료,," 지난 30년간 인구 감소율 46.7% 유소년층 64% 감소 30년 이상된 노후 건축물 73% 방치되거나 저활용되는 다양한 용천수(두천, 생이물 등) 쓰레기로 몸살을 앓고 있는 마을 갯녹음으로 인한 바다사막화가 가속되고 있는 마을 해안     모두 우리 제주 동한두기 마을의 문제입니다.     2022년 10월 24일 ~25일 이틀간 동한두기 주민과 활동 대학생들이 모여 용담1동 마을의 문제에 대해 논의하였습니다.     학생A : 한두기 마을은 귀여운 고양이도 많고 계곡도 참 이쁜곳인 것 같아요. 하지만 청년들이나 아이를 동반한 가족단위가 놀러올 만한 즐길 거리가 없는 것 같아요.   학생B : 마을 해안에 쓰레기나 노후된 건축물이 마을의 경관을 헤치는 것 같아요.   주민A : 이 동네는 타 동네와 달리 공항인근에 바다와 매우 밀접한(뷰권)상권들을 살려서 관광객을 유치할 수 있지만 인구유출이 심하고 고령화가 진행되고 있어서 마을에 활기가 없어요.   주민B : 우리 마을은 물이 정말 많아요. 용천수와 용연계곡, 마을 앞은 모두 바다입니다. 하지만 잘 관리가 되고 있다는 생각은 안들어요.    “동한두기의 풍부한 물과 해안쓰레기를 활용하여 문제를 해결할 방법은 없을까?”     자석 낚시 들어보셨나요?     마그넷 피싱(magnet fishing)으로 불리는 자석낚시는 최근 몇 년 동안 미국, 프랑스, 영국 등에서 친환경 취미 생활로 떠오르고 있습니다. 큰 비용을 들이지 않고 즐길 수 있고 바다나 강 속에서 어떤 물건이 낚여올지 모른다는 점에서 즐거움을 줍니다. 물 속에 있던 고철을 건져내 수질 정화에도 기여하는 '착한 취미'라고 볼 수 있죠. 끈에 달린 강력한 자석에 붙어나오는 물품에는 칼, 자전거, 권총, 낚시바늘, 총알, 드론 등을 비롯해 간혹 금고나 보물상자가 딸려올라올 때도 있습니다. 자석 낚시꾼 중에는 그저 취미로 이 활동을 즐기는 사람이 있고, 강을 정화하려는 목적을 가지고 지속적으로 참가하는 사람도 있습니다. 지난해 5월 본디 트레져 헌터(Bondi Treasure Hunter)는 자석낚시로 보물이 담긴 상자를 발견해 화제가 되기도 했답니다. 강에서 자석 낚시를 통해 건져올린 장난감 자동차, 마트 카트, 아이폰(사진 Magnet Fishing Devils 공식 유튜브 채널 영상 캡처/뉴스펭귄)     국내에서도 여러 유튜버들이 자석낚시로 다양한 물건을 낚는 콘텐츠를 만들어 점차 유명해지고 있습니다.     큰 비용을 들이지 않고 즐길 수 있는 친환경취미생활 ‘자석낚시’를  우리 마을의 환경과 브랜딩을 위해 활용하면 어떨까요?       ",,,https://jejudsi.kr/issue/1Wp3,,,
jejudsi_ARBN,수직정원을 활용한 제주도형 탄소배출 모니터링 시스템 구축,환경,2022-12-30,기간종료,,,"        현재 우리 지구는 어떤 상황일까요?   - 2022년 뉴스 보도 中 - 전 지구 온실가스 농도 역대 최대…""우린 지금 잘못된 방향으로 가고 있다"" 금년도 대기 속 온실가스 농도는 415.7ppm으로 작년 기록된 최고치 경신 온실가스, 해수면 뿐만 아니라 해양의 열 함량도 계속 증가해 지난해 관측 이래 최고를 기록 해수면 높이 10년째 상승해 1993년 평균 수위보다 97mm 높아지면서 신기록 올해 많은 곳에 1,000년 만에 최악의 홍수, 극히 드문 가뭄, 기록적 폭염이 닥쳤다 1,550종의 해양 포유류 및 해초가 멸종위기, 41%는 기후변화 영향“ 모든 전복과 조개류 중 44% 심각한 멸종위기     우리가 살고 있는 제주도는 어떨까요?       - 2022년 뉴스 보도 中 -  제주도 평균 해수면 높이 50여 년 전보다 23.4cm가량이 높아져  제주지역 연안 해수면 온도 현재 27.6도로 평년 23.7도에 비해 무려 3.9도나 높은 것으로 관측 28도로 상승하면 양식어류 집단 폐사와 같은 피해가 발생할 위험이 높아  기후변화가 부른 ‘극한 여름’…10년새 폭염·열대야 50%나 늘었다 제주도는 폭염일수 1위  ""하늘로 솟았나 땅으로 꺼졌나""…제주서도 꿀벌 '집단 실종'      기후위기가 눈앞까지 닥쳐왔습니다. 한국은 2030년까지 탄소배출 40% 감축과 2050년 탄소중립을 선언했지만 여전히 국제사회에서는 기후 대응 열등생으로 평가받고 있습니다. 기후변화 대응지수가 조사대상 61개국(EU포함) 가운데60위(최하위 점수 64위, 1,2,3위 공석)로 평가될 만큼인데요.    왜일까요? 기후대응을 위한 선언에도 불구하고 여전히 높은 온실가스 배출 수준이 큰영향을 미쳤습니다. 여기에 더해 아직도 진행되고 있는 신규 석탄 화력발전소 건설과 낮은 재생에너지 발전 비중은 한국의 기후위기 대응이 국제적으로낮은 평가를 받을 수 밖에 없는 이유이기도 합니다. 현재 세계는 이 온실가스 배출을 감축하기 위해 다양한 제도를 도입하고 있습니다.그 중 대표적인 것이 “*온실가스 배출권 거래제”의 도입입니다.  *온실가스 배출권거래제란? 할당된 사업장의 실질적 온실가스 배출량을 평가하여 여분 또는 부족분의  배출권에 대하여는사업장 간 거래를 허용하는 제도입니다.       우리나라 또한 해당 배출권 거래제를 도입하고 있습니다.   <법적 근거>저탄소 녹색성장 기본법저탄소 녹색성장 기본법 및 시행령온실가스배출권의 할당 및 거래에 관한 법률 및 시행령온실가스 배출권의 할당, 조정 및 취소에 관한 지침온실가스 배출권거래제의 배출량 보고 및 인증에 관한 지침외부사업 타당성 평가 및 감축량 인증에 관한 지침온실가스 배출권거래제 조기감축실적 인정지침온실가스 배출권의 거래에 관한 고시온실가스 배출권거래제 운영을 위한 검증지침온실가스 배출권거래소신청자격 및 평가기준 등에 관한 고시배출권 유상할당 및 시장안정화 조치를 위한 배출권 추가할당에 관한 규정    제주도는 어떤 노력을 하고 있을까요?   - 2021년 기준 전국 최고 수준의 전기차 보급(6.4%, 2.6만대)을 통해 온실가스 6만 883톤CO2eq(이산화탄소 환산량)가 절감됐으며, 전기차 배터리 산업화센터 운영 등 전기차 전·후방산업을 확대 - 2020년 기준 전국 최고의 신재생에너지 발전(18.2%)을 통해 온실가스 44만 9,383톤CO2eq를 감축했을 뿐만 아니라, 에너지공급이 원활하지 못한 제주가 안정적인 전력수급을 추진하는데 크게 기여 - 제주에너지공사 설립, 전기차 및 스마트그리드 사업 추진을 통해 2,000여 명의 일자리가 창출됐으며, 제주대학교 내 풍력대학원 설립·운영으로 배출된 전문가들은 관련 분야에서 전국적으로 활발하게 활동    이렇듯 도전적인 목표로 탄소중립 프런티어로서 성과도 거둬왔으나 목표 대비 실적 부족, 신재생에너지 확대에 따른 출력제어 심화 등 개선해 나가야 할 부분도 적지 않은 실정입니다. 또한 에너지·수송 분야에 치중된 목표를 1차산업·관광 등 지역 내 근간산업과 생활 전반으로 확장하고, 보다 광범위한 도민공감대 형성이 중요하다는 지적도 제기되고 있습니다.      그렇다면 배출권 거래제와 관련하여 제주도는 어떤 노력을 하고 있을까요?  농업기술진흥원-서부발전-제주도농업기술원이 상생협력사업의 일환으로 배출권거래제 할당대상업체와 42개 농가의 거래를 지원해 이로 인한 농가당 연평균 수익이 603만원에 달했습니다.  저탄소 농업기술을 통해 온실가스를 감축한 농가들이 배출권 거래로 새로운 소득을 쏠쏠하게 올리고 있는 것입니다.       ->그러나 이렇듯 농업분야에 좋은 수익모델 사례가 있음에도 현재 배출권 거래제는 다양한 농업시설별, 작물별 탄소흡수량 산정식을 통해 산정된 값으로 거래가 이루어지며  이 과정에서 값을 도출하기위해 많은 비용의 연구컨설팅비가 필요합니다.    사실상 작은 규모의 민간기업, 소규모 집단, 개인 등이 이 배출권 거래제에 참여할 기회는 없는 셈입니다. 큰 기업, 기관이 거래로서만 참여하는 탄소 모니터링이 과연 잘 이루어질 수 있을까요?이는 사실상 더 큰범위의 탄소 모니터링을 막는 걸림돌이 될지도 모릅니다.   그렇다면 우리는 더나은 환경을 위해 어떻게 해야 할까요? 우선 탄소모니터링 시스템, 플랫폼 등을 만들수 있는 혹은  많은 사람들이 관심을 갖게할 근거를 만들어가야 하지 않을까요?     우리 학교, 사무실, 상가 등의 작은 공간의 공기질을 모니터링하고 관리하는 것부터 시작하면 어떨까요? 많은 소외된 공간(벽)에 수직정원을 조성하고 기존의 탄소 농도와 관리를 통해 줄여갈 탄소 농도를 기록해가며 앞으로 우리나라 곳곳의 탄소농도를 모니터링하는 것입니다.     앞으로의 환경 연구와 활동에 보탬이 될 수 있도록저희 함께 '수직정원을 활용한 제주도형 탄소배출 모니터링 시스템'을 구축하면 어떨까요?         ","149500※ 해결방안 등록일로부터 60일 이내, 누적 500표 도달한 경우 프로젝트화에 도전합니다.  공감투표기간 : 2022-12-30 ~ 2023-02-28공감투표 달성 기간 경과",https://jejudsi.kr/issue/Arbn,,,
jejudsi_LQRB,지역과 환경문제 해결을 위한 '한두기 낚시방',환경,2022-12-12,기간종료,,"        지난 30년간 인구 감소율 46.7% 유소년층 64% 감소 30년 이상된 노후 건축물 73% 방치되거나 저활용되는 다양한 용천수(두천, 생이물 등) 쓰레기로 몸살을 앓고 있는 마을 갯녹음으로 인한 바다사막화가 가속되고 있는 마을 해안     모두 우리 제주 동한두기 마을의 문제입니다.      2022년 10월 24일 ~25일 이틀간 동한두기 주민과 활동 대학생들이 모여 용담1동 마을의 문제에 대해 논의하였습니다.  학생A : 한두기 마을은 귀여운 고양이도 많고 계곡도 참 이쁜곳인 것 같아요.              하지만 청년들이나 아이를 동반한 가족단위가 놀러올 만한 즐길 거리가 없는 것 같아요. 학생B : 마을 해안에 쓰레기나 노후된 건축물이 마을의 경관을 헤치는 것 같아요. 주민A : 이 동네는 타 동네와 달리 공항인근에 바다와 매우 밀접한(뷰권)상권들을 살려서              관광객을 유치할 수 있지만 인구유출이 심하고 고령화가 진행되고 있어서 마을에 활기가 없어요. 주민B : 우리 마을은 물이 정말 많아요. 용천수와 용연계곡, 마을 앞은 모두 바다입니다.              하지만 잘 관리가 되고 있다는 생각은 안들어요. 용천수만 해도 바다에 그대로 버려지고 있거든요.     ""동한두기의 다양한 문제를 해결할 수 있는 방법이 없을까?""  동한두기의 풍부한 물과 해안쓰레기를 활용하여 한두기 마을의 브랜드화와 용담1동 한두기 해안 정화의 필요성 인식을 위한  새로운 컨셉의 ""낚시방""을 운영하면 어떨까?      <낚시방 운영 목표> 지역주민이 직접 참여하고 스스로 관리할 수 있는 활동(일자리)을 제공하고 동한두기 마을의 발전을 도모 환경문제 인식을 확산하고 다양한 연령대의 사람들이 즐길 수 있는 콘텐츠 제공 주민들의 환경 실천이 수익화로 이루어질 수 있는 마을단위 비즈니스모델 수립 도모        지역과 환경을 위한 ""한두기 낚시방"" 많은 관심 부탁드립니다!   ",,,https://jejudsi.kr/issue/LqrB,,,
