id 값,제목,분류,프로젝트 시작,프로젝트 종류,상세 내용,제안의 시작,주요제안(문제정의),해결방안,링크,미추진 사유,공감투표 참여안내,참고자료
jejudsi_A6KK,읍면지역 주변 공원 조성,환경,2023-03-08,진행,,시 및 서귀포시 시내중심에는 공원이 있지만 읍면지역에는 바다와 오름이 있어서 그런진 몰라도 공원이 없습니다.작은 규모의 공원이라도 조성이 된다면 노인분들이나 마을사람들도 이용할 수 있으리라 생각해요  ,,,https://jejudsi.kr/issue/A6kK,,,
jejudsi_1EP2,재난 감시 CCTV 민관협력 모델 제안,환경,2023-02-28,진행,,," 기후변화의 경고, 열대성 저기압은 더 빈번해 지고 강력해 질것 민관협력을 통한 제주도 재난감시CCTV 한계점 보완   올해 4월 기후변화에 대한 국제공동연구팀이 발표한 조사결과에 따르면, 기후변화로 인해 점점 강력해지는 열대저기압에 가장 큰 피해를 볼 수 있는 상위 10개 국가중 한국은 4위에 올랐습니다.태풍을 가장 먼저 가장 크게 맞이하는 제주도는 재난감시에 대한 민감도가 한국에서도 가장 큰 지역이라 할수 있을 것입니다.제주도는 하천감시, 적설감시, 월파감시등으로 구분하여 재난감시 CCTV를 공개하고 있고, 안전총괄관리과 담당자의 답변으로는 이러한 재난감시 CCTV는  최대한 많은 사람들이 볼 수 있도록 장려한다고 합니다. 제주도 이주 11년차, 제주의 구석구석이 좋아 눈으로, 사진으로 제주를 담으며 돌아다니던중, 한라산을 중심으로 동서남북의 날씨가 차이가 크기 때문에, 실시간으로 제주전역의 날씨를 볼수 있으면 좋겠다는 생각을 가지게 되었습니다.  풍광좋은 곳에 위치한 식당 및 카페들과 제휴를 통해 20여개의 cctv를 설치하고, 제주도에서 공개하고 있는 재난감시 cctv와 직접 설치한 cctv를 한눈에 볼수 있도록 작은 웹 사이트를 구축했습니다. 검정색 : 직접 설치한 CCTV 빨간색 : 제주도 재난 감시 CCTV대정쪽 남원쪽이 특히 부족하며, 특정지역 CCTV 장애를 대비하여 좀더 촘촘하게 배치할 필요가 있어 보입니다. 유튜브 채널도 운영하고 있던바, 지난해 제2의 매미라던 힌남노의 북상과 함께 민감도가 높아진 시점에2박 3일 에 걸쳐 윈디닷컴의 예측모델과, cctv들의 영상을 지역별로 돌려보며, 태풍중계 아닌 태풍중계를 하게 되었습니다. 3천명 정도되던 구독자수는 7천명이 넘어섰고, 실시간 시청자수도 1500명에 이르렀습니다. 참여한 시청수의 숫자와 함께 채팅에서 드러난 대중들의 재난상황에 대한 불안감 혹은 불신감은 생각보다 크다고 느껴졌습니다.   그때의 방송을 토대로 꾸준히 가지고 있었던 제주도 재난감시 cctv에 대한 문제점을 몇가지 지적해보고자 합니다. 첫번째, 월파감시, 적설감시, 하천감시, 한라산 등으로 나뉘어져있는 재난감시용 cctv 는 주무부처가 다르기 때문인지, 제주를 전반적으로 둘러보기 위해서는 3곳 이상의 웹사이트를 방문해야만 합니다.  두번째, 노후화 때문인지, 스펙의 문제인지 영상을 통해 보여지는 화질은  개선이 필요해 보입니다 태풍 힌남노 당시 중국의 어느 지역에서 기존 운용중인 cctv를 활용해 유튜브로 송출한 영상 캡쳐본입니다. 화질도 화질이지만, 줌을 통해 먼 바다를 보여주고, 앵글을 돌려가며 최대한 폭넓게 태풍상황을 객관적으로 보여주고 있습니다.  세번째, 특히 서귀포 지역의 감시cctv가 부족합니다.  네번째, 정작 가장 필요한 때 태풍이 가장 근접한 시점에 재난감시용 cctv들은 하나둘씩 먹통이 되기 시작했고, 그 역할을 충분히 해내지 못했습니다.  제주도에서 운용중인 대부분의 cctv들이 줌기능과, 회전이 되는 고가의 장비들로 알고 있습니다. 다만 이 cctv들이 가격만큼 가지고 있는 스펙만큼 제 기능을 제대로 하고 있는지는 의문입니다.   20배줌 이상정도의 줌기능을 탑재한 cctv라면, 굳이 바닷가 바로 앞에 설치해서 해수를 감당케할 필요가 없습니다. 제주도 2천개가 넘어가는 커피숍들을 활용하면, 최소한의 비용으로 최대한의 cctv 설치가 가능합니다. 최소한 긴급한 재난상황 때 만이라도 별도의 방법을 찾아, 재난감시 본연의 역할을 수행할수 있어야 합니다.   제가 가지는 문제의식에 다른분들도 공감하여 30일이내에 100표에 도달하게 된다면, 해결 방안에 대해 좀더 구체적으로 풀어보도록 하겠습니다. 감사합니다.    ","205500※ 해결방안 등록일로부터 60일 이내, 누적 500표 도달한 경우 프로젝트화에 도전합니다.  공감투표기간 : 2023-02-28 ~ 2023-04-29공감투표 하기",https://jejudsi.kr/issue/1EP2,,,
jejudsi_RW3Z,버섯 균사체를 활용한 친환경 소재를 통해 지역 경제 발전과 영농 폐기물 감소,환경,2022-04-08,프로젝트미추진,," 해안가, 마을 길을 걷다 보면 각종 쓰레기들이 버려져 있습니다.  영농 폐기물중에 지자체에서 보조금을 통해 폐비닐과 농약은 회수를 하고 있지만묘종 트레이는 영농 폐기물로 재활용이 안되며 보조금조차 없어 자발적인 회수에 많은 어려움이 있습니다.이런 묘종 트레이를 만드는 과정 또한 플라스틱, 폐수, 탄소 등과 같은 환경오염을 야기합니다.또한 도내에서는 도외에서 구입 후 생성된 쓰레기가 도내에서 태워지거나 몰래 버려지고 있는 상황입니다.이런 묘종 트레이는 생산하는 과정부터 버려지는 과정까지 많은 환경오염을 야기하며 최종적으로 도내 토양오염을 악화시킵니다.		","		-제주도 아름다운 해안가, 마을 길을 걷다 보면 각종 쓰레기들이 버려져 있습니다.  영농 폐기물중에 지자체에서 보조금을 통해 폐비닐과 농약은 회수를 하고 있지만묘종 트레이는 영농 폐기물로 재활용이 안되며 보조금조차 없어 자발적인 회수에 많은 어려움이 있습니다.이런 묘종 트레이를 만드는 과정 또한 플라스틱, 폐수, 탄소 등과 같은 환경오염을 야기합니다.또한 도내에서는 도외에서 구입 후 생성된 쓰레기가 도내에서 태워지거나 몰래 버려지고 있는 상황입니다.이런 묘종 트레이는 생산하는 과정부터 버려지는 과정까지 많은 환경오염을 야기하며 최종적으로 도내 토양오염을 악화시킵니다.제주도 1차산업은 관광업 다음으로 높은 비율을 차지하고 있으며 도외 수출품목 또한 오랫동안 1차산업 품목이였습니다.1차 산업에 영농 폐기물에 대해서 제안을 할것이며 그중 묘종트레이 대해서 지적할것입니다.묘종 트레이는 농가에서 이식 재배를 위한 필수자재 입니다육묘장에서 묘종을 키워 농가에서 이식을 통해 농산물을 생산해 가고 있어 묘종 트레이는 이런 과정에서 필수적인 제품이며 가격 경쟁력도 우수하여 대체품을 마련하기에 어려움 겪고 있습니다.-묘종 트레이는 플라스틱(PP)를 활용하고 있으며 재활용이 되지 않고 생활 폐기물로 분리하여 매립 또는 태워지고 있습니다.21년 도청에서 농협에 위탁 수거를 지원하고 있으며 제주시 7개 농협에서 묘종트레이 수거를 17톤가량을 수거했습니다.추자도,우도,비양도등 들어간 묘종 트레이는 수거 자체도 되지 않고 있으며 이런 문제를 해결하기 위한 노력들이 계속 되고있습니다.		","사체 모종 트레이를 만들기 위해선 버섯 균사체+농업부산물+임업부산물등 필요로 하는데요.이와 마찬가지로 버섯 배지안도 버섯균사체+농업부산물+임업부산물등이 동일하게 들어갑니다.-근데 어떻게 다르냐구요?-약간에 제조방법과 온도,습도를 조절을 통해만들고 있습니다. --이미 1차 산업이 활발한 제주에선 넘치는 재료들입니다, 또한 과거 조선왕실에 납품하였던 표고버섯 또한 제주 특산품으로버섯 또한 제주도에서 유명한 특산물이죠 그렇기에 이미 제주도는 버섯과농업,임업을 하기에 풍부한 자연을 갖고 있습니다.( 출처 : 에코베이티브디자인 )-모종 성형 트레이 부산물을 넣고 배양하여 적절한 온도와 습도를 맞춰줍니다.이렇게 시간이 지난 버섯은 하얗고 단단하게 굳어지는데요. 이런 과정이 7~10일 정도 소요됩니다.( 출처 : 에코베이티브디자인 )이후 버섯을 성형 틀에서 꺼내 추가적으로 2일 정도 추가적으로 키워줍니다, 그러면 공기와 만나 균은 더욱 단단해지는데( 출처 : 에코베이티브디자인 )이 모든 과정이 끝났다면 균사체 트레이를 건조기에 넣고 높은 온도에 건조시켜줍니다. - 그이유는 버섯 균을 없애기 위해서 입니다 -버섯 균이 살아 남아 다른 농수산물에 문제를 일으키면 안되기 때문입니다.하지만 균사체가 구성하고 있는 원재료에 영양분이 죽지는 않습니다. 그렇기 에 나중에 모종과 함께 땅에 심어 거름이 됩니다.마이 앤 마인 시제품-이 모든 과정이 끝났다면 이제 육모장으로가서 모종을 심고 빠르면25~60일 가량을 육묘장에서 모종과 함께 살아갑니다.육묘장에서 출하 준비를 맞춘 균사체 모종 트레이는 이식재배처럼 뽑아서 땅에 심는게 아닌 틀 자체를 부셔 땅에 같이 심어주면 됩니다. -이미 일반 농가에선 다 사용하고 남은 버섯배지를 거름으로써 많이 사용하고 있습니다 -그이유는 위에 말한거와 같이 아직 균사체 트레이는 버섯이 다 흡수하지 못한 영양분이 남아 토양에 좋은 거름이 될것입니다.이렇게 되면 쓰레기도 남지 않고 창고에 쌓이지도 않는 가장 아름다운 모종 트레이가 될것입니다.- MY & MINE 이인원-e3817@naver.comINSTAGRAM : MYANDMINE___OFFICIAL",https://jejudsi.kr/issue/Rw3Z, 미추진 사유,524500공감투표500표 달성되어 프로젝트화에 도전합니다.  공감투표기간 : 2022-04-08 ~ 2022-06-07공감투표 달성 기간 경과,
jejudsi_AR65,제주 폐 플라스틱을 활용한 제품 제작과 더불어 도내 환경 캠패인 순환 구조 확립,환경,,프로젝트완료," 상세 내용※ 추진 방향가. 캠페인 협업◦ 도내 대학과의 캠페인 협업을 기획◦ 제주대학교 링크플러스사업단을 통해 봉사 시간 및 물자 지원 확보◦ (사)제주올레, (사)청년제주와 인적자원, 행사 기획 구체화 방안 논의◦ 올레길, 해안 정화 작업 등을 실시하기 위해 수거 업체 파악 및 현장 답사 기획◦ 월별 정화 작업을 실시하며 추가적으로 지역 활성화를 위한 연계 활동 모색 나. 수거 체계◦ 제주개발공사와 제주 지속가능발전 협의회 ‘제주 플라스틱 분리 배출 실천 캠페인’ 사업- 도내 32개의 참여 단체의 연간 수거를 총 담당하는 협업 기업으로 선정- 자체 창고를 통해 수거된 병뚜껑을 무상으로 활용할 수 있도록 수거 체계 구축 ◦ 제주대학교 병뚜껑 수거함 배치- 제주대학교 신관 및 단과대 병뚜껑 수거함 배치를 통해 발생되는 병뚜껑 수거 체계 마련- 수거 할당량 도달 시 제주개발공사 장학금 후원- 추가적으로 자체 장학금 지원 예정  독립적 수거 체계 기획- 기존 참여 단체와 캠페인 종결 이후 자체적인 리워드 제공을 통한 재참여 여부 파악 중- 도내 호텔 관련 기업과의 mou를 통한 도내 숙박시설 수거 체계 마련 논의 중- 분리배출 교육 캠페인을 재편성하여 수거 체계 확보 및 환경 교육 방안 제시 다. 제품 기획, 제작캠페인- 수거 – 제품 기획 – 가공 – 매입 – 외주 생산 – 검수 – 홍보 – 포장 - 판매 순으로 진행 캠페인 : 제주대 병뚜껑 분리배출 캠페인, 제주개발공사, 제주 플라스틱 분리 배출 실천 캠페인수거 : 도내 30개 참여 단체 방문을 통해 수거 이후 원재료 확보제품 기획 : 제품의 제작 가능성, 단가, 타당성 파악 후 디자인 기획가공 : 버클 - 우진 플라스틱, 시트 – 자체 제작, 챙심 – 신영 하이텍매입 : 원단 - 뷰 컴퍼니, 아트임팩트외주 생산 : 아트 임팩트, 대도모자, 프로젝트 1907, 데일리스티치 등 소량 외주 제작 가능 업체 확보검수 : 도담스튜디오홍보 : 인스타그램, 와디즈 펀딩포장 : 리그라운드판매 : 네이버 스토어, 와디즈 펀딩 라. 홍보, 판매◦ 제품 생산 이후 홍보, 판매의 경우 자체 유통 채널 활용 (네이버스토어)◦ 일련의 사업화 과정을 영상, 사진 등 기획 자체 스토리 텔링을 통한 크라우드 펀딩 진행◦ 제주대학교, 한라대학교, 링크플러스 사업단 등의 자체 홍보 채널 활용 바이럴 마케팅 진행마. 후원금 마련◦ 홍보, 판매 이후 생산 소요 비용 제외 매출 일부를 후원기금으로 조성◦ 제주대 병뚜껑 수거 캠페인에 따라 개발공사 자체 장학금 지원◦ 제주대 병뚜껑 수거량 일정 무게 달성 시 자사 자체 장학금 추가 지원※ 프로젝트 수행가. 캠페인① 6월 - 환경의 날 캠페인- 제주도청, 제주지속가능발전협의회 주관 환경의 날 행사 개최 (21.06.05)- 주요 내용 : 업사이클 제품 전시, 판매 업체로 선정- 행사 일시 : 21.06.05 (10:00 ~ 17:00)- 참여 인력 : 총 30명 참여(지속가능발전 협의회 일동, 제주랩, 도담스튜디오, 클린보이즈 클럽 등)- 행사 장소 : 제주시 민속 오일시장 도두동 재활용센터- 행사 결과 : 약 500명 인원 행사 관람 및 재활용 체험 ② 7월 - 봉그러가게 플로깅 캠페인- 제주지속가능발전협의회 주관, 제주환경 운동연합 주관 캠페인 (21.07.17)- 주요 내용 : 플로깅 참여 업체로 선정- 행사 일시 : 21.07.17 (14:00 ~ 18:00)- 참여 인력 : 총 30명 참여(지속가능발전 협의회 일동, 보나바, 도담스튜디오, 봉그젠, 지구별 약수터 등)- 행사 장소 : 제주시청 인근- 행사 결과 : 시청 인근 쓰레기 수거 후 분리 배출 진행 ③ 8월 – 업사이클 수거함 전달- 주요 내용: 폐플라스틱 활용 업사이클 수거함 제작 및 배포 (21.08.20)- 행사 일시 : 21.08.20- 주관 업체 : ㈜도담스튜디오- 행사 결과 : 수거 참여 32개소 업체 전달 및 배포, 환경 교육 진행 ④ 9월 제주국제협력센터 환경 교육 - 주요 내용 : 국제협력센터 환경관련 교육 진행 (21.09.24)- 행사 일시 : 21.09.24 (10:00 ~ 12:00)- 주관 업체 : ㈜도담스튜디오참여 인력 : 국제협력센터 협력 제주대학교 재학생 15명 참석행사 내용 : 제주도내 환경 선순환, 도담스튜디오 소개 및 지속 가능성 강의 진행 ⑤ 10월 녹색 연구자 라운지 환경 캠페인 - 제주대학교 LINC +사업단 주관 녹색 연구자 라운지 환경 캠페인 (21.10.13 ~ 10.15)- 주요 내용 : 전시 참여 업체 선정- 행사 일시 : 21.10.13 ~ 10.15 (10:00 ~ 18:00)- 참여 인력 : 총 10명 참여 (후후, 도담스튜디오, 미간 등)- 행사 장소 : 한라마을 작은 도서관행사 결과 : 2일간 전시 참여 및 참여자 대상으로 환경 관련 교육 진행⑥ 제주관광공사 ‘세상에 이런 트립’- 주요 내용 : 제주관광공사 ‘세상에 이런 트립’ 환경 행사 주관 업체 선정 (21.09.24)탄소 제로 여행을 지향하는 플로깅 정화 캠페인행사 장소 : 제주공항 - 이호방면- 행사 일시 : 21.08月 ~ 10月 진행참여 인력 : 총 45명 환경 관련 인플루언서 참여- 주관 업체 : 제주관광공사, 한국공항공사 제주지사, 티웨이항공, 이호동 어촌계, 푸른컵, 지구별약수터, 지구별가게, 도담스튜디오행사 결과 : 업사이클 제품 제작 및 납품, 온 오프라인 마케팅 공동 참여 진행⑦ 산학 엑스포 - 주요 내용 : 산학엑스포 제주대학교 대표 업체 선정, 업사이클 제품 전시 (21.10.20)- 행사 일시 : 21.10.20 ~ 10.21 진행- 행사 장소 : 수원 컨벤션센터참여 인력 : 총 300개 기관, 대학 참여행사 결과 : 산학엑스포 제주대학교 대표 창업 기업으로 선정,업사이클 제품 전시 및 환경, 업사이클 관련 교육 진행 ⑧ 강원진로교육원 환경 교육- 주요 내용 : 강원진로교육원 학생 대상 환경, 지속가능성 교육 (21.10.20)- 행사 일시 : 21.10.20- 행사 장소 : 휘슬락호텔참여 인력 : 강원도 소재지 청소년 15명, 강원진로교육원 일동행사 결과 : 청소년 대상 환경, 지속 가능성 관련 강의 진행 및 Q&A 진행 나. 수거- 제주개발공사, 제주지속가능발전협의회와 함께 병뚜껑 수거 캠페인 추진- 도내 32개 단체의 병뚜껑 수거 캠페인을 진행- 본 캠페인의 수거, 재활용 총괄 업체로 선정- 연간 8톤 이상의 수거량 확보- 제주대학교 협업을 통해 수거 체계 확산- 각 참여 단체에서 연간 200kg 수거 시 삼다수 장학재단을 통해장학기금 조성 및 후원 예정  다. 제품 제작 ① 데일리스티치협동조합데일리스티치협동조합과 도내 생산 및 유통을 목표로 협업을 진행매듭백, 호보백, 복조리백 3종류 각 2개 색상으로 총 6품종 생산 진행사업기간 내 성과목표에 따라 품종당 20개 총 120개 생산가방 제작 이후 크라우드 펀딩 진행 및 후원 기금 사용 예정 (21.12) ※ 일정21.07.20 – 데일리스티치 협동조합 사전 미팅21.08.05 – 리사이클 폴리에스테르 원단 매입21.08.16 – 가방 샘플 파악 및 세부 사항 조율21.09.24 – 샘플 제작 및 사진 촬영 진행21.10.10 – 텀블벅 크라우드 펀딩 스토리 기획21.10.20 – 크라우드 펀딩 오픈 예정 신청21.10.27 – 크라우드 펀딩 시작21.11.17 – 크라우드 펀딩 종료 및 발송 준비21.12 – 후원 기금 전달② ㈜서진상사주식회사 서진상사와 리사이클 원단 방직 및 의류 생산 협업을 진행리사이클 폴리에스테르 원사와 면의 적정 배합을 통한 원단 생산4품종 티셔츠 각 500개, 총 2,000벌 제작- 도내 기업, 제주유나이티드 등 기업 로고 디자인 이후 납품 진행 조율 중 (21.12) ※ 일정21.07.15 – 리사이클 티셔츠 제작을 위한 사전 미팅21.08.03 – 리사이클 폴리에스테르 원사를 통한 방직21.08.15 – 원단 방직 이후 염색 공정 돌입21.08.17 – 원단 스와치를 통해 생산 진행 여부 전달21.08.21 – 샘플 티셔츠 제작 및 라벨 등 세부 사항 조율21.08.26 ~ 09.20 – 의류 재단, 봉제, 라벨 작업 진행21.09.21 – 발송 준비 및 화물 일정 조율21.09.23 – 배송 완료 라. 판매① 텀블벅 크라우드 펀딩데일리스티치협동조합과 협업을 통한 제품 크라우드 펀딩 진행매듭백, 호보백, 복조리백 3종류 각 2개 색상으로 총 6품종 생산 진행가방 제작 이후 크라우드 펀딩 진행 및 후원 기금 사용 예정 (21.12) ※ 펀딩 일정21.08.16 – 가방 샘플 파악 및 세부 사항 조율21.09.24 – 샘플 제작 및 사진 촬영 진행21.10.10 – 펀딩 공개 예정일21.10.27 – 펀딩 시작일21.11.17 – 펀딩 종료일21.11.24 – 결제 종료일21.12.05 – 리워드 후가공 및 포장21.12.05 ~ 펀딩 종료 후 후원 기금 전달 3.2 프로젝트 협업 및 홍보가. 협업 진행① 데일리스티치협동조합 – 업사이클 가방 제작협업 내용 : 사회적 기업 데일리스티치 협동조합과 업사이클 가방 공동 제작 협의역할 분담 : 도담스튜디오 – 원단 매입, 라벨 제작, 펀딩 스토리텔링 기획 및 판매데일리스티치 – 가방 봉제 및 디자인 작업, 펀딩 이후 제품 납기※ 일정공동 제작에 따른 사전 미팅 (21.07.20)업사이클 원단 매입 및 라벨 제작 (21.08.05)가방 샘플 파악 및 세부 사항 조율 (21.08.16)제품 사진 촬영 (21.09.24)스토리 기획 후 크라우드 펀딩 진행 (21.10.20 ~) ② 생산기술연구원 – 폐플라스틱 소재 개발협업 내용 : 금형 제작, 플레이크 생산, 재활용 챙심 양산, 소재 테스팅 금형 제작 : 챙심 제작을 위한 금형 틀 제작플레이크 생산 : 자사 분쇄기를 활용한 플레이크 생산재활용 챙심 양산 : 생산기술연구원 내 대형 사출기를 통한 양산소재 테스팅 : ‘PE, PP, PET’에 다른 소재를 배합 ③ 블랙야크 & 우진플라스틱 – 새로운 플라스틱 제품군 생산협업 내용 : 우진플라스틱과 생산기술연구원을 통해 버클 모델링 및 시사출, 소재 테스팅 진행 ④ 한라산 소주 – 도내 폐플라스틱을 활용한 캠핑박스 굿즈 제작협업 내용 : 한라산 소주의 굿즈를 도내 대구플라스틱과 함께 캠핑박스 협업 제작문제점 : 캠핑박스의 업사이클 선순환 구조 구축의 난항으로 캠핑박스에서 미니어처 박스로 협의 중 ※  결과물 활용방안□ 도내 30개 거점을 통해 연간 폐자원 수거 데이터 포집 및 제주 데이터 허브 등록◦ 동부권, 서부권, 서귀포권 3가지 권역으로 32개 단체가 참여 중◦ 이를 거점으로 수거되는 양과 시기를 데이터화 하여 지역별 수거량 파악◦ 연간 데이터를 파악하여 제주데이터허브 수집 데이터 게시 (21.12월)◦ 연간 수집 데이터 업로드 (매년 12월) □ 데이터 수집을 통한 유의미한 데이터 활용 방안◦ 수거, 재가공에 발생되는 비용 파악 후 제품 제작 시 사출 비용을 파악하고자 함.- 수거량 대비 재가공 시 발생되는 공임비, 사출비 측정◦ 수거량이 적은 지역의 원인을 파악하고, 이를 개선할 수 있는 솔루션을 제시- 권역별 수거량 파악◦ 인구 밀집, 지역별 수거량에 따라 원활한 수거 동선 파악- 지역별 수거량에 따라 수거 일정 시기, 일정 재조율◦ 수거 이후 재활용률에 따라 소각, 탄소배출권에 따른 경제적 이익 산출- 탄소배출권, 소각에 투입되는 비용대비 경제적 이익, 혹은 사회적 훼손 비용 파악□ 생산기술연구원과의 협업◦ 생산기술연구원 제주지부와 협업을 통해 소재 배합, 사출 테스트 진행◦ 생산 프로세스 상 소재 가공 및 사출 생산을 제주에서 해결할 수 있도록 함.◦ 도내 기업과 협업을 통해 제주에서의 공동 제작물 성과를 도출하고자 함 □ 도민이 참여할 수 있는 메이커 스페이스 조성◦ 도내 메이커 스페이스 ‘팹랩 제주’ 업무 협약 체결 예정 (21.11)◦ 메이커 스페이스 위탁 운영을 통해 청년, 환경과 관련된 교육과 시제품 제작,다양한 도내 유관기관과 함께 양질의 행사를 진행하고자 함. 나. 기대효과1) 환경적 가치□ 제주 폐자원을 활용한 선순환 구조◦ 실제 제주 폐자원을 활용한 제품을 기획, 제작◦ 이를 통해 수거, 분쇄, 가공, 판매 등 일련의 과정에서의 선순환 구조 확립 2) 사회적 가치□ 사회적 가치 실현의 솔루션 제시◦ 사회적 책임을 가져야 할 기관, 기업에 페자원을 활용◦ 이를 제품으로 기획하여 사회적 책임을 실현할 수 있는 솔루션 제시",,,,https://jejudsi.kr/issue/Ar65,,, 관련 자료 
