id 값,제목,분류,프로젝트 시작,프로젝트 종류,상세 내용,제안의 시작,주요제안(문제정의),해결방안,링크,미추진 사유,공감투표 참여안내,참고자료
jejudsi_A6KK,읍면지역 주변 공원 조성,환경,2023-03-08,진행,,제주시 및 서귀포시 시내중심에는 공원이 있지만 읍면지역에는 바다와 오름이 있어서 그런진 몰라도 공원이 없습니다.작은 규모의 공원이라도 조성이 된다면 노인분들이나 마을사람들도 이용할 수 있으리라 생각해요  ,,,https://jejudsi.kr/issue/A6kK/PROPOSE,[],,
jejudsi_1EP2,재난 감시 CCTV 민관협력 모델 제안,환경,2023-02-12,진행,,"  기후변화의 경고, 열대성 저기압은 더 빈번해 지고 강력해 질것 민관협력을 통한 제주도 재난감시CCTV 한계점 보완   올해 4월 기후변화에 대한 국제공동연구팀이 발표한 조사결과에 따르면, 기후변화로 인해 점점 강력해지는 열대저기압에 가장 큰 피해를 볼 수 있는 상위 10개 국가중 한국은 4위에 올랐습니다.태풍을 가장 먼저 가장 크게 맞이하는 제주도는 재난감시에 대한 민감도가 한국에서도 가장 큰 지역이라 할수 있을 것입니다.제주도는 하천감시, 적설감시, 월파감시등으로 구분하여 재난감시 CCTV를 공개하고 있고, 안전총괄관리과 담당자의 답변으로는 이러한 재난감시 CCTV는  최대한 많은 사람들이 볼 수 있도록 장려한다고 합니다. 제주도 이주 11년차, 제주의 구석구석이 좋아 눈으로, 사진으로 제주를 담으며 돌아다니던중, 한라산을 중심으로 동서남북의 날씨가 차이가 크기 때문에, 실시간으로 제주전역의 날씨를 볼수 있으면 좋겠다는 생각을 가지게 되었습니다.  풍광좋은 곳에 위치한 식당 및 카페들과 제휴를 통해 20여개의 cctv를 설치하고, 제주도에서 공개하고 있는 재난감시 cctv와 직접 설치한 cctv를 한눈에 볼수 있도록 작은 웹 사이트를 구축했습니다. 검정색 : 직접 설치한 CCTV 빨간색 : 제주도 재난 감시 CCTV대정쪽 남원쪽이 특히 부족하며, 특정지역 CCTV 장애를 대비하여 좀더 촘촘하게 배치할 필요가 있어 보입니다. 유튜브 채널도 운영하고 있던바, 지난해 제2의 매미라던 힌남노의 북상과 함께 민감도가 높아진 시점에2박 3일 에 걸쳐 윈디닷컴의 예측모델과, cctv들의 영상을 지역별로 돌려보며, 태풍중계 아닌 태풍중계를 하게 되었습니다. 3천명 정도되던 구독자수는 7천명이 넘어섰고, 실시간 시청자수도 1500명에 이르렀습니다. 참여한 시청수의 숫자와 함께 채팅에서 드러난 대중들의 재난상황에 대한 불안감 혹은 불신감은 생각보다 크다고 느껴졌습니다.   그때의 방송을 토대로 꾸준히 가지고 있었던 제주도 재난감시 cctv에 대한 문제점을 몇가지 지적해보고자 합니다. 첫번째, 월파감시, 적설감시, 하천감시, 한라산 등으로 나뉘어져있는 재난감시용 cctv 는 주무부처가 다르기 때문인지, 제주를 전반적으로 둘러보기 위해서는 3곳 이상의 웹사이트를 방문해야만 합니다.  두번째, 노후화 때문인지, 스펙의 문제인지 영상을 통해 보여지는 화질은  개선이 필요해 보입니다 태풍 힌남노 당시 중국의 어느 지역에서 기존 운용중인 cctv를 활용해 유튜브로 송출한 영상 캡쳐본입니다. 화질도 화질이지만, 줌을 통해 먼 바다를 보여주고, 앵글을 돌려가며 최대한 폭넓게 태풍상황을 객관적으로 보여주고 있습니다.  세번째, 특히 서귀포 지역의 감시cctv가 부족합니다.  네번째, 정작 가장 필요한 때 태풍이 가장 근접한 시점에 재난감시용 cctv들은 하나둘씩 먹통이 되기 시작했고, 그 역할을 충분히 해내지 못했습니다.  제주도에서 운용중인 대부분의 cctv들이 줌기능과, 회전이 되는 고가의 장비들로 알고 있습니다. 다만 이 cctv들이 가격만큼 가지고 있는 스펙만큼 제 기능을 제대로 하고 있는지는 의문입니다.   20배줌 이상정도의 줌기능을 탑재한 cctv라면, 굳이 바닷가 바로 앞에 설치해서 해수를 감당케할 필요가 없습니다. 제주도 2천개가 넘어가는 커피숍들을 활용하면, 최소한의 비용으로 최대한의 cctv 설치가 가능합니다. 최소한 긴급한 재난상황 때 만이라도 별도의 방법을 찾아, 재난감시 본연의 역할을 수행할수 있어야 합니다.   제가 가지는 문제의식에 다른분들도 공감하여 30일이내에 100표에 도달하게 된다면, 해결 방안에 대해 좀더 구체적으로 풀어보도록 하겠습니다. 감사합니다.    ",,,https://jejudsi.kr/issue/1EP2/PROPOSE,[],,
jejudsi_RW3Z,버섯 균사체를 활용한 친환경 소재를 통해 지역 경제 발전과 영농 폐기물 감소,환경,2022-04-08,프로젝트미추진,,"				-제주도 아름다운 해안가, 마을 길을 걷다 보면 각종 쓰레기들이 버려져 있습니다.  영농 폐기물중에 지자체에서 보조금을 통해 폐비닐과 농약은 회수를 하고 있지만묘종 트레이는 영농 폐기물로 재활용이 안되며 보조금조차 없어 자발적인 회수에 많은 어려움이 있습니다.이런 묘종 트레이를 만드는 과정 또한 플라스틱, 폐수, 탄소 등과 같은 환경오염을 야기합니다.또한 도내에서는 도외에서 구입 후 생성된 쓰레기가 도내에서 태워지거나 몰래 버려지고 있는 상황입니다.이런 묘종 트레이는 생산하는 과정부터 버려지는 과정까지 많은 환경오염을 야기하며 최종적으로 도내 토양오염을 악화시킵니다.제주도 1차산업은 관광업 다음으로 높은 비율을 차지하고 있으며 도외 수출품목 또한 오랫동안 1차산업 품목이였습니다.1차 산업에 영농 폐기물에 대해서 제안을 할것이며 그중 묘종트레이 대해서 지적할것입니다.묘종 트레이는 농가에서 이식 재배를 위한 필수자재 입니다육묘장에서 묘종을 키워 농가에서 이식을 통해 농산물을 생산해 가고 있어 묘종 트레이는 이런 과정에서 필수적인 제품이며 가격 경쟁력도 우수하여 대체품을 마련하기에 어려움 겪고 있습니다.-묘종 트레이는 플라스틱(PP)를 활용하고 있으며 재활용이 되지 않고 생활 폐기물로 분리하여 매립 또는 태워지고 있습니다.21년 도청에서 농협에 위탁 수거를 지원하고 있으며 제주시 7개 농협에서 묘종트레이 수거를 17톤가량을 수거했습니다.추자도,우도,비양도등 들어간 묘종 트레이는 수거 자체도 되지 않고 있으며 이런 문제를 해결하기 위한 노력들이 계속 되고있습니다.		",,,https://jejudsi.kr/issue/Rw3Z/PROPOSE,[],,
jejudsi_AR65,제주 폐 플라스틱을 활용한 제품 제작과 더불어 도내 환경 캠페인 순환 구조 확립,환경,2021-04-07,프로젝트완료,,"				- 제주를 좋아하고 바다를 좋아하는 청년들이 모여 제주도의 환경이라는 카테고리 속에서 쓰레기 매립장 포화, 해양 쓰레기, 미흡한 쓰레기 분리 배출 등 다양한 문제를 다양한 관점에서 관찰하고 조금씩 해결해보려 합니다.  - 실현 가능한 일부터 시작해 나가는 것이 우선적인 목표입니다.제주의 폐자원을 제주에서 수거하고 가공하고 유통할 수 있도록 하는 것이 환경적인 목표입니다.이에 따른 활동 등을 통해 사회적으로 다시 공헌할 수 있는 순환 체계를 마련하는 것이 최종 목표입니다.이러한 목표를 갖고 가장 우선적으로 주목하고 있는 것은 플라스틱입니다.※ 문제인식※ 증가하는 국내 플라스틱 사용량 - 환경부 ‘전국 폐기물 발생 및 처리현황’- 2010년대 초반 대한민국의 플라스틱 폐기물은 연간 약 600만 톤 발생 2010년대 후반대한민국의 플라스틱 폐기물은 연간 약 800만 톤 발생 5년 사이 30% 이상 급증※ 1인당 플라스틱 사용량이 세계에서 가장 많은 ‘대한민국’ - 한국 해양 수산 개발원- 대한민국 국민 1인당 플라스틱 사용량은 2020년 기준 145.9kg으로 미국의 100.2kg, 일본의71.5kg보다 많은 사용량을 보이며 1인당 플라스틱 사용량에 있어서 세계 1위를 차지하는 불명예 ※ 대한민국의 플라스틱 수입 제한 - 환경의 폐플라스틱 ‘폐기물 품목 고시’ 제정안- 환경부는 환경 오염 방지 및 국내에서 발생하는 폐 플라스틱의 적체를 해소하고자 재활용이용이한 플라스틱 소재에 한하여 폐 플라스틱 수입을 정책적으로 제한, 이에 따라서국내에서 발생하는 폐 플라스틱의 활용도를 증대 방안이 필요 ※ 해양 오염의 주범 ‘폐플라스틱 - 한국해양수산개발원(KMI)- 제주의 경우 해양 쓰레기가 연간 2만 톤이 유입이 되며 50% 이상이 플라스틱,수거에만 60억의 예산이 소요되고 있으나 실질적인 수거는 절반에 그침.※ 사업개요※ 고부가가치의 지닌 HDPE- 도내에서는 캠페인을 통해 연간 약 10t의 병뚜껑(HDPE)이 수거가 되지만수거된 병뚜껑(HDPE)을 활용하여 제품군으로 발현시킬 수 있는 체계가 마련되어 있지 않음- 페트병의 경우 몸통부(PET)는 현재 원사, 원단으로 가공하여 실제 다양한활용도를 갖추어 가고 있으나 병뚜껑(HDPE)의 경우에는 재활용이 용이한플라스틱 소재임에도 불구하고 재활용으로서 활용이 미비하기 때문에 실질적인대안을 통해 병뚜껑(HDPE) 또한 재활용이 이루어져야 하는 실정※ 저조한 재활용률- 한 해 제주지역에서 판매된 삼다수는 무게로 환산하면 2,475t이며2019년 실 수거율은 3% 정도에 그침.  더불어 수거 범위를 확대하려 노력을 기울이고 있지만 실질적 수거율은 10%미만으로 이 마저도 온전히 재활용되고 있지 못하는 실정 ※ 도민 환경 의식 개선의 필요성- 현 제주는 요일별 배출제, 투명 페트 분리 배출제 등을 시행하고 있지만요일별 폐기물 품목이 어떠한 것인지, 변경되는 시간은 언제인지 등의 명확한숙지가 되고 있지 않고 있으며 올바른 분리 배출에 따라 어떠한 긍정적인순환이 가능한지에 대한 인지와 필요성이 부족하다고 판단",,,https://jejudsi.kr/issue/Ar65/PROPOSE,[],,
jejudsi_1OVO,게임 요소가 접목된 환경정화활동 디지털 플랫폼 개발 및 운영,환경,2020-04-08,프로젝트완료,,"▣ 제안의 시작- 천혜의 자연환경을 자랑하는 제주도가 심각하게 증가하는 쓰레기 등으로 인한 다양한 환경 문제로 자연이 훼손되는 심각한 사회 문제가 발생하고 있음.- 이처럼, 곳곳에 버려져 쌓여있는 쓰레기는 수도 없이 많지만 행정차원의 수거처리에는 한계가 있음.- 안타까운 마음에 개인적으로 쓰레기를 수거하려고 해도 개인이 감당할 수 없는 양 등 으로 인해 수거를 포기할 수밖에 없는 경우가 비일비재함.- 이와 같은 문제를 해결하기 위해 여러 단체나 기업 등에서 환경 정화 자원봉사자들을 모집해 활동을 펼치고 있으나, 일회성 캠페인 활동으로 끝나는 경우가 대부분임.- 눈에 보이는 쓰레기를 치우고 싶은데, 혼자 치우기에는 양이 많고, 누가 같이 해주었으면 하는 생각에 제안을 하게 되었음▣ 문제의 중요성○ 제주도의 최대 현안 “환경문제” ○ 모두가 알고 있는 심각한 문제- 통계청 자료에 따르면 제주의 2017년 1인당 하루 생활폐기물 배출량은 2㎏으로 전국 1위를 차지하는 불명예를 안았으며, 처리 가능한 수용력을 초과하여 제주도민들의 안전을 위협하는 수준에 도달했음- 2019년 4월 만 19세 이상 제주도민 1,500여 명을 대상으로 조사한 결과에 따르면 제주도의 최대 현안은 쓰레기 등의 환경 문제(37.7%)로 가장 걱정되는 문제로 조사 되었음- 위의 자료들을 통해 알 수 있듯이, 제주도의 환경 문제가 심각한 수준에 이르렀다는 것은 모두가 알고 있지만, 이를 해결하기 위한 노력은 문제 해결을 위한 수준에 미치지 못하고 있음 ○ 환경 관련 자원봉사 활동의 한계- 자원봉사자들이 활동을 하기 위해서는 ‘수요처’에서 정한 장소, 시간에만 활동을 하고 있어 자율적이지 못한 현실- 사회와 공공의 이익을 위한 일을 자기 의지로 행하는 것이 자원봉사이나, 현행 교육과정에는 학생들의 봉사활동 시간을 규정하는 봉사활동 의무제가 시행되고 있고, 이에 부작용으로 봉사활동은 하기 귀찮고 재미있지 않은 어려운 일이라는 인식이 팽배한 것이 현실임- 기업 및 단체 등에서 환경정화 활동을 펼치고는 있으나, 관련 활동 자체가 단발성 이벤트 형식이 대부분이기 때문에 지속적으로 활동을 이어나가기 어려움- 실제로 환경 관련 자원봉사 활동에 참여하였을 경우 환경 문제에 대한 심각성을 느끼고, 참여하였음에 보람과 뿌듯함을 느끼지만, 활동에 참여하기까지의 문턱이 높은 것이 현실임 ○ 어렵고 복잡한 자원봉사활동 참여 과정- 아무렇게나 버려져 쌓여 있는 쓰레기들을 보고 치우고 싶었지만 혼자서는 치우고 처리할 엄두가 나지 않아 포기하는 경우가 적지 않은데, 다른 사람과의 협력을 통해 환경정화 활동을 진행한다면 참여율과 효율이 더 높아질 것으로 예상됨- 이에, 다른 사람들과 함께 환경정화 활동을 하고 싶어도, 유관 기관 및 단체 등을 찾아 가입하고 실제 활동 매칭까지 이루어지는데 과정과 절차가 복잡한 애로사항이 있고, 이는 자원봉사 활동 참여 의지를 저해하는 요소임- 유관 기관 및 단체를 통하는 어렵고 복잡한 과정과 절차를 생략하고 공익적인 목적을 가진 개인들이 스스로 혹은, 단체를 구성해 직접 환경정화 봉사활동에 참여할 수 있는 방안이 마련된다면 더 많은 사람이 보다 쉽게 자원봉사 활동에 참여할 수 있을 것으로 기대됨 ○ 제주도의 자원봉사 활동 실태- 인구 : 670,989명- 등록인원: 179,763명 (27%)- 활동인원: 12,977명 (7%)<출처: 행정안전부 1365 자원봉사 포털 2019.12.31 기준 통계>- 자원봉사활동의 중요성은 날로 커지고 있지만 실제 활동내용은 그 수준에 못 미치고 있는 현실임- 디지털 시대의 흐름에 따라 자원봉사활동에도 새로운 시스템을 도입하여 지속가능한 자원봉사 활동을 이끌어 낸다면 여러 긍정적인 효과를 불러올 것으로 기대됨▣ 토론 중점내용- 제주도 환경 문제 해결을 위한 제주도민들의 현실적 참여 방안 모색- 환경 정화 활동에 대한 부담감 및 어렵다는 인식 전환 방안 모색- 환경 정화 활동이 일회성, 단발성 행사로 그치지 않고 지속적으로 이어질 수 있는 방안 모색- 누구나 쉽게 참여할 수 있는 방안 모색- 지역 내 유관 기관 및 단체들과 연대 할 수 있는 방안 모색- 미래 세대의 주역이자 주인인 청년층, 학생층이 관심 갖고 활동에 참여할 수 있게 하는 방안 모색- 디지털 기술을 활용하고 접목할 수 있는 방안 모색▣ 문제정의 최종요약- (WHERE) 지속가능한 환경보전과 보호가 필요한 제주도에서- (WHY) 날이 갈수록 심각해지는 환경오염 문제 등을 해결하기 위해서- (WHAT) 제주도를 깨끗하게 가꾸고 유지하는 환경 정화 활동이- (WHEN) 일회성, 단발성으로 그치지 않도록 수시로- (WHO) 도민 및 관광객이 누구나 쉽게 스스로, 혹은 단체로 직접 참여할 수 있도록 하고- (HOW) 재미와 흥미를 느낄 수 있는 디지털 기술을 접목·활용할 수 있는 방안 모색 필요  제목: 게임 요소가 접목된 환경정화활동 디지털 플랫폼 개발 및 운영1. 환경정화활동 디지털 플랫폼 “(가칭)제주를 그리다”(이미지 출처: freepik.com, pngtree.com)2. 제안배경 ○ (제주환경 문제의 심각성)- 천혜의 자연 환경을 자랑하는 제주도가 심각하게 증가하는 쓰레기 등으로 인해 다양한 환경 문제로 자연이 훼손되는 심각한 사회 문제가 발생하고 있습니다.- 주요 여행지 및 해안에는 사람들이 버린 쓰레기 들로 넘쳐 나죠- 통계청 자료에 따르면 제주의 2017년 1인당 하루 생활폐기물 배출량은 2㎏으로 전국 1위를 차지하였으며, 처리 가능한 수용력을 초과하여 제주도민들의 안전을 위협하는 수준에 도달했습니다.(이미지 출처: 사단법인 제주바당)(그래프 출처: 한국일보 ""주민1인당 생활 폐기물 배출량)○ (환경 관련 자원봉사의 한계)- 제주 곳곳에 버려져 있고, 쌓여있는 쓰레기는 많지만, 행정차원의 환경정화는 한계가 있기 때문에, 유관기관 및 사회단체 등에서 환경 관련 자원봉사자를 모집하여 쓰레기 수거 등의 활동을 펼치고는 있으나, 일회성 캠페인 활동 정도로 끝나는 경우가 대부분입니다.- 사회와 공공의 이익을 위한 일을 자기의지로 행하는 것이 자원봉사이나, 현행 교육과정에는 초중고 학생들의 연간 봉사활동시간을 규정하는 등 봉사활동 의무제가 시행되고 있으나, 이로 인한 부작용으로 봉사활동은 하기 귀찮고, 재미있지 않다는 인식이 팽배한 것이 현실입니다.- 아무렇게나 버려져 쌓여 있는 쓰레기들을 보고 치우고 싶지만 혼자서는 치우고 처리할 엄두가 나지 않아 포기하는 경우 또한 적지 않습니다.- 자원 봉사 활동은 하고 싶은데 어디서,어떻게 해야되나? 보통 자원봉사 수요처 즉 단체나 기관에서 정한 시간과 장소에 가야만 봉사 활동을 하고 시간을 인정 받을 수 있습니다. 내가 원하는 시간과 장소가 맞는 조건을 찾기란 쉽지 않죠○ (환경정화활동과 게임의 콜라보레이션(collaboration))- 디지털 기술을 활용한 게임적 요소를 도입한 환경 정화 활동은 사용자들로 하여금 흥미와 재미를 유발시켜 자발적인 참여를 이끌어내는 새로운 패러다임을 선도할 수 있고, 활성화 된다면 게임을 하기 위해 제주도를 찾는 “환경 정화 관광”이 새로운 문화로써 정착 가능할 것입니다.2. 제안 아이디어 요약 ○ (게임의 팀 구성 요소가 접목된 소통 협력 플랫폼)- 플랫폼을 통해 쓰레기의 위치를 파악하여 직접 치우거나, 직접 치우기 어려워 누군가와 같이 팀을 꾸려 함께 치웠으면 하는 경우 스스로 팀원을 모집해 미션(퀘스트)를 수행하는 방식의 게임 요소를 환경정화활동과 접목한 플랫폼을 개발하고 운영하고자 합니다.- 팀원을 구성하는 과정은 쓰레기를 치우는 공익적인 활동을 목적으로 하기 때문에 플랫폼은 소통과 협력의 장으로서 역할을 합니다.- 사용자들은 환경정화 활동을 통해 얻는 경험치를 바탕으로 레벨업 할 수 있고, 레벨에 따라 플랫폼으로부터 보상을 받을 수 있습니다.- 단순한 재미를 추구하는 것이 아니라, 실제 환경정화 활동으로 이어져 공익적인 효과를 거둘 수 있습니다.○ (제주도 정보 제공 플랫폼)- 플랫폼 내 맵(Map)을 통해 제주의 날씨, 각 지역의 축제 현황, 관광 명소 들을 확인할 수 있고, 평화롭고 아름다운 제주도를 더럽히는 버려져 있는 쓰레기들의 위치를 실시간으로 확인하여 수거할 수 있게 만듭니다. 3. 제안의 게임요소 프로세스 설명- 사용자는 플레이어와 목격자의 두가지 역할을 수행합니다.(1) 목격자: 쓰레기 수거 활동이 필요한 곳을 사진 찍어 본부에 전송하는 역할(2) 플레이어: 본부로부터 받은 퀘스트(미션)지령에 따라 수거 활동을 수행하는 역할 - 운영자는 본부의 역할을 수행합니다.(1) 목격자로부터 전달 받은 사진의 메타데이터(위치정보)를 통해 정확한 위치와 쓰레기양을 파악하고, 쓰레기 수거가 원활한 날짜, 날씨 등을 사전 파악해 플레이어들에게 퀘스트(미션) 지령을 전달합니다.(2) 플레이어의 퀘스트(미션) 완료 사진을 확인하고, 해당 플레이어들에게 경험치를(포인트) 지급합니다.(3) 축적된 경험치에 따라 레벨업 과정과 보상 과정을 진행합니다.4. 제안의 기대효과 ○ (봉사활동 패러다임의 혁신적 진화)- 게임과 접목된 혁신적인 봉사활동이 가능해 집니다.- 일반 시민들, 학생들에게 더 이상 봉사활동(환경정화 활동)이 어렵고 귀찮은 것이 아니라 재미있고 하고 싶은 활동이 됩니다. ○ (가까운 사람들과 함께하는 자발적인 환경정화 활동)- 친구, 지인 등 가까운 사람들과 자발적으로 팀(파티)을 꾸려 게임에 참여할 수 있습니다.- 또한, 활동 실적에 따른 보상(봉사시간 인정, 기념품 제공, 제휴점 할인 혜택 등)을 주어 지속적인 참여 유도가 가능합니다. ○ (청정 제주 만들기 기여)- 더 많은 사용자들이 퀘스트(미션)를 수행하는 것은 더 많은 쓰레기를 수거하는 것과 같은 의미이기 때문에, 청정 제주 만들기에 기여할 수 있습니다. ○ (제주 지역경제 활성화)- 플랫폼 내 맵(Map)을 통해 제공되는 지역별 축제나 관광명소 정보 제공을 통해, 지역 경제를 활성화 시키는데 기여할 수 있습니다. 5. 결론 - 지속가능한 제주의 아름답고 쾌적한 환경을 위해 게임적 요소가 접목된 디지털 소통 협력 플랫폼 앱을 통한 해결 방안을 제시합니다. 저희의 제안이 다소 부족하고 미흡한 부분이 있을 수 있으나, 도민 여러분들과 함께 아이디어를 더하고, 가치를 더해 나가고자 합니다. 많은 분들의 관심과 공감 부탁 드립니다.",,,https://jejudsi.kr/issue/1OVO/PROPOSE,[],,
