id 값,제목,분류,프로젝트 시작,프로젝트 종류,상세 내용,제안의 시작,주요제안(문제정의),해결방안,링크,미추진 사유,공감투표 참여안내,참고자료
jejudsi_LQRB,지역과 환경문제 해결을 위한 '한두기 낚시방',환경,2022-12-12,기간종료,,"          지난 30년간 인구 감소율 46.7% 유소년층 64% 감소 30년 이상된 노후 건축물 73% 방치되거나 저활용되는 다양한 용천수(두천, 생이물 등) 쓰레기로 몸살을 앓고 있는 마을 갯녹음으로 인한 바다사막화가 가속되고 있는 마을 해안     모두 우리 제주 동한두기 마을의 문제입니다.      2022년 10월 24일 ~25일 이틀간 동한두기 주민과 활동 대학생들이 모여 용담1동 마을의 문제에 대해 논의하였습니다.  학생A : 한두기 마을은 귀여운 고양이도 많고 계곡도 참 이쁜곳인 것 같아요.              하지만 청년들이나 아이를 동반한 가족단위가 놀러올 만한 즐길 거리가 없는 것 같아요. 학생B : 마을 해안에 쓰레기나 노후된 건축물이 마을의 경관을 헤치는 것 같아요. 주민A : 이 동네는 타 동네와 달리 공항인근에 바다와 매우 밀접한(뷰권)상권들을 살려서              관광객을 유치할 수 있지만 인구유출이 심하고 고령화가 진행되고 있어서 마을에 활기가 없어요. 주민B : 우리 마을은 물이 정말 많아요. 용천수와 용연계곡, 마을 앞은 모두 바다입니다.              하지만 잘 관리가 되고 있다는 생각은 안들어요. 용천수만 해도 바다에 그대로 버려지고 있거든요.     ""동한두기의 다양한 문제를 해결할 수 있는 방법이 없을까?""  동한두기의 풍부한 물과 해안쓰레기를 활용하여 한두기 마을의 브랜드화와 용담1동 한두기 해안 정화의 필요성 인식을 위한  새로운 컨셉의 ""낚시방""을 운영하면 어떨까?      <낚시방 운영 목표> 지역주민이 직접 참여하고 스스로 관리할 수 있는 활동(일자리)을 제공하고 동한두기 마을의 발전을 도모 환경문제 인식을 확산하고 다양한 연령대의 사람들이 즐길 수 있는 콘텐츠 제공 주민들의 환경 실천이 수익화로 이루어질 수 있는 마을단위 비즈니스모델 수립 도모        지역과 환경을 위한 ""한두기 낚시방"" 많은 관심 부탁드립니다!   ",,,https://jejudsi.kr/issue/LqrB/PROPOSE,[],,
jejudsi_LJJE,고장난 제주환경의 정상화를 위한 제주중학교 '비정상환경기구',환경,2022-12-08,기간종료,,"         - 한해에 제주에 버려지는 플라스틱 일회용컵만 6,300만개- 제주도 1인당 일평균 쓰레기 배출량 전국 최고수준- 제주도 지하수 지속 이용 가능량의 91.2%에 육박- 제주 바다  ‘사막화’ 갯녹음 현상 심각    미래의 제주는 어떤 섬일까요?    2022년 12월 7일 수요일5명의 제주중학생과 관련 전문가들이 모여 함께 제주도의 환경문제에 대해 논의하였습니다.     학생A : 길에서 만들어진 쓰레기의 처리가 어려워 그대로 길이나 바다에 버려지고 이로인해 환경오염이 증가하는 것 같아요. 학생B : 어업폐기물이나 플라스틱이 바다에 그대로 버려지고 있다고 들었어요. 이 해양쓰레기로 인해 죽어가는              거북이, 새, 물고기 등 다양한 생물들이 죽음에 이르는 사진을 보고 환경문제가 심각하다고 생각했어요. 학생C : 환경 강의를 듣고 제주도의 지하수 고갈문제가 정말 심각하다는 것을 알았어요. 그리고 대부분의 사람들이              이러한 사실을 모르거나 외면하며 살아가는것 같아요. 학생D : 환경에 대한 책임 인식이 낮은것 같아요. 우리가 생각하는 지금의 환경문제는              모두 ""사람의 환경인식 부족""이라는 원인에 의해서 발생하는 문제가 아닐까요?  =>""우리 제주중학교 학생들이 이러한 환경인식 부족이라는 문제를 해결할 수 있는 방안을 생각해보자! ""     <제주중학생 환경인식 부족의 원인>1.편하고자 하는 욕심- 분리수거 혹은 친환경제품 구입, 정화활동 참여 등은 모두 노력이 필요한 일입니다.   하지만 우리는 모두 편해지기 위해 외면하고 있습니다. 2.환경에 대한 무관심과 무지- 세상은 우리에게 좋은 대학을 가야한다고 열심히 공부해야 한다고, 이로운 사람이 되라고 합니다.   그러나 이로운 사람의 소양에는 환경지식이 없나봅니다. 환경은 시험과목이 아니거든요. 3.환경문제를 바꿀 용기가 없음-학교라는 작은 울타리안에서 교우관계는 저희 학생들에게 매우 중요한 문제이기도 합니다.  친구들이 게임이야기를 할때 환경문제를 꺼내는것은 어쩌면 정말 큰 용기가 필요한 일이기도 합니다.   <2022.12.07(수) 문제정의를 위한 제주중학생 환경리빙랩 토의 내용> Q.이러한 환경인식 부족은 무엇으로 보완이 가능할까?-> 교육으로 보완이 가능하다. Q.환경 교육을 들으려고 하는 학생들이 있을까?->소통이 없고 이론적인 얘기만 하는 교육/재미 없는 교육/성취감이 없는 환경 교육은 학생들이 흥미를 느끼지 못해 참여가 저조할 것이다. Q.흥미가 붙는 환경교육은 어떤 교육일까?->보상감/즐거움/성취감/이해가 쉬운/현장형/실생활 사용 가능/쌍방향소통/학생주체적 교육은 흥미가 붙을 수 있다. Q.흥미가 붙는 환경교육을 운영하기 위해 필요한 것은 무엇일까?->능동적으로 이끌어갈 학생이 필요하다.->제주중학교내에서 우리 스스로 성취감을 얻을 수 있도록 하는 자체적인 학생 환경조직이 필요하다. Q.좋은 학생조직이란?->학생 스스로 활동을 주도할 수 있는 조직->다양한 성취감을 스스로 느끼게하는 조직 Q.환경활동을 했을때 중학생이 받을수 있는 최고의 보상이란 무엇일까?-환경활동으로 인한 변화를 직접 모니터링하고나서 느끼는 성취감-상점(그린마일리지 상, 내신, 생활기록부 반영)-동아리 활동을 통한 친목-서울대 강연 등        ",,,https://jejudsi.kr/issue/LjJE/PROPOSE,[],,
jejudsi_LBOO,제주도 내 애플리케이션을 활용한 공병 회수 시스템,환경,2022-11-29,기간종료,,"우리나라는 빈용기 보증금 제도를 통해 공병을 반납할 시 일정 금액을 돌려받을 수 있다.그러나 제주도에서 적극적으로 공병 수거 시스템을 운영하는 마트는 많지 않으며 소비자들의 참여율도 낮아 공병 수거가 활발하게 이루어지지 않고 있다.공병의 무게를 활용한 어플리케이션 및 하드웨어를 개발함으로써 공병 수거율을 높이는 데에 기여하고자 한다. -어플리케이션 이용 사용자의 회원 정보 관리(로그인, 회원가입).-아두이노를 통한 공병의 무게 데이터 어플리케이션에 전송.-공병 수거에 따른 포인트 적립.아두이노를 활용한 공병의 무게 측정제주도 지도API를 이용해 공병 수거 HW의 위치 확인바코드를 이용한 회원 인지공병 수거에 대한 포인트 적립 로그인 및 회원가입, 포인트, 위치 정보 요청회원정보 저장 및 확인요청 회원정보 전송USER 요청 데이터 전송 (ex) 포인트 정보, 위치 정보 등)공병 재활용시 하드웨어가 무게 측정공병 수거 후 회원 포인트 적립업데이트 된 포인트 정보 제공수거 완료 후 알림깨끗한 제주도  - 제주도 내 공병회수환경 개선.- 제주도 환경적인 측면에서의 사회공헌적인 효과 ",,,https://jejudsi.kr/issue/LBOO/PROPOSE,[],,
jejudsi_RVVQ,MZ세대 1인 가구를 위한 쓰레기 배출 및 분리수거 지침서,환경,2022-11-29,기간종료,,"최근들어 환경문제가 전세계적으로 대두되고 있는 찰나과거 독립을 하면서 불편을 겪었던 쓰레기 배출 및 분리수거 문제가 문뜩 떠올랐고 이를 해결하고자 몇가지 제안을 생각해봤습니다. 처음 독립을 하게되면 많은 정보를 혼자서 알아내기가 어려운데 그 중 환경문제와 직결되는 쓰레기와 관련해 원룸촌 및 빌라촌위주로 1인가구를 위한 쓰레기,음식물 쓰레기 배출법 및 분리수거  방법, 그 동네의 분리수거함,헌옷수거함 등등 의 위치를 표시한 환경지도를 배포해주면 좋을것같습니다",,,https://jejudsi.kr/issue/RvvQ/PROPOSE,[],,
jejudsi_1VBB,폐목재를 활용한 액자 제작,환경,2022-11-18,기간종료,,"안녕하세요. 저는 제주도에서 사진관을 운영을 하고 있는 이주민입니다.해안가 정비 봉사활동을 하며 많은 쓰레기들을 보았습니다. 그중에 저는 폐목재를 액자로 만드는 방안을 생각을 하게 되었습니다.액자라는게 사실 좋은 나무로 만들면 좋지만 액자를 사용하는 사용자로써는 단가를 생각하면 좋지 못한 나무들로 만드는 액자들도 많이 사용을 합니다.강도가 약한 건 분쇄하여 합판으로 만들어 액자 뒷면 고정판으로도 사용을 하고요. 합판에 시트지를 붙여 사용도 합니다.강도가 있는건 색, 오일을  발라서도 사용이 가능합니다.폐목재가 해안가 쓰레기로 말을 하였지만 건축, 인테리어, 가구공장, 목재 공방 제주도에서만 나오는 양만 해도 많다고 생각을 합니다.또한 육지에서도 폐목재를 처리하려면 비용이 발생을 할 텐데요. 만약 제주까지 운송비용이 더 가렴 하다면 역으로 수입을 하는 방법도 있을 거 같습니다.제주도에 사진관련 종사자 사업자등록증만 몇 천개가 되는 걸로 알고 있습니다. 대부분이 저같은 이주민이고요.제주가 좋아서 왔기에 폐목재 액자라면 모두 관심을 자기고 사용을 할 거라 생각합니다.담당자 한분이 전담을 하여 수거, 가공, 판매까지 이루어진다면 좋은 성과 일 거 같다고 생각합니다.",,,https://jejudsi.kr/issue/1VBb/PROPOSE,[],,
jejudsi_RVQQ,쓰레기를 돈내고 버리고 재활용은 쿠폰 할인,환경,2022-05-19,기간종료,,"				관광지에서 음식물 쓰레기와 쓰레기는 버리는 데 항상 함들다 . 종량제는 구하기도 힘들고 또 그자체도 음식물쓰레기등 쓰레기를 교통카드단말기를 이용하여 지불하도록 개선, 그리고 재활용 중 가장 많이 사용되는 캔과 투명 PET 수거는 포인트 적립으로 쓰레기 버릴시 비용과 또 주변 할인쿠폰으로 상생		",,,https://jejudsi.kr/issue/RvQQ/PROPOSE,[],,
jejudsi_1EOY,종량제봉투 자판기 도입,환경,2022-05-18,기간종료,,"				코로나 확산으로 활동에 제한이 있다보니 독립된 공간에서 즐기는 캠핑을 즐기게 되었습니다. 캠핑장의 경우 쓰레기 분리수거가 가능하고 종량제 봉투도 제공하고 있지만 캠핑장이 아닌 곳에서 캠핑 또는 피크닉 등을 즐기게 될 경우 종량제 봉투를 미리 준비하지 않아 난처했던 경험이 있습니다. 그리고 바닷가, 오름, 올레길 등에서 무분별하게 버려지는 쓰레기들로 인해 불편함을 느끼곤 하는데 조깅을 하면서 동시에 쓰레기를 줍는 플로깅과 같은 친환경 활동을 사전에 계획하지 않아도 언제든 할 수 있도록 근방의 클린하우스, 공중화장실, 캠핑장 등에서 종량제 봉투를 판매하는 자판기 도입을 제안합니다.1. 용량별 종량제 봉투를 구입할 수 있는 자판기2. 폐자원을 회수하면 회수량에 따라 종량제 봉투를 제공하는 기능 포함      ( 종이팩, 폐플라스틱, 폐건전지 등)		",,,https://jejudsi.kr/issue/1Eoy/PROPOSE,[],,
jejudsi_RBKJ,관광지 쓰레기 제로,환경,2022-05-14,기간종료,,"				얼마전 육지에서 지인이 와서 함께 중문해변과 사계해변을 걸었습니다.너무도 아름다운 제주바다에 쓰레기가 여기저기 흩어져 있는 모습에 정말 마음 아팠습니다.중문, 사계, 함덕, 협재등 제주도의 바다에 환경사랑 부스를 설치하고 관광객이나 도민들에게 쓰레기 담을 봉투를 나눠주고 회수하는 방식으로 운영하면 참 좋을 것 같습니다.해변 쓰레기를 모아오면 종량제 봉투나 생필품으로 교환해주는 환경사랑 운동을 주기적으로 펼친다면 아름다운 제주 바다를 지킬 수 있지 않을까요~?최근 페트병, 우유팩, 폐건전지 등을 모아오면 종량제 봉투로 빠꿔주는 행사에 많은 분들이 동참했던 환경부 행사가 처음엔 종량제 봉투를 받기위해 열심히 동참했지만 지금은 정착하여 스스로 환경을 생각하며 분리배출 하게 되었던것처럼~우리 함께 바다사랑 캠페인을 실천해보아요!!^^		",,,https://jejudsi.kr/issue/RbKJ/PROPOSE,[],,
jejudsi_AMXZ,자전거코스 개발,환경,2022-04-05,기간종료,,"				렌트카가 아닌 자전거로 투어할 수 있는 도로 개발/ 코스개발렌트카가격이 너무 올랐는데 환경적으로도,  자전거가 많은 유익한 점을 줄 것 같음.		",,,https://jejudsi.kr/issue/Amxz/PROPOSE,[],,
jejudsi_1DXM,청정제주 에코컵 프로젝트,환경,2021-12-16,기간종료,,"				제주도의 폭증하는 쓰레기 문제 해결과 환경문제를 고민해 보면서, 최근 스타벅스의 리유저블컵을 보며 제주도에 공통으로 쓸수 있는 리유저블컵을 개발 보급했으면 좋겠다는 생각을 했습니다. 스타벅스처럼 컵값을 따로 받되 씻어서 반납하면 되돌려 받는 제도를 만들었으면 하는데요. 우선 투썸플레이스 같은 대형프랜차이즈간의 협력을 통해 기반을 마련하고 빽다방 같은데도 확장을 하면 어떨까 합니다.제주는 대한민국이 자랑하는 세계적인 자연유산으로,  꾸준히 사랑받는 우리나라 대표 관광지입니다. 제주를 찾는 관광객 수는 매년 꾸준히 증가하고 있으며 해외 관광지를 대체하며 더욱 더 큰 사랑을 받고 있습니다. 이렇게 제주가 사랑을 받는 것은 좋은 일이지만 그만큼 부작용도 있습니다. 쓰레기 문제가 그 대표적인 예로,제주시에 위치한 봉개, 서부, 동부 매립장의 경우는 이미 사용수명을 다했고, 2019년 가동을 시작한 동복 제주환경자원순환센터 매립장을 제외하고는 다른 매립장도 여유 용량이 얼마 남지 않아 2030년 안으로 사용기한이 다할 것으로 예상됩니다. 관광객들이나 도민들이 테이크 아웃해 가며 즐겁게 한잔 하는 커피는 재활용이 어려운 플라스틱 쓰레기를 남기고 있습니다. 이러한 쓰레기를 조금이라도 줄일수 있는 노력이 절실합니다.		",,,https://jejudsi.kr/issue/1dxM/PROPOSE,[],,
jejudsi_RVGQ,제주도 내 재활용 확대를 위한 재활용 보상제,환경,2021-12-12,기간종료,,"				일회용품 사용증가, 관광객 증가 등으로 제주도 내 쓰레기가 포화상태에 이르름. 이러한 문제를 해결하기 위해 쓰레기 분리수거 참여를 높이기 위해 고안됨.",,,https://jejudsi.kr/issue/RvgQ/PROPOSE,[],,
jejudsi_1WXK,무단 취식 및 무단 음주로 인한 해양쓰레기 문제,환경,2021-12-07,기간종료,,				돗자리가 필요한 방문객에게 돗자리 대여와 종량제 봉투도 함께 판매하는 자판기 개념으로 재활용 도움센터와 근접하게 하여 접급성을 편하게 하여 분리수거를 할수있도록 도와 준다.무단 취식 및 무단 음주로 인한 해양쓰레기		,,,https://jejudsi.kr/issue/1WxK/PROPOSE,[],,
jejudsi_LJYK,분리수거장 위치지도 어플,환경,2021-11-23,기간종료,,				분리수거장 찾는게 너무 어려워요!!그래서 쓰레기를 집으로 가져와서 자주 버립니다.불편해요!!관광객은 더 불편하지 않을까요?항상 쓰레기를 집에 가져와서 버리시나요?낯선 지역에가면 쓰레기를 버릴 곳 찾기가 어렵습니다.관광객들은 그래서 아무데나 쓰레기를 버리나봅니다.그래서 분리수거장을 쉽게 확인 할 수 있는제주도 분리수거장 지도 어플을 제안합니다.,,,https://jejudsi.kr/issue/LjYK/PROPOSE,[],,
jejudsi_RBGK,제주 캐릭터 수집기능을 동반한 제로웨이스트 챌린지 어플리케이션,환경,2021-09-29,기간종료,,"				[제주도의 제로웨이스트(zero waste) 필요성]코로나19의 영향으로 제주도행 휴가를 선택하는 사람이 증가. 2021년 8월 10일 제주도에 따르면 하루 20~30톤씩 제주환경자원순환센터로 반입되던 사업장 폐기물이 최근에는 70~80톤으로 처리 물량이 크게 증가함.(제주의소리. 2021) 제주도 관광지의 음식점, 카페 등의 소비는 매장이용이 아닌 테이크아웃, 배달 이용객 증가. 이로 인해 플라스틱 폐기물 배출량이 늘어나 환경을 해칠 수 있다는 우려 제기됨.이런 사회적 흐름에 따라 제주도민들의 제로웨이스트에 대한 관심은 자연스럽게 증가.- 일회용 플라스틱 줄이기를 실천하는 가게들과 업무협약을 체결하는 가게들도 늘고 있음.- 이영웅 제주환경운동연합 사무처장은 “아직 도내 제로웨이스트 가게에 대한 정보와 자료가 구축되지 않은 가운데 조사와 협약이 더 많은 가게가 쓰레기 줄이기 실천에 참여하게 되는 마중물이 될 것으로 기대한다.”고 밝힘.(연합뉴스.2021) - 2019년 제주도 제기된 제주의 주요 환경 정책은 세계환경 수도 조성, 환경보전기여금 등 다양한 제안이 있음.(뉴스제주, 2019)그러나 이러한 문제제기에도 불구, 제주특별자치도가 실시한 도민인식조사 결과에 따르면 여전히 생활쓰레기 분야는 심각하다는 응답 많음. 생활쓰레기를 가장 우선해야할 정책으로 꼽음. 이를 개선하기 위해서는 원인자에게 부담을 가해야 한다는 의견이 우세.(제주일보. 2021) 제주 방문객들의 환경활동 참여를 유도할 필요.1.아이디어 핵심 내용제로웨이스트 활동에 어려움을 겪고 있는 사람들에게 챌린지, 커뮤니티 기능을 통해 재미와 성취감을 주고, 지도, 커뮤니티 기능을 통해 제로웨이스트 정보를 제공해줌으로써 제로웨이스트 활동을 계속 이어갈 수 있게 함.2.서비스2-1. 챌린지/이벤트챌린지: 다양한 환경 관련 미션들을 통해 사람들의 제로웨이스트 도전에 도움을 제공.이벤트: 어플에서 진행하는 이벤트에 성공한 사람들에게 리워드 증정.(리워드: 어플 자체내의 제주도와 관련된 캐릭터로 보상.)2-2. 제로웨이스트샵 지도-지도에 표시된 제로웨이스트 가게를 클릭하면 가게의 주소, 운영 시간, 파는 물건 등의 정보를 확인할 수 있음.2-3. 커뮤니티: 제로웨이스트 활동후기/ 질문/ 재활용방법/ 지역별 중고거래 등 정보를 공유하고, 사람들끼리 소통할 수 있도록 한다.",,,https://jejudsi.kr/issue/Rbgk/PROPOSE,[],,
jejudsi_A868,제주 바닷길 지킴이,환경,2021-08-18,기간종료,,				바닷길에 분리수거 통이 설치되어 있지않아 관광객 또는 도민(현지인)들이 바다나 바닷길에 쓰레기를 버리고 가는 경우가 많아 관심을 갖게 되었다.쓰레기를 막대하게 버리면 제주도 바다가 쓰레기 바다로 변할수 있게되어 관광지나해수욕장이 파괴 될수있다. 만약에 바다에 버려진 쓰레기를 보면 제주도 도민인 해녀분들도 쓰레기를 보고 생물인지 알고 잡게 될수도 있고 쓰레기에서 나오는 물질 같은것도 몸 건강에 해를 키친다. 물고기도 플라스틱 같은것을 먹이로 봐서 먹으면 그 물고기는 결국 우리 몸속에 들어와서 피해를 키친다.		,,,https://jejudsi.kr/issue/A868/PROPOSE,[],,
jejudsi_RZV4,내가 그리는 제주! 우리가 만드는 제주!,환경,2021-08-17,기간종료,,"				❍ 우리가 살고 있는 청정제주가 여러 요인으로 인하여 아파하고 있습니다. ❍ 다음 세대에 깨끗한 제주를 물려주기 위해서는 우리가 우리 손으로 제주를 잘 만들어야 할 것입니다.❍ 쓰레기 무단투기, 거북이 코 빨대, 지구온난화 북극곰, 해양쓰레기 등 심각한 환경문제는 전 세계가 겪고 있는 문제입니다.❍ 이러한 현상에 대해 제주의 초등학생, 중학생들이 제주의 환경오염을 제대로 인식하고 스스로 해결할 수 있는 문제해결 역량을 키우기 위한 방법은 무엇인가 생각    해보았습니다.「제주특별자치도 출범 15주년 도민인식조사」에 따르면 지속적 발전을 위한 우선적 추진 분야 및 제주특별자치도의 성공적 추진을 위한 최우선 과제 순위로 환경 분야가 1순위를 차지탄소포인트제, 에코머니포인트 등의 제도가 있지만 초등, 중학생들은 할 수 없는 것들이 대부분이다.'세살버릇 여든까지 간다'라는 속담도 있듯이 학생들이 환경오염에서부터 해결방법 등을 어릴때부터 몸에 익히게 되면 어른이 되어서도 분리배출, 분리수거 등을 실천할 수 있을 것이며, 현재보다는 더 나은 미래가 실현될 것으로 기대한다.(예시) 학생들이 직접 재활용 물품 분리 → 환경자원순환센터 제출 → 무게 측량 → 포인트 지급 → 상품권 지급",,,https://jejudsi.kr/issue/RZv4/PROPOSE,[],,
jejudsi_R2XO,제주지역 생활쓰레기 중 플라스틱이나 비닐쓰레기를 재활용한 생활 안전 장치(보도블럭 및 놀이터 방지턱 등) 제작,환경,2021-07-09,기간종료,,"				현재 제주도의 가장 큰 문제점이라 볼 수 있는 쓰레기 문제를 어떻게 하면 조금이나마 해소를 할 수 있을까라는 점에서 제안을 드립니다.쓰레기 중에서도 분류를 하게 되면  1. 음식물 쓰레기, 2. 철·알루미늄 캔, 3. 빈병, 4. 종이(신문지, 우유팩, 음료수팩, 종이컵), 5. 플라스틱 및 스티로폼, 6. 폐형광등, 폐건전기 등이 있는데 이중 음식물 쓰레기나 빈병, 종이 등은 분리와 재활용적인 측면에서 좀 나아지고 있다고 보여지나 플라스틱 및 스티로폼과 철·알루미늄 캔의 생활쓰레기의 재활용은 전혀 이루어지지 않고 있다고 보여짐더불어, 제주 지역의 자연경관에서도 아름다운 해안 지역임에도 불구하고 해안가의 주 쓰레기 중 하나가 플라스틱(60% 이상 차지)이며, 계절에 따라 외부에서 밀려 들어오는  괭생이모자반 등을 모아서 생활 속 안전 장치(보도블럭 및 놀이터 방지턱 등), 건축물 사용 벽돌 제작을 하여 생활속에서 재활용된다면 어떨까?라는 생각이 들었습니다. 위의 문제점이나 제안을 드리게 된 가장 큰 계기는 지역의 신문 기사 내용 중에서도 가장 심각하게 보도되는 문제인 생활쓰레기인 점을 봐서 제안을 하게 되었습니다. 구글 사이트를 통해서 '제주도 해안가 쓰레기'를 검색하였을 때 검색량이 약 37,100여개의 기사가 나오며, '제주도 쓰레기'를 검색하였을 때 약 509,000여개의 기사가 나온다는 측면에서 보았을 때도 제주지역의 쓰레기는 큰 이슈이며, 이를 어떻게 하면 재활용해서 쓰레기량을 줄이고 활용하는 방안을 찾아내어 문제 해결을 해야 한다는 점에서 이를 제안하게 되었습니다.    <출처 : 연합뉴스(2021.06.07일자, '비닐 포장 쓰레기를 벽돌로...인도네시아 재활용 아이디어 눈길') 기사> 결론적으로 제주지역 시멘트공장이나 보도블럭, 벽돌 제조업체와의 협업을 통해 재활용 제품을 만들고 활용함으로써 제주지역 환경문제로 가장 시급한 생활 쓰레기량을 줄이고, 환경오염을 최소화하는데 제안의 목적이 있습니다.		",,,https://jejudsi.kr/issue/R2Xo/PROPOSE,[],,
