지역명,기사제목,기자이름,날짜,내용,링크
경북,포항 평생학습원 ‘두드림 페스티벌’ 개최,일간경북신문 - 김재원 기자,2023/05/31,"포항시는 2, 3일 이틀간 뱃머리 평생학습원 일원에서 ‘두드림(DO Dream) 페스티벌’을 개최한다.
이번 행사는 포항시 평생학습원 개원 10주년을 맞아 지난 10년간의 평생학습 성과를 시민과 함께 공유하고 축하하기 위해 평생교육과, 시립도서관, 시립미술관에서 함께 마련했다.
포항시는 이번 행사를 어린이부터 어르신까지 전 연령대가 함께 즐길 수 있는 학습 축제의 장으로 만들기 위해 다채로운 프로그램을 준비하고 있다.
먼저 어린이들을 위한 △영어 놀이, 요리와 필라테스 체험 △가족 얼굴 쿠키 만들기 △어린이 풍선아트 △버블 건 및 레고 체험 등 프로그램과 함께 성인들을 위한 프로그램으로는 △다도 및 예절 △맥적요리, 꽃차 시음 △네일아트 △한문 붓글씨 체험 행사 등이 열린다.
또한 성인 문해교육 시화전을 비롯해 미술작품, 생활 인테리어 소품 등 우수 작품전시와 프리마켓 판매 행사, 독서존, 스틸아트공방 체험 등 특별행사도 마련된다. 이와 함께 사물놀이, 난타, 댄스, 악기 연주 등 수강생과 학습동아리의 공연 등 다양한 볼거리도 준비하고 있다.
3일 기념식 행사에서는 오전 9시 30분 어르신 골든벨을 시작으로, 수강생 공연, 식전공연 등이 펼쳐지며, 기념식에서는 평생학습 발전 유공자 시상, 축하 영상메세지 상영, 퍼포먼스 등이 이어진다.
특히 이날 오전 11시에는 인기 트로트 가수 신유의 토크가 있는 콘서트가 6월 시민교양대학과 연계해 진행될 예정이다. 김재원기자",http://www.newgbnews.com/news/view.php?idx=307645
경북,"영덕, 어민 소득↑… 어린 전복·해삼 방류",일간경북신문 - 박두원 기자,2023/05/31,"지역어장 13곳에 61만미
영덕군은 기후 위기와 생태계 변화로 감소하는 수산 자원을 회복하고 어업인의 소득을 증대하기 위해 지난 26일 남정면 부경리를 비롯한 관내 마을어장 13곳에 어린 전복 28만미와 어린 해삼 33만 5,000미를 방류했다.
영덕군은 이번에 방류한 어린 전복과 해삼은 경북도 어업기술센터의 수산생물 전염병 검사를 마친 건강한 종자로, 어촌계 잠수사들이 직접 암초가 많고 해조류가 풍성한 곳에 안전하게 안착시켜 향후 건강한 성채로 자랄 것을 기대하고 있다.
정상호 해양수산과장은 “현재 수산종자 매입 방류사업과 동해안 해삼양식산업 육성사업 등을 지속적으로 추진해 고부가 가치 수산물인 전복과 해삼의 종자를 꾸준히 방류하고 있다”며, “수산자원 회복과 효율적인 관리로 어업인들의 소득 증대와 국민의 먹거리 확보에 기여할 수 있도록 최선을 다하겠다”고 밝혔다. 박두원기자",http://www.newgbnews.com/news/view.php?idx=307644
경북,"포항, 대형건설공사장 7곳 안전 점검",일간경북신문 - 김재원 기자,2023/05/31,"포항시는 여름철 집중호우와 각종 재해 사전 예방을 위해 지난달 24일부터 오는 10일까지 지역 대형건설공사장 7곳에 대해 집중 안전 점검을 실시하고 있다.
점검 대상은 산지 인근 공사장, 토사 붕괴, 침수 등으로 인한 감전·익사, 강풍에 의한 시설물 낙하·전도가 우려되는 시설물로, 특히 집중호우에 취약한 터파기 및 흙막이 공사 현장, 배수에 어려움이 있는 지하 굴착공사 현장을 집중 점검한다.
이번 점검 결과 경미한 사항은 즉시 시정하도록 하고, 조치가 어려운 사항은 위험 요소가 해소될 때까지 지속 관리할 방침이다.
한편 시는 점검에 앞서 지난 24일 현장 관계자를 대상으로 안전관리 실태와 재해 대응 계획에 대한 사전점검과 안전교육을 통해 현장별 관리계획의 적정성과 정기 안전 점검 실시 여부를 확인하고 우수사례와 사업장별 보완사항을 검토했다.
김기창 하수도과장은 “철저한 안전 점검으로 재난사고를 사전 예방해 시민의 생명과 재산을 보호하는 안전 도시 조성에 행정력을 집중하겠다”라고 말했다. 김재원기자",http://www.newgbnews.com/news/view.php?idx=307643
경북,"포항, 기관·단체와 손잡고 학교폭력 예방",일간경북신문 - 김재원 기자,2023/05/31,"포항시는 학교폭력 예방 및 대책 논의를 위해 31일 시청 드림스타트 회의실에서 2023년 포항시 학교폭력 대책 지역협의회 회의를 개최했다.
포항시 학교폭력 대책 지역협의회 회의는 포항시 학교폭력 예방 및 대책 활동 지원에 관한 조례 제9조에 의거 매년 1회 이상 개최되고 있다.
부위원장인 최명환 복지국장 주재로 진행된 이번 협의회는 지자체, 경찰서, 교육지원청 관련 공무원과 청소년단체 대표 등 20명이 참석한 가운데 기관별 학교폭력 예방 대책계획 및 보고, 협의체 간 상호협력 및 지원방안 등을 논의했다. 특히 최근 증가하고 있는 학교폭력 예방을 위해서는 개인이나 한 기관이 아닌 지역사회를 중심으로 유관기관·단체가 상호 유기적으로 협력해야 한다는 데 뜻을 모았으며, 향후 기관·단체 간 연계 강화를 통해 긴밀한 협업과 지원을 이어가기로 했다. 복지국장은 “청소년들이 올바르게 성장할 수 있도록 지역 유관기관들이 손을 맞잡은 의미있는 자리”라고 했다. 김재원기자",http://www.newgbnews.com/news/view.php?idx=307642
경북,“전국서 맨발로 걸으러 왔어요”,일간경북신문 - 김재원 기자,2023/05/31,,http://www.newgbnews.com/news/view.php?idx=307641
경북,"독도박물관, 10월 3일까지 ‘울릉도’ 공동기획전",일간경북신문 - 송성준 기자,2023/05/31,"울릉군 독도박물관은 국립호남권생물자원관 및 경북대학교 울릉도·독도연구소와의 공동기획전 “울릉도”를 지난달 31일부터 10월 3일까지 국립대구과학관 꿈나무과학관 2층에서 개최한다.
이번 전시는 대양섬 울릉도의 고유생물과 자연, 그리고 이곳의 환경을 배경으로 형성, 발전되어 온 울릉주민의 생활문화를 주제로 기획됐다.
울릉도는 화산 폭발로 생겨난 이후 한 번도 육지와 연결된 적이 없는 대양섬으로 오랜 기간 이곳이 지닌 독특한 환경에 적응하여 새로운 종으로 진화한 다양한 고유생물들을 품고 있다. 특히 울릉도는 30여 종이 넘는 고유생물이 자생하기에 ‘한국의 갈라파고스’라고 부르기도 한다.
이번 전시에서는 울릉해변해면, 울도하늘소 등 울릉도 고유생물 표본을 비롯하여 독도박물관이 소장한 과거 오징어 어로도구와 떼배를 이용한 미역채취 어업 도구, 그리고 울릉도의 기후환경에 적응한 가옥인 울릉도 투막집 등 울릉도의 환경에 적응하며 고유한 생활문화를 발전시켜 나간 울릉주민의 삶을 엿볼 수 있는 각종 민속유물이 소개된다.
남한권 울릉군수는 “울릉도의 깨끗하고 소중한 자연환경과 환경에 적응하며 고유의 문화를 발전시켜 나간 울릉주민의 삶을 소개하는 전시가 개최되는 것을 매우 의미깊게 생각하며, 앞으로도 여러 지역에서 울릉도와 독도를 알리는 공동전시 개최에 힘쓰겠다.”고 밝혔다. 송성준기자",http://www.newgbnews.com/news/view.php?idx=307640
경북,포항 ‘시민과 약속’ 공약 이행 차질 없이 ‘순항’,일간경북신문 - 김재원 기자,2023/05/31,,http://www.newgbnews.com/news/view.php?idx=307639
경북,"시정소식지 우리경산 개편, 시민들 ‘호평’",일간경북신문 - 이종구 기자,2023/05/31,"경산시가 매월 발행하는 시정소식지‘우리 경산’이 큰 글씨와 사진의 비중을 늘린 디자인 개편 등으로 시민들의 가독성을 높이고 있다는 호평을 받고 있다고 지난달 31일 밝혔다.
소식지‘우리경산’은 민선 8기 시작과 함께 유명 잡지에서나 볼 수 있는 사진 기술과 커버스토리 형식을 도입해 시의 정책이나 다양한 소식들을 쉽게 전달할 수 있도록 하고 소식지 규격도 B5 사이즈에서 A4 사이즈로 큰 변화를 주었다.
또한, 소식지에 시가 추구하는 산․학․관 상생협력의 일환으로‘이 달의 기업’ 등 우수기업을 소개하는 한편, 현재 주요 이슈 사항을 재미있는 만화로도 구성해서 게재하고 있어, 다양한 연령층으로부터 호응을 얻고 있다.
시각장애인과 노인 등 정보 취약계층을 위해 소식지 내용을 음성으로 들을 수 있는 음성변환프로그램을 지난 2월 도입해, 소식지 상세내용을 QR코드를 활용해 동영상으로도 볼 수 있다.
또한, 정보화 시대 언제 어디서든 휴대폰으로도 손쉽게 시정 소식을 접할 수 있도록 시 공식 SNS 채널을 통해 제공하고, 경산시 누리집(홈페이지)을 통해서도 매월 새롭게 발간하는 소식지를 볼 수 있도록 게재하고 있다. 이종구기자",http://www.newgbnews.com/news/view.php?idx=307638
경북,"성주 파크골프장, 건전한 체육활동 홍보",일간경북신문 - 윤기영 기자,2023/05/31,,http://www.newgbnews.com/news/view.php?idx=307637
경북,"고령, 1인 가구 공무원 ‘안전한 생활’ 지원",일간경북신문 - 윤기영 기자,2023/05/31,,http://www.newgbnews.com/news/view.php?idx=307636
경북,고령 ‘호국보훈의 달’ 독립유공자 유족 위문,일간경북신문 - 윤기영 기자,2023/05/31,"고령군은 지난달 30일 호국보훈의 달을 맞이해 조국의 독립을 위해 희생하신 독립유공자 유족(우곡면 박복수)을 방문해 국가유공자의 숭고한 희생과 고귀한 삶에 감사와 존경의 뜻을 표하고 위문품을 전달했다.
고령군에서는 ‘국가보훈대상자 예우 및 지원에 관한 조례’에 따라 매월 25일 고령군에 주소를 둔 만65세 이상 국가보훈대상자에게 참전유공자 명예수당, 보훈예우수당, 미망인수당 등을 지급하고 있다.
고령군수는 “앞으로 국가유공자분들의 명예와 자긍심을 높이기 위해 국가유공자에 대한 예우 강화를 위해 노력하겠다”고 전했다. 윤기영기자",http://www.newgbnews.com/news/view.php?idx=307635
경북,"경주, 지역실업자 직업훈련생 35명 모집",일간경북신문 - 서경규 기자,2023/05/31,"경주시는 실업자와 비진학 청소년 등의 취업 취약계층에게 직업 훈련 기회를 제공하기 위해 ‘지역실업자 직업훈련생’ 35명을 모집한다.
이번 훈련은 총 4개 과정으로 △양장기능사(경주패션디자인학원) △한식조리(경주중앙직업전문학교) △한복기능사(권미란패션학원) △지게차운전(건영직업전문학교) 등으로 구분돼 진행된다. 모집인원은 각 과정별 8~10명이며, 훈련기간은 6월부터 9월까지 기관별로 상이하다.
훈련수당은 출석일수가 소정 훈련일수의 80% 이상인 훈련생을 대상으로 월 최대 5만원 교통비와 6만6천원 식비가 지급된다. 단 훈련비는 시에서 훈련기관으로 전액 지원한다. 신청은 2일까지 주소지 읍면동 행정복지센터를 방문해 신청하면 된다. 서경규기자",http://www.newgbnews.com/news/view.php?idx=307634
경북,외국인 민원 통역 만족도 UP,일간경북신문 - 일간경북신문 기자,2023/05/31,"영천시는 지난달 30일 의사소통 문제로 어려움을 겪는 외국인 민원인을 위해 영어, 중국어, 일본어, 베트남어, 필리핀어(타갈로그어), 태국어 등 6개 국어 민원 통역서비스를 시행한다. 시는 2019년부터 통역 서비스를 실시하고 있다. 이번에는 내부 직원 중 영어, 일본어, 중국어에 능통한 8명과 영천시 다문화가족지원센터와 협업을 통해 베트남어, 필리핀어(타갈로그어), 태국어에 능통한 통역요원 3명을 명예 민원통역관으로 지정했다.
지정된 민원통역관은 민원서류 작성 및 안내는 물론, 타 부서와의 업무 연결이 필요한 민원을 처리할 때 부서 담당자와 민원인 사이에서 의사소통의 가교 역할을 했다. 이경미기자",http://www.newgbnews.com/news/view.php?idx=307633
경북,"경산, 다양한 소상공인 지원 ‘빛나는 성과’",일간경북신문 - 이종구 기자,2023/05/31,,http://www.newgbnews.com/news/view.php?idx=307632
경북,“주민동의 없는 사용 핵연료 저장 시설 반대”,일간경북신문 - 서경규 기자,2023/05/31,,http://www.newgbnews.com/news/view.php?idx=307631
경북,"깨끗한 군위 만들기, 공공근로 사업 종료",일간경북신문 - 박효명 기자,2023/05/31,"군위군 군위읍은 지난달 26일을 마지막으로 23년 상반기 군위읍 공공근로 지원사업을 종료했다.
또한, 군위군 군위읍 공공근로자 25명은 3월 2일부터 3개월간 군위읍 구석구석을 이동하며 깨끗한 군위를 만들기 위해 노력했다.
공공근로자들은 군위읍 경계인 무성리 및 대흥리에서 시작하여 주요 도로 주변과 하천 산책로 등을 청소하였으며, 아름다운 시가지를 만들기 위해 꽃심기 등 화단조성에도 힘썼다.
손숙옥 반장은 “10년 동안 공공근로를 하면서 힘이 들기도 했지만, 내 집 청소하듯 열심히 했다”며 “청소 후 깨끗한 주변의 모습을 보면 마음이 뿌듯해진다”고 소감을 전했다.
장판철 군위읍장은 “늘 깨끗한 군위읍을 위해 고생해 주셔서 감사하고, 아무 사고없이 안전하게 마칠 수 있어 다행이다. 하반기 공공근로에도 꼭 신청하셔서 가을철 군위읍의 환경정비를 위해 힘써달라”고 인사하였다. 박효명기자",http://www.newgbnews.com/news/view.php?idx=307630
경북,"김천, 여름철 집중호우 배수펌프장 점검",일간경북신문 - 문장훈 기자,2023/05/31,,http://www.newgbnews.com/news/view.php?idx=307629
경북,"구미시장, 고향사랑기부 챌린지 동참",일간경북신문 - 김학전 기자,2023/05/31,,http://www.newgbnews.com/news/view.php?idx=307628
경북,"의성, 노인 의료·돌봄 통합지원 추진",일간경북신문 - 박효명 기자,2023/05/31,"의성군은 지난달 25, 26일 이틀간 청소년문화의집 다목적강당에서 노인 의료-돌봄 통합지원 시범사업 수행기관과 함께 워크숍을 실시했다고 밝혔다.
이날 워크숍은 시범사업 수행기관의 핵심주축인 읍면 찾아가는 보건복지팀, 보건소, 보건지소, 보건진료소, 공중보건의, 시범사업 추진단의 각 영역별 역할 공유 및 공동 협력을 위한 시간을 가지기 위해 마련된 자리로 행정의 공백을 최소화하기 위해 대상자 별로 나눠 양일간 걸쳐 진행되었다.
교육은 장명화 보건복지인재원 교수님의 시범사업 관련 찾아가는 보건-의료라는 주제 강의를 시작으로, 건강보험공단 통합돌봄연구센터의 이기주박사님의 시범사업 관련 복지분야 강의와 보건과 복지의 협력강화를 위한 레크레이션 강의로 협력을 다졌고 끝으로 애로사항과 건의사항에 대해 토론하는 시간을 가졌다.
의성군은 「노인 의료-돌봄 통합지원」시범사업 공모사업에 선정되어, 그동안 민과 관이 함께 시범사업 추진단을 구성하고 실행계획서 작성을 위한 컨설팅, 회의 등을 지속적으로 추진해왔으며, 최종 실행계획서를 바탕으로 7월부터 지역사회통합돌봄의 체계를 갖추어 나갈 예정이다. 의성군수는“이번 워크숍은 수행기관이 시범사업을 위해 역할을 잘 수행할 수 있는 발판의 시간이었길 바란다”고 했다. 박효명기자",http://www.newgbnews.com/news/view.php?idx=307627
경북,"상주, 복지시설 관계자와 ‘소통의 장’",일간경북신문 - 김학전 기자,2023/05/31,,http://www.newgbnews.com/news/view.php?idx=307626
경북,"상주, 8일까지 ‘찾아가는 현장민원실’ 운영",일간경북신문 - 김학전 기자,2023/05/31,"상주시는 지난달 30일부터 오는 8일까지 2주간(화, 수, 목) 경북대 상주캠퍼스에서 ‘찾아가는 현장민원실’을 운영한다.
아울러, 찾아가는 현장민원실은 상주시 인구 증가 및 학생들의 민원 신청 편의를 위해 매년 3월, 5월, 11월 3차례 운영되며 전입신고와 전입 지원금 및 전입 학생 기숙사비를 현장에서 신청받고 있다.
상주시는 전입신고 후 6개월이 지나면 전입 중·고·대학생에게 전입 지원금 20만 원(상주화폐)을 지급하고 주소 유지 시 6개월마다 졸업까지 최대 8회 지원하고 있다. 또한, 기숙사로 전입신고 시 학기마다 기숙사비를 최대 8회까지 지원하고 있다.
강영석 상주시장은 “찾아가는 현장민원실 운영으로 더 많은 학생이 상주시로 전입하고 많은 혜택을 누릴 수 있도록 다양한 인구 증가 시책을 펼쳐 나가겠다.”라고 말했다. 김학전기자",http://www.newgbnews.com/news/view.php?idx=307625
경북,“구미시민이라면 특별 혜택 먼저 확인하세요”,일간경북신문 - 김학전 기자,2023/05/31,"인구정책 추진상황 보고회
전입 지원 등 90여건 점검
구미시는 지난달 30일 부서장 등 80여 명이 참석해「구미시 인구정책 추진상황 보고회」를 열었다.
이번 보고회는 인구감소에 대응하고 지역 활력 제고를 위해 지난해부터 발굴해온 90여 건의 인구정책 사업의 추진상황을 점검하고 향후 계획 및 부서 간 협력 방안 등을 점검하기 위해 마련됐다.
특히, 인구감소 대응을 위한 핵심시책 뿐만 아니라 시가 최근 공들여 추진하고 있는 관내 전입자에 대한 지원과 구미시민만이 누릴 수 있는 특별한 혜택 강화에 대해 중점적으로 논의됐다.
▶시는 우선 전입자에 대한 혜택을 대폭 강화하기로 했다. 올해 하반기(‘23.8월)부터 전입세대 당 일선정품 쌀 10kg 등 구미농산물을 전입기념품으로 지급하고, 전입 고등학생 및 대학생에게는 전입지원금을 전입 후 1년에 걸쳐 20만 원씩 지급한다.
또한, 구미로 전입한 시민이 즉시 피부에 와 닿을 수 있도록 공공시설 이용료에 대한 다양한 혜택도 마련했다. 올해 하반기부터 전입일로부터 1년간 공영주차장 무료 이용의 기회를 제공하고 문화예술회관에서 매년 12회 가량 펼쳐지는 기획공연에 대해 50% 할인 혜택도 제공한다.
이밖에 전입자를 위한 구미승마장 무료 승마체험(2회) 기회를 제공하고 올해 10월 개관 예정인 구미영상미디어센터 이용료도 1년간 면제한다.
▶새로 전입하는 시민에 대한 혜택뿐만 아니라 기존 시민에 대한 혜택도 확대한다. 예약이 어려울 정도로 사계절 인기있는 구미 캠핑장은 5월부터 구미시민에 한해 50% 우선예약 제도를 시행했으며, 문화예술회관 기획공연도 30% 할인 혜택을 제공한다.
또한, 구미에코랜드 및 박정희대통령역사자료관 50%, 옥성자연휴양림40%, 구미캠핑장 및 신라불교초전지마을 20% 등 시민 할인율을 적용 중이며 올림픽기념관, 금오테니스장, 구포생활체육공원 등 생활체육시설에 대해서는 향후 물가상승에 따른 요금인상 시 구미시민에 대해서 기존 요금을 유지할 방침이다.
그뿐만 아니라 시는 각 시설을 이용할 때 번거로운 증빙서류 구비를 준비할 필요 없이 간편하게 감면받고 시설을 이용할 수 있도록 시민 간편확인시스템 도입을 추진 중이다. 김학전기자",http://www.newgbnews.com/news/view.php?idx=307624
경북,"안동 영가초, 경북도의회 의정 체험활동",일간경북신문 - 이기화 기자,2023/05/31,,http://www.newgbnews.com/news/view.php?idx=307614
경북,"안동, 전국 최초 적극 행정 ‘우수사례’",일간경북신문 - 이기화 기자,2023/05/31,"안동시가 시행한 ‘경로당 맞춤형 간편회계 서식 보급’이 행정안전부에서 주관한 그림자·행태규제 개선 1/4분기 우수사례로 선정됐다.
행안부는 각종 불합리한 규제를 개선해 주민행정 만족도를 높이고자 분기마다 추진과정 노력도와 개선 효과, 타 지자체 확산 가능성 등을 기준으로 적극행정 사례를 선정하고 있다.
올 1분기에는 전국에서 제출된 391건의 사례를 검토해 다른 지자체로 공유·확산할 필요성이 높다고 인정되는 8건을 우수사례로 선정했다. 안동시는 주민편의 증진분야 우수사례에 포함됐다.
‘경로당 맞춤형 간편 회계 서식 보급’은 복잡한 회계처리 절차와 기준 으로 어려움을 겪는 노령층을 배려하고자 하는 담당 공무원의 고민에서 출발했다.
대다수 경로당 회원들이 고령으로 보조금 집행에 어려움을 겪었고, 집행 규정에 맞지 않게 사용해 반납 또는 환수되는 사례도 빈번하게 발생했다.
이에 어르신들이 간편하고 쉽게 사용할 수 있는 회계 서식을 전국에서 최초로 제작·보급했다.
또한, 경로당에서 회계를 맡는 경로당 임원 어르신들을 대상으로 서식 활용 방법 등에 대한 특별 교육도 진행했다.
시는 경로당 맞춤형 간편회계 서식 보급을 비롯해 시민들의 고충·불편을 해결하는 실질적인 시민 중심의 행정 서비스를 더욱 발굴·보급할 수 있도록 박차를 가해나갈 계획이다.이기화기자",http://www.newgbnews.com/news/view.php?idx=307602
경북,동남아 한류 열풍 타이베이서 안동 관광 홍보,일간경북신문 - 이기화 기자,2023/05/31,"안동시가 동남아 한류 열풍의 중심지인 타이베이에서 안동 관광의 맛과 멋을 선보였다.
시는 지난달 26일부터 29일까지 나흘간 대만 타이베이 세계무역센터에서 열린‘2023 타이베이 국제관광박람회’에서 현지 관광객 유치를 위한 다양한 홍보 활동을 펼쳤다.
‘2023 타이베이 국제관광박람회’는 대만 교통부 관광국과 타이베이시 정부가 주최하고 타이베이시여행협회가 주관하는 관광박람회로 13개국 250개 관광 관련 업체·기관이 참가하고 30만 6천여 명의 관람객이 방문했다.
이번 박람회에서 안동시는 단독으로 안동시 홍보부스을 운영해 일반 관람객과 현지 아웃바운드 여행사를 대상으로 하회마을, 병산서원, 도산서원, 봉정사, 하회별신굿탈놀이 등 유네스코 유산과 안동국제탈춤페스티벌을 적극 홍보했다.
특히, 유네스코 세계유산과 함께하는 안동의 4계절 포토존과 나만의 하회탈 만들기 체험은 안동에 대한 관심을 이끌며 관람객으로부터 폭발적인 인기를 얻었다.
또한, 안동 알리기 퀴즈 이벤트, 여행사 바이어 상담회, 현지 언론(ERA TV, NEXT TV)과의 인터뷰로 안동 관광 명소와 다채로운 매력을 알렸다.
안동시 관계자는 ""대만 현지인과 관광업계를 대상으로 안동의 다양한 관광자원을 소개하였으며, 이번 박람회를 계기로 지속적인 마케팅 활동을 펼쳐 보다 많은 대만 관광객 유치에 힘쓰겠다""라고 밝혔다.이기화기자",http://www.newgbnews.com/news/view.php?idx=307601
경북,안동 이런 곳이 있어? 농촌체험 어때요?,일간경북신문 - 이기화 기자,2023/05/31,"안동시농업기술센터가 지난달 30일 지역 내 국·공립 유치원 관계자 15명을 초청해 농촌체험농장 팸투어를 실시했다.
‘팸투어’란 지방 자치 단체가 관광지나 여행상품을 홍보하기 위하여 협력업체 등을 초청하여 관광을 제공하는 것이다.
이번 팸투어는 교육기관의 농업·농촌에 대한 이해도를 높이고 농장 인지도 제고를 통해 농장 재방문 유도 및 농촌지역 경제 활성화를 도모하고자 추진했다.
이번 팸투어는 남선면에 위치한 「안동흙돼지체험농장」에서 떡갈비만들기 체험을 시작으로, 농가맛집 「안동화련」에서 채련정식을 식사 후, 남후면에 위치한 「쪽빛아침」에서 인견이불 염색체험과 「토락토닥」에서 도자기체험을 통해 안동이 가진 우수한 농업·농촌 관광자원을 둘러보며 다양한 체험프로그램을 경험하고 홍보하는 시간을 가졌다.
안동시농업기술센터 관계자는 “이번 팸투어는 농촌 체험·교육·치유농장과 교육기관 간 접목으로 농촌의 교육적 가치와 현장 체험활동 중요성을 느낄 수 있는 유익한 시간이 되었다”라며 “농촌체험농장 육성과 활성화에 지속적으로 관심을 쏟을 것이다”라고 말했다.이기화기자",http://www.newgbnews.com/news/view.php?idx=307600
