지역명,기사제목,기자이름,날짜,내용,링크
포항,"포항, 새로운 번성 ‘인구정책’ 모색",일간경북신문 - 김재원 기자,2023/05/24,"포항시는 24일 포스코국제관 1층 국제회의장에서 ‘지방소멸시대, 지방의 새로운 번성을 향해’라는 주제로 인구정책 관련 심포지엄을 개최했다고 밝혔다.
이날 1부에서는 전영수 한양대 국제대학원 교수가 ‘지방소멸과 로컬리즘’을 주제로 위기에 맞설 지역사회의 발전전략을, 정석 서울시립대 도시공학과 교수가 ‘더 행복한 로컬’을 주제로 지역 한달살이와 일본의 사례에 대해 발표했다.
이어진 특강에서는 주부 작가이자 개그맨인 이정수 씨가 ‘가족에게 환영받고 있나요?’란 강의를 통해 저출산 시대 가족과 가정의 소중함을 전했다.
2부 패널토론에서는 이재원 포항학연구회장(포스텍 융합문명연구원 겸임교수)이 좌장을 맡아 김철규 한동대 총학생회장, 곽정원 위덕대 전 총학생회장, 최은주(40대, 초등 엄마) 씨, 정소윤(30대, 사회초년생) 씨가 참여해 각각 청년, 학부모의 시각에서 바라본 지방의 문제점과 바라는 점에 대한 열띤 토론을 펼쳤다.
정경원 자치행정실장은 “우리 사회의 주축을 이루고 있는 청년층과 사회초년생, 학부모의 실생활에서 필요하다고 생각되는 다양한 정책들이 인구를 끌어들이는 밑거름이 될 것”이라며, “오늘 제안된 정책 제안과 의견을 시정에 적극 반영하겠다”고 밝혔다. 김재원기자",http://www.newgbnews.com/news/view.php?idx=307011
포항,"포항국제불빛축제, 관람~ 귀가 ‘안전’에 총력",일간경북신문 - 김재원 기자,2023/05/24,,http://www.newgbnews.com/news/view.php?idx=307010
포항,"포항, 가장 사랑받는 브랜드 이차전지 선도 ‘대상’",일간경북신문 - 김재원 기자,2023/05/24,,http://www.newgbnews.com/news/view.php?idx=307009
포항,"포항, 태풍 북상 ‘인명피해 제로’ 추진",일간경북신문 - 김재원 기자,2023/05/23,"포항시는 태풍과 폭염 등 여름철 자연 재난으로부터 시민들의 안전을 지키기 위해 ‘인명피해 제로화’를 최우선 목표로 사전 대응을 강화하고 있다고 밝혔다.
시는 23일 재난안전대책본부 상황실에서 제2호 태풍 ‘마와르’ 북상 및 엘니뇨 대비 대책 회의를 개최했다.
이날 회의는 제2호 태풍 ‘마와르’가 북상함에 따라 선제적으로 태풍의 예상 진로와 기상 전망을 파악하고 발생 가능한 긴급 상황에 대비하기 위한 대책을 공유했다.
시의 13개 협력부서는 물론 농어촌공사, 포항지방해양수산청, 철강관리공단, POSCO 등 유관기관이 함께 참여해 분야별 대처계획을 논의하고, 피해 방지를 위해 총력을 기울이기로 했다.
또한 올여름 기상 전망을 공유하고 엘니뇨 현상으로 인한 폭염·폭우 등 각종 재난에 긴밀하게 대처할 방안에 대해 집중적으로 논의했다.
시는 지난 힌남노 태풍 피해 지역을 중심으로 복구와 피해 재발 방지 사업에 총력을 기울여 왔으며, 신속한 상황관리와 응급대처, 주민대피를 위한 사전 대비와 훈련을 실시하는 등 재난에 대비해 사각지대가 발생하지 않도록 촘촘한 안전망을 구축해오고 있다.
산사태 및 급경사지, 둔치주차장, 침수 우려 도로 등 인명피해 위험지역에 대한 지속적인 순찰 활동과 안전 점검을 대대적으로 강화하고, 인명피해 우려 지역 사전통제 기준 마련 및 주민대피계획 수립 후 주민대피계획서에 반영해 신속한 대피가 가능하도록 준비하는 한편 재난 상황을 대비한 상황관리와 대피 훈련도 실시할 계획이다. 이와 함께 기존에 지정된 인명피해 우려 지역 50여 곳의 관리강화를 비롯해 침수 취약 시설 17곳, 산지 태양광 1곳, 해안시설 1곳, 시특법시설 3곳, 산사태 우려 지역 3곳을 추가했다. 김재원기자",http://www.newgbnews.com/news/view.php?idx=306843
포항,무단 방치 체납 차량 정리기간,일간경북신문 - 김재원 기자,2023/05/23,"포항시는 장기간 방치된 차량의 체납액 징수 및 체납 차량 발생의 사전 예방을 위해 5월부터 7월까지를 특별 정리 기간으로 설정하고, 체납 차량을 일괄 공매할 계획이라고 밝혔다.
공매 차량 보관소 입고 후부터는 자동차세 및 과태료(자동차손해배상보장법 위반, 검사 지연)가 부과되지 않아 방치 차량들의 납세 부담을 덜어주는 효과도 있다. 또한 시는 국세 및 지방세, 저당 등 배분 순위에서 밀려 강제처분까지 이뤄지지 않아 처분에 어려움을 겪는 세외수입 체납자의 압류 자동차를 대상으로 공매제도도 적극적으로 추진한다고 밝혔다. 김재원기자",http://www.newgbnews.com/news/view.php?idx=306841
포항,"포항·산학관, 이차전지 전문 인재 양성 ‘속도’",일간경북신문 - 김재원 기자,2023/05/23,,http://www.newgbnews.com/news/view.php?idx=306839
포항,‘화려한 쇼’ 포항국제불빛축제 안전점검 ‘꼼꼼 또 꼼꼼’,일간경북신문 - 김재원 기자,2023/05/23,,http://www.newgbnews.com/news/view.php?idx=306836
포항,"최정우, 인도 JSW사와 친환경 철강사업 협력",일간경북신문 - 김재원 기자,2023/05/23,,http://www.newgbnews.com/news/view.php?idx=306794
포항,"포스코, 국회·정부·학계와 저출산 해결 나섰다",일간경북신문 - 김재원 기자,2023/05/23,,http://www.newgbnews.com/news/view.php?idx=306792
포항,포항에 ‘귀어귀촌 거점지원센터’ 전국 최초 문 연다,일간경북신문 - 김재원 기자,2023/05/22,,http://www.newgbnews.com/news/view.php?idx=306732
포항,불빛축제 보고 우수 농특산물도 만나보세요,일간경북신문 - 김재원 기자,2023/05/22,,http://www.newgbnews.com/news/view.php?idx=306722
포항,전국 최대 규모 소비 촉진 페스티벌 열린다,일간경북신문 - 김재원 기자,2023/05/22,,http://www.newgbnews.com/news/view.php?idx=306721
포항,안전·편리한 포항 “가이드라인 그린다”,일간경북신문 - 김재원 기자,2023/05/22,"포항시는 안전하고 편안한 사람 중심 행복 도시 포항 실현을 위해 ‘유니버설디자인 기본계획 및 가이드라인’을 수립한다.
시는 지난 19일 김남일 포항시 부시장, 유니버설디자인 관련 전문가, 용역사, 관계 공무원이 참석한 가운데 착수보고회를 개최했다고 밝혔다.
유니버설디자인(Universal Design)이란 장애·연령·성별·언어 등과 관계없이 모든 시민이 안전하고 편리하게 이용할 수 있는 환경을 조성하는 디자인 접근방식을 의미한다. 장애인·고령자·어린이·임산부·외국인 등 사회 구성원 모두를 배려한다는 의미로, 모두를 위한 디자인을 뜻한다.
이번 용역은 종합적이고 체계적인 기본계획과 단계별 주요 시책 및 제도개선 방안을 마련하고, 다양한 유형별 사례를 담은 맞춤형 지침서인 가이드라인을 개발해 사업 추진 시 기본 지침으로 활용하기 위해 실시된다. 김재원기자",http://www.newgbnews.com/news/view.php?idx=306719
포항,"포항, 고품질 쌀 재배단지 거점 조성",일간경북신문 - 김재원 기자,2023/05/22,,http://www.newgbnews.com/news/view.php?idx=306718
포항,"포항, 친환경 미래 에너지 도시 ‘온힘’",일간경북신문 - 김재원 기자,2023/05/22,"포항시는 친환경 미래 에너지인 수소연료전지에 기반한 수소 산업을 적극 육성하며 수소에너지 경제를 선도할 ‘K-수소 중심도시 도시’ 도약에 박차를 가하고 있다고 22일 밝혔다.
이를 위해 시는 △수소연료전지인증센터 운영 △수소 전문기업 육성 등을 중점 추진 전략으로, 정부의 수소에너지 전환 정책에 적극 부응하고 있다.
먼저 포항시는 경북도와 힘을 합쳐 중점 전략인 수소연료전지 클러스터를 구축하기 위한 초석으로 수소연료전지 인증센터를 선제적으로 구축, 운영하고 있다.
인증센터는 대경권 연료전지 테스트베드로 구축된 장비를 통합해 2019년 포항테크노파크에 개소, 2021년부터 한국인정기구(KOLAS)로부터 국제공인 시험 기관으로 지정받았다. 이곳은 연료전지 기업과 협력해 생산기술 개발, 핵심부품과 소재 국산화 및 제품 안정성·신뢰성 평가 등을 지원한다.
또한 수소연료전지 제품·부품 인증 및 평가 장비 32종을 구축하고 한국산업표준(KS) 인증 위탁기관으로 지정받기 위한 절차를 진행 중이다. KS인증이 완료되면 국내 유일의 수소연료전지 전 분야(KOLAS, KS인증, 대용량 설비) 검인증이 가능한 인증센터로 발돋움할 것으로 기대하고 있다.
이를 통해 기업 애로사항 해결, 연료전지 분야 R&D, 검인증 업무 지원 등이 가능해지며, 부품 국산화 선도로 산업 기반을 튼튼하게 구축하고 수출 산업 육성으로 글로벌시장 우위를 확보하기 위한 표준화를 선점해 나갈 방침이다. 무엇보다 지난 2021년 예비타당성 조사 대상 사업으로 선정된 ‘포항 수소연료전지 발전 클러스터 구축사업’이 예비타당성 조사를 거쳐 2024년부터 본격 조성되면 기업 집적화단지, 연료전지 부품·소재 부품성능평가센터, 실증단지 등이 갖춰지면서 기업 유치에 탄력을 받을 전망이다. 김재원기자",http://www.newgbnews.com/news/view.php?idx=306717
포항,"포항시민 고교평준화, 긍정·부정 팽팽",일간경북신문 - 김재원 기자,2023/05/22,"박용선 경북도의원 조사
포항시민의 고교평준화 정책 인식 조사에서 긍정과 부정이 오차범위내에서 팽팽한 것으로 나타났다.
박용선 경북도의원이 여론조사 전문기관인 코리아정보리서치에 의뢰해 조사한 ‘포항시 고교평준화 인식도 여론조사’ 결과에 따르면 ‘긍정’ 46.9%, ‘부정’ 45.9%, ‘모름’ 7.2%로 조사됐다.
계층별로는 남성은 ‘부정(52.1%)’ 비율이 높았고, 여성은 ‘긍정(50.8%)’ 비율이 높아 성별 간 차이를 보였다. 지역별로는 남구 ‘긍정’ 47.8%, ‘부정’ 46.0%, 북구 ‘긍정’ 46.2%, ‘부정’ 45.7%였다.
연령별로는 20대 ‘긍정’ 37.6%, ‘부정’ 62.4%, 30대 ‘긍정’ 37.0%, ‘부정’ 58.1%, 40대 ‘긍정’ 44.6%, ‘부정’ 52.0%로 부정 비율이 높았고, 50대 ‘긍정’ 52.1%, ‘부정’ 37.6%, 60세이상 ‘긍정’ 52.5%, ‘부정’ 36.5%로 긍정 비율이 높았다.
긍정평가 이유는 ‘학교간 격차해소’가 38.0%로 가장 높았고, ‘학습부담 저감’ 23.4%, ‘입시위주교육 폐단개선’ 19.5%, ‘대도시집중 현상해소’ 8.3%, ‘사교육저감’ 7.4%, ‘기타’ 3.4%순 이였다. 부정평가 이유는 ‘학력수준 하향평준화’가 44.7%로 가장 높았고, ‘우수학생의 타 도시 유출’ 19.7%, ‘공교육 황폐화’ 11.6%, ‘학교평판도 저하’ 10.1%, ‘비평준화쏠림’ 8.3%, ‘기타’ 5.6%순 이였다. ‘고교평준화 정책 방향성’에 대해서는 ‘폐지’ 37.2%, ‘개선후 유지’ 38.4%, ‘현행 유지’ 17.1%, ‘모름’ 7.3% 순으로 조사됐다.
남성은 ‘폐지’ 43.5%, 여성은 ‘개선후 유지’ 42.8%로 가장 높았고, 지역별로는 남구는 ‘폐지’ 38.8%, 북구는 ‘개선후 유지’ 38.9%로 다소 높았다.
연령별 조사에서는 20대의 ‘폐지’ 응답 비율이 53.7%로 가장 높았고, 30대(41.5%), 40대(42.9%)도 폐지 비율이 높았다. 50대(47.9%)와 60세 이상(37.1%)은 ‘개선후 유지’가 가장 높게 나타났다.
‘비평준화 지역인 경주시와 비교했을 때 주요 대학 진학률이 1/3 수준으로 줄어든 것에 대해 알고 있는가’를 물은 학력 저하 인지도 조사에서는 54.2%가 ‘알고 있다’, 45.8%는 ‘모른다’라고 응답했다.
전체 연령층에서 비교적 최근 학업을 마쳤다고 유추되는 20대 연령층의 학력 저하에 대한 인지도가 83.0%로 가장 높았고, 30대 52.5%, 40대 53.2%, 50대 51.4%, 60세이상 45.3%로 연령층이 높아질수록 인지도가 낮게 나타났다. 학부모의 인지도(59.4%)가 비학부모(50.7%)층에 비해 높게 나타나 자녀 교육에 대한 관심도가 결과에 반영된 것으로 해석된다.
‘경북내 고교평준화 단독 시행 인지도’ 조사에서는 ‘인지’ 75.3%, ‘미인지’ 24.7%로 조사됐다. 초‧중‧고 재학중인 자녀가 있는 학부모층의 인지도(79.0%)가 비학부모층(72.9%)에 비해 높았고, 연령별로는 30대(86.7%)와 40대(85.8%)가 타 연령층에 비해 높게 나타났다. 이번 조사는 5월12일부터 14일까지 포항시에 거주하는 만 18세 이상 성인 남녀 1002명 대상으로 이뤄졌다. 구조화된 질문지를 이용한 유‧무선 전화 ARS 여론조사 방식을 활용했으며 표본 오차는 95% 신뢰 수준에서 ±3.1%포인트다. 김재원기자",http://www.newgbnews.com/news/view.php?idx=306677
포항,‘태풍 힌남노’ 지방하천 복구 첫 삽 뜬다,일간경북신문 - 일간경북신문 기자,2023/05/21,,http://www.newgbnews.com/news/view.php?idx=306578
포항,포항 ‘맞춤형 입시전략’ 대학 진학 박람회,일간경북신문 - 김재원 기자,2023/05/21,"포항시는 오는 6월 3일 오전 10시부터 오후 5시까지 포항실내체육관에서 수험생과 학부모를 대상으로 ‘2024학년도 대학진학박람회’를 개최한다고 밝혔다.
이번 박람회는 수험생과 학부모들의 입시 불안을 해소하고, 급변하는 입시전형에 따른 대응 전략을 제공해 지역의 교육경쟁력을 강화하고 우수한 인재를 양성하기 위해 마련된다.
서강대, 중앙대, 경북대 등 전국 50여 개 대학이 참가한 이번 박람회는 대학별 다양한 입시전형에 대비한 입학사정관의 1:1 진학 상담 뿐만 아니라 현직 진학 교사의 1:1 진학 상담, 명문대 대학생 멘토링 등 다채로운 프로그램을 운영하며, 지역의 수험생 및 학부모들의 고민과 궁금증 해소하고 대입전형에 대한 다양한 정보와 맞춤형 진학 설계를 지원할 예정이다.
박람회장의 모든 부스는 학생과 학부모를 비롯해 관심 있는 시민 누구나 사전 예약 없이 현장 접수로 참여 가능하며, 각 대학 수시모집 안내 책자와 대학별 입시홍보물, 일부 불참대학의 수시모집 책자도 제공할 예정이다.
정진철 교육청소년과장은 “이번 박람회를 통해 성공적인 입시전략을 수립해 지역을 대표하는 우수한 미래 인재로 거듭나기를 기대한다”고 말했다.
한편, 시는 오는 8월 전문 입시 컨설턴트가 맞춤형 대입 전략을 도와주는 ‘대입 상담캠프’를 개최할 예정이다. 이 행사는 수시를 준비하는 고3 학생들을 대상으로 진행하는 상담으로 7월 말 선착순으로 신청받을 예정이다. 김재원기자",http://www.newgbnews.com/news/view.php?idx=306525
포항,포항보호관찰소협의회 ‘벽화 봉사활동’,일간경북신문 - 김재원 기자,2023/05/21,,http://www.newgbnews.com/news/view.php?idx=306524
포항,"포항, 우수 농산물 판매 ‘직거래장터’ 운영",일간경북신문 - 김재원 기자,2023/05/21,,http://www.newgbnews.com/news/view.php?idx=306522
포항,포항 “현장서 주민참여 제안 듣다”,일간경북신문 - 김재원 기자,2023/05/21,"포항시 주민참여예산위원회는 20일 철길 숲 한터마당에서 주민참여 예산제도에 대한 시민 관심과 이해도를 높이기 위한 거리홍보 캠페인을 개최했다고 밝혔다.
이날 개최된 캠페인에서는 주민참여예산제도에 대한 홍보와 더불어 2024년 포항시 예산 편성에 반영할 주민참여예산 제안사업 발굴을 위해 제안서 작성 방법을 안내하고 작성된 제안서를 접수했다.
이날, 거리홍보 캠페인에서 주민참여예산위원회 김도준 위원장은 “주민참여예산제도는 주민 스스로 생활 속에서 필요한 사업들을 발굴하고 제안함으로써 재정민주주의를 실현할 수 있는 좋은 제도”라고 말했다.
아울러, “앞으로도 캠페인을 추가로 개최하는 등 다양한 방안을 통해 시민들이 관심과 참여를 유도할 수 있도록 노력하겠다”고 전했다.
한편, 포항시는 주민참여예산제도를 4월 1일부터 6월 30일까지 약 90일간 온·오프라인을 통해 2024년도 예산에 반영할 주민참여예산 제안사업을 접수하고 있다. 김재원기자",http://www.newgbnews.com/news/view.php?idx=306521
포항,포항국제불빛축제 사랑상품권 10% 할인,일간경북신문 - 김재원 기자,2023/05/21,"포항시가 오는 26일부터 28일까지 형산강 체육공원 일원에서 개최되는 ‘2023 포항국제불빛축제’ 기간에 관광객과 시민을 대상으로 카드·모바일형 포항사랑상품권(이하 포항사랑카드)을 10% 특별할인 판매한다고 밝혔다.
이번 할인행사는 포항국제불빛축제를 즐기러 포항을 찾는 관광객과 시민들을 대상으로 진행되며, 포항사랑카드를 구매(충전)해 축제 현장과 주요 관광지에서 사용함으로써 지역경제 활성화에 기여할 것으로 기대된다.
포항국제불빛축제 개막일인 26일에는 오전 12시 15분부터 90억 원 예산 소진 시까지 포항사랑카드 모바일 앱(IM#)을 통한 온라인 판매를 진행하고, 26일부터 28일까지 축제장에서는 현장 판매를 진행한다.
구매 한도는 기존 상시 월 50만 원(연 600만 원)과는 별도로 추가 한도를 적용해 최대 20만 원까지 충전할 수 있으며, 5월에 이미 충전한 사용자도 특별한도 제공으로 10% 할인 혜택을 누릴 수 있다.
현장 판매는 ㈜대구은행의 이동 모바일 뱅크를 통해 26일~28일 오후 1시부터 6시까지 운영한다. 축제장 방문객을 대상으로 포항사랑카드 발급과 충전을 진행하며, 본인확인(신분증) 후 현금으로 충전할 수 있다.
권혁원 일자리경제국장은 “포항국제불빛축제 기간 포항사랑카드 특별할인 판매를 통해 시민들과 관광객들의 소비를 진작시켜 소상공인들에게 힘을 싣고 지역경제에 활력을 불어넣기를 기대한다”고 말했다.
한편, 포항사랑카드는 포항사랑상품권 가맹점에서 사용할 수 있으며, 2만 1,000여 개소 가맹점에서 편리하게 사용할 수 있다. 김재원기자",http://www.newgbnews.com/news/view.php?idx=306520
포항,포항·해수부 ‘수산 정책’ 어업인 목소리 청취,일간경북신문 - 김재원 기자,2023/05/21,,http://www.newgbnews.com/news/view.php?idx=306519
포항,포항 “구제역 유입 차단 총력 기울인다”,일간경북신문 - 김재원 기자,2023/05/18,,http://www.newgbnews.com/news/view.php?idx=306410
포항,"포항 고향사랑기부제, 답례품 18종 선정",일간경북신문 - 김재원 기자,2023/05/18,"포항시는 18일 답례품 선정위원회를 개최하고, 포항시 고향사랑기부제 답례품을 추가 선정했다.
또한, 추가로 선정된 답례품은 (제조 물품)△한지 공예품 (농·수산물)△문어숙회 △오징어 △산딸기 △단호박 (농·수산 가공품)△ABC 주스 △복분자즙 △와송 사과즙 △조미 소스 △샹떼블루와인 △블루베리청 △블루베리즙 △발효 한방차 등으로 총 7개 공급업체 18종이다.
이번 답례품 추가 선정은 지난 4월 체험·관광형 답례품을 선정한 데 이어 기부자들의 선택권을 확대하기 위한 것으로, 답례품은 고향사랑e음 답례품 사이트(https://shop.ilovegohyang.go.kr/)에서 확인할 수 있다.
포항시 관계자는 “시행 5개월 차에 접어든 고향사랑기부제의 지속 확산을 위해 다양한 답례품을 발굴해 기부자들을 만족시키겠다”며, “기부 문화 정착을 위해 지자체를 응원하는 고향사랑기부제에 더 많은 관심과 참여를 부탁한다”고 말했다. 김재원기자",http://www.newgbnews.com/news/view.php?idx=306408
포항,"포항평생학습원, 바닥분수 ‘새단장’",일간경북신문 - 김재원 기자,2023/05/18,,http://www.newgbnews.com/news/view.php?idx=306407
포항,"‘시민 안전 확보’ 포항, 빗물펌프장 가동훈련",일간경북신문 - 김재원 기자,2023/05/18,"포항시는 여름철 집중호우와 태풍을 대비해 형산 빗물펌프장 외 14개소를 대상으로 대응력 강화를 위한 시 운전 및 점검을 18일 실시했다.
이번 가동훈련은 재해 상황에 대비해 펌프장 운영자들이 신속하고 정확하게 대응하도록 하고 시설의 정상 작동 여부를 사전에 점검하기 위해 실시됐다.
빗물펌프장은 침수 예방에 중요한 역할을 하는 시설로, 시는 빗물펌프장의 안정적인 운영을 통해 주민의 생명과 재산을 보호하기 위해 여름철 우기 전 사전 점검으로 도시 침수를 예방하고 비상 상황에 신속, 정확하게 대응할 방침이다.
이날 훈련을 주관한 이창우 맑은물사업본부장은 “무엇보다 재해 상황을 대비한 신속하고 효율적인 대응 능력이 중요하다”며, “지역 사회의 안전을 최우선으로 시민들에게 안전한 주거 환경을 제공하기 위해 최선을 다하겠다”고 말했다.
한편, 포항시는 대형 태풍과 기록적 폭우를 동반한 기상이변에 대비하기 위해 배수 능력을 상향하는 빗물펌프장 신·증설 사업을 본격 추진할 계획으로, 상습 침수지역인 대송면 행정복지센터 인근 및 구룡포읍 일원에 2개소를 신설하고, 창포동·대송면·송도동·연일읍·철강공단 등 기존 빗물펌프장을 증설해 배수 능력을 20~30년 빈도에서 50년 빈도로 상향할 계획이다.
이를 위해 포항시는 지난해 11월 환경부로부터 하수도 정비 중점 관리지역 4개소를 지정받아 국비 880억 원을 확보했으며, 오는 2028년까지 시비 587억 원 등 총 1,467억 원을 투입할 예정으로 현재 하수도 정비 중점 관리지역 정비 대책 수립용역을 추진 중이다고 밝혔다. 김재원기자",http://www.newgbnews.com/news/view.php?idx=306406
포항,‘보고 또 보고’ 안전한 포항국제불빛축제 만들기,일간경북신문 - 김재원 기자,2023/05/18,,http://www.newgbnews.com/news/view.php?idx=306405
포항,"이차전지 초강대국, 포항에 답이 있다",일간경북신문 - 일간경북신문 기자,2023/05/17,,http://www.newgbnews.com/news/view.php?idx=306260
포항,경북도 부지사가 ‘포항시정’ 챙기면 부시장은 뭐하나…,일간경북신문 - 김재원 기자,2023/05/17,,http://www.newgbnews.com/news/view.php?idx=306259
포항,"청년들, 포항 ‘송도’ 매력 알렸다",일간경북신문 - 김재원 기자,2023/05/17,,http://www.newgbnews.com/news/view.php?idx=306253
포항,"포항, 정신건강 UP… 정원서 마음 돌보기",일간경북신문 - 김재원 기자,2023/05/17,"포항시는 4월 26일부터 5월 16일까지 4주간 매주 화요일 시민들의 정신건강 증진 및 정원문화 확산을 위한 ‘정원 치유프로그램’을 운영했다고 밝혔다.
프로그램은 수목원·정원조성 및 진흥에 관한 법률 제2조(정원 치유) 신설과 산림청 제2차 정원진흥 기본계획 전략과제 중 ‘국민 누구나 누리는 생활 속 정원문화의 확산’에 발맞춰 포항시에서 올해 시범적으로 시행하는 사업이다.
엔데믹을 맞아 코로나 기간 내외적 스트레스로 심리 치유가 필요한 시민을 대상으로 운영했으며, 대상자는 남·북구보건소의 추천을 받아 총 25명을 선발했다. 이번 프로그램에는 정원 분야 전문 강사를 초빙해 시청 실외 정원, 철길 숲, 양덕 나무은행, 영일대 장미원 일원에서 △실외 정원 속 명상 체험 등 시민들의 큰 호응을 받았다. 김재원기자",http://www.newgbnews.com/news/view.php?idx=306252
