지역명,기사제목,기자이름,날짜,내용,링크
포항,포항 평생학습원 ‘두드림 페스티벌’ 개최,일간경북신문 - 김재원 기자,2023/05/31,"포항시는 2, 3일 이틀간 뱃머리 평생학습원 일원에서 ‘두드림(DO Dream) 페스티벌’을 개최한다.
이번 행사는 포항시 평생학습원 개원 10주년을 맞아 지난 10년간의 평생학습 성과를 시민과 함께 공유하고 축하하기 위해 평생교육과, 시립도서관, 시립미술관에서 함께 마련했다.
포항시는 이번 행사를 어린이부터 어르신까지 전 연령대가 함께 즐길 수 있는 학습 축제의 장으로 만들기 위해 다채로운 프로그램을 준비하고 있다.
먼저 어린이들을 위한 △영어 놀이, 요리와 필라테스 체험 △가족 얼굴 쿠키 만들기 △어린이 풍선아트 △버블 건 및 레고 체험 등 프로그램과 함께 성인들을 위한 프로그램으로는 △다도 및 예절 △맥적요리, 꽃차 시음 △네일아트 △한문 붓글씨 체험 행사 등이 열린다.
또한 성인 문해교육 시화전을 비롯해 미술작품, 생활 인테리어 소품 등 우수 작품전시와 프리마켓 판매 행사, 독서존, 스틸아트공방 체험 등 특별행사도 마련된다. 이와 함께 사물놀이, 난타, 댄스, 악기 연주 등 수강생과 학습동아리의 공연 등 다양한 볼거리도 준비하고 있다.
3일 기념식 행사에서는 오전 9시 30분 어르신 골든벨을 시작으로, 수강생 공연, 식전공연 등이 펼쳐지며, 기념식에서는 평생학습 발전 유공자 시상, 축하 영상메세지 상영, 퍼포먼스 등이 이어진다.
특히 이날 오전 11시에는 인기 트로트 가수 신유의 토크가 있는 콘서트가 6월 시민교양대학과 연계해 진행될 예정이다. 김재원기자",http://www.newgbnews.com/news/view.php?idx=307645
포항,"포항, 대형건설공사장 7곳 안전 점검",일간경북신문 - 김재원 기자,2023/05/31,"10일까지 각종 재해 사전 예방
포항시는 여름철 집중호우와 각종 재해 사전 예방을 위해 지난달 24일부터 오는 10일까지 지역 대형건설공사장 7곳에 대해 집중 안전 점검을 실시하고 있다.
점검 대상은 산지 인근 공사장, 토사 붕괴, 침수 등으로 인한 감전·익사, 강풍에 의한 시설물 낙하·전도가 우려되는 시설물로, 특히 집중호우에 취약한 터파기 및 흙막이 공사 현장, 배수에 어려움이 있는 지하 굴착공사 현장을 집중 점검한다.
이번 점검 결과 경미한 사항은 즉시 시정하도록 하고, 조치가 어려운 사항은 위험 요소가 해소될 때까지 지속 관리할 방침이다.
한편 시는 점검에 앞서 지난 24일 현장 관계자를 대상으로 안전관리 실태와 재해 대응 계획에 대한 사전점검과 안전교육을 통해 현장별 관리계획의 적정성과 정기 안전 점검 실시 여부를 확인하고 우수사례와 사업장별 보완사항을 검토했다.
김기창 하수도과장은 “철저한 안전 점검으로 재난사고를 사전 예방해 시민의 생명과 재산을 보호하는 안전 도시 조성에 행정력을 집중하겠다”라고 말했다. 김재원기자",http://www.newgbnews.com/news/view.php?idx=307643
포항,"포항, 기관·단체와 손잡고 학교폭력 예방",일간경북신문 - 김재원 기자,2023/05/31,"포항시는 학교폭력 예방 및 대책 논의를 위해 31일 시청 드림스타트 회의실에서 2023년 포항시 학교폭력 대책 지역협의회 회의를 개최했다.
포항시 학교폭력 대책 지역협의회 회의는 포항시 학교폭력 예방 및 대책 활동 지원에 관한 조례 제9조에 의거 매년 1회 이상 개최되고 있다.
부위원장인 최명환 복지국장 주재로 진행된 이번 협의회는 지자체, 경찰서, 교육지원청 관련 공무원과 청소년단체 대표 등 20명이 참석한 가운데 기관별 학교폭력 예방 대책계획 및 보고, 협의체 간 상호협력 및 지원방안 등을 논의했다. 특히 최근 증가하고 있는 학교폭력 예방을 위해서는 개인이나 한 기관이 아닌 지역사회를 중심으로 유관기관·단체가 상호 유기적으로 협력해야 한다는 데 뜻을 모았으며, 향후 기관·단체 간 연계 강화를 통해 긴밀한 협업과 지원을 이어가기로 했다. 복지국장은 “청소년들이 올바르게 성장할 수 있도록 지역 유관기관들이 손을 맞잡은 의미있는 자리”라고 했다. 김재원기자",http://www.newgbnews.com/news/view.php?idx=307642
포항,“전국서 맨발로 걸으러 왔어요”,일간경북신문 - 김재원 기자,2023/05/31,,http://www.newgbnews.com/news/view.php?idx=307641
포항,포항 ‘시민과 약속’ 공약 이행 차질 없이 ‘순항’,일간경북신문 - 김재원 기자,2023/05/31,,http://www.newgbnews.com/news/view.php?idx=307639
포항,‘이차전지 특화단지’ 선정…“정치적 결정 안된다”,일간경북신문 - 김재원 기자,2023/05/30,,http://www.newgbnews.com/news/view.php?idx=307500
포항,포항스틸아트공방 ‘두드림 페스티벌’,일간경북신문 - 김재원 기자,2023/05/30,"포항시립미술관 스틸아트공방이 6월 2, 3일 이틀간 뱃머리 평생학습원 2층에서 체험프로그램 및 마켓을 운영하고, 공방 개발상품과 공모전 수상 작품 등을 전시한다. 이번 행사는 포항시 평생학습원 개원 10주년을 기념해 개최하는 ‘두드림(Do Dream) 페스티벌’의 하나로 마련됐으며, 스틸아트공방 창업반 수강생들이 직접 운영에 나선다.
과메기 은반지를 만들어 볼 수 있는 체험프로그램이 1일 30개 한정 수량으로 진행되며, 스틸아트공방 수강생들이 제작한 금속공예 소품도 판매한다. 과메기 은반지 만들기 체험은 30분 정도의 시간이 소요되며, 은으로 제작하는 만큼 소정의 재료비가 발생한다.
스틸아트공방은 스틸을 매개로 금속공예 작품을 직접 만드는 시민 공작소로 지난 2016년 12월에 개소해 현재까지 916명의 수강생을 배출했다. 금속공예 전문가를 양성하고 시민 중심 예술 일자리를 창출하는 것을 목표로 스틸문화 저변 확산에 힘쓰고 있다.
한편, 오는 6월 3일 오전 10시 30분 ‘두드림 페스티벌’ 기념식 식전 행사에는 부산시립교향악단 수석 트럼페터 드미트리 로카렌코프가 참석해 ‘썸머타임’, ‘체리 핑크’, ‘백만송이 장미’ 등을 연주한다. 미술관 음악회에서도 만났던 드미트리는 국제 트럼펫 콩쿠르 3위에 입상 후 볼쇼이극장 트럼펫 수석, 말리 주립 심포니 오케스트라 트럼펫 수석, 모스크바 심포니 트럼펫 수석 등을 역임했다. 김재원기자",http://www.newgbnews.com/news/view.php?idx=307452
포항,“독도는 대한민국 땅…日만행 규탄”,일간경북신문 - 김재원 기자,2023/05/30,,http://www.newgbnews.com/news/view.php?idx=307450
포항,"포항, 물놀이 안전사고 제로화 ‘온힘’",일간경북신문 - 김재원 기자,2023/05/30,"포항시는 본격적인 여름철 물놀이 시기인 6월 1일부터 8월 31일까지를 물놀이 안전 관리 대책 기간으로 정하고, 안전사고 예방을 위해 5월 28일과 30일 이틀간 물놀이 안전지킴이 역량 강화 교육을 실시했다.
이번 교육은 계곡과 하천, 비지정 해수욕장의 물놀이 안전을 위해 35명의 물놀이 안전지킴이를 선발해 심폐소생술을 비롯한 응급처치 요령, 물놀이 안전 장비를 활용한 구조술 등 현장에서 인명구조에 활용할 수 있는 교육을 위주로 진행됐다.
이와 함께 시는 물놀이 안전사고 취약지인 내수면 10개소와 비지정 해수욕장 17개소를 사전 점검하고, 위험표지판과 인명구조함, 구명조끼 등 안전 시설물을 정비하는 등 안전사고 선제 대응을 위해 힘쓰고 있다.
김남진 도시안전해양국장은 “코로나19 해제 등으로 올여름은 계곡과 비지정 해수욕장에 물놀이객이 대폭 증가할 것으로 예상된다”며, “물놀이 안전사고 예방 교육을 더욱 강화해 인명피해를 최소화할 수 있도록 철저히 대비하겠다”고 말했다. 김재원기자",http://www.newgbnews.com/news/view.php?idx=307449
포항,"포항, 6월부터 EBS 영어 콘텐츠 무료",일간경북신문 - 김재원 기자,2023/05/30,"포항시는 지역 내 중·고등학생과 시민의 영어학습 지원을 위해 ‘2023년 EBS 포항 스마트러닝’ 사업을 6월부터 신규로 추진한다.
‘포항 스마트러닝’은 EBS 영어학습 교재를 기반으로 듣기·어휘·문법 등 영어 공부에 반드시 필요한 콘텐츠와 수능과 동일하게 구성된 실전 모의고사, 오답 노트 단어장 기능 등을 제공해 자기주도 학습이 가능하도록 설계된 영어교육 플랫폼이다.
하반기에는 구문 독해 콘텐츠와 초등학생을 위한 영어책 읽기 콘텐츠까지 추가로 선보일 계획이다.
이 사업은 올해 처음 시행하는 사업으로 포항시민 누구나 ‘포항 스마트러닝’ 어플리케이션 또는 포항시 전용 웹사이트에 접속해 회원가입 후 무료로 이용할 수 있다. 회원가입 등 관련 문의는 포항 스마트러닝 고객센터(02-572-0818)로 연락하면 된다.
정진철 교육청소년과장은 “포항 스마트러닝 사업 지원으로 청소년과 일반 시민들이 시공간의 제약 없이 실생활에 유용한 영어 능력을 기르는 데 보탬이 될 것으로 기대한다”며, “영어학습에 관심 있는 학생과 시민들의 많은 이용을 바란다”고 말했다. 김재원기자",http://www.newgbnews.com/news/view.php?idx=307448
포항,해도 운하 마을 도시재생 “주민·대학생 뭉쳤다”,일간경북신문 - 김재원 기자,2023/05/30,,http://www.newgbnews.com/news/view.php?idx=307446
포항,"포항, 글로컬 대학 선도적 모델 구축 ‘정조준’",일간경북신문 - 김재원 기자,2023/05/30,,http://www.newgbnews.com/news/view.php?idx=307442
포항,"포항시민교양대학, 신유 토크 콘서트",일간경북신문 - 김재원 기자,2023/05/29,"포항시는 내달 3일 뱃머리 평생학습원 정문 앞 야외 특설무대에서 6월 시민교양대학 특집 ‘신유의 토크가 있는 콘서트’를 개최한다고 밝혔다.
이번 콘서트는 포항시 평생학습원 개원 10주년을 맞아 마련된 특별 행사로, 포항시민이라면 누구나 무료로 관람할 수 있다.
인기 트로트 가수 신유 씨는 2001년 SBS Net Music 가요제 대상을 수상하고, 2010년 제17회 대한민국 연예예술상 신인상, 2012년 제12회 대한민국 전통가요대상 인기 가수상, 2014년 MBC 가요베스트 올해의 가수상 등 다수의 상을 수상한 바 있으며, 시계바늘, 나쁜남자, 꽃물, 일소일소 일노일노, 잠자는 공주 등 수많은 히트곡으로 많은 사람들의 사랑을 받고 있다.자세한 사항은 평생학습원 홈페이지를 참고하거나, 포항시 평생교육과( 270-4434)로 문의하면 된다.
한편, 김현구 평생학습원장은 “앞으로도 시민들의 눈높이에 맞는 다양한 프로그램을 통해 시민들의 삶에 행복을 충전할 수 있도록 최선을 다하겠다”고 말했다.김재원기자",http://www.newgbnews.com/news/view.php?idx=307354
포항,포항 ‘국민 비서’ 편리한 자동차 종합검사,일간경북신문 - 김재원 기자,2023/05/29,"포항시는 한국교통안전공단에서 국민 비서(구삐)를 통한 자동차 종합(정기)검사 알림서비스를 시행하고 있다고 밝혔다.
이번 서비스는 차량 소유자가 국민 비서를 통해 자동차 검사 알림을 신청하면 검사 유효기간 만료일 31일 전부터 최대 4회까지 원하는 앱으로 사전 안내를 받을 수 있다.
현재 시행 중인 우편 안내 서비스는 안내문을 제때 받지 못하거나 분실될 우려가 있었으나, 국민 비서를 통한 알림서비스는 이러한 문제점을 보완할 수 있을 것으로 예상된다.
서비스는 국민 비서 홈페이지(www.ips.go.kr) 또는 카카오톡, 네이버 등의 국민 비서 메뉴에서 신청할 수 있다.
차량등록과장은 “자동차 종합검사는 운전자만이 아닌 시민 모두의 안전을 지키기 위한 차량 보유자의 기본 의무 사항”이라며, “사고 발생을 예방하고 안전한 교통문화를 정착시키기 위해 많은 분들이 자동차 검사 알림서비스를 신청하시기 바란다”고 했다. 김재원기자",http://www.newgbnews.com/news/view.php?idx=307353
포항,"포항 지방세·계약 심의위, 신규위원 위촉",일간경북신문 - 김재원 기자,2023/05/29,"포항시는 납세자의 권익을 보호하고 계약의 적절성과 적법성을 심의하기 위해 지난 26일 포항시 지방세 심의위원·계약 심의위원 위촉식을 개최했다.
지방세 심의위원회는 변호사, 세무사, 회계사 등 지방세에 관한 전문지식과 경험이 풍부한 민간위원 8명과 시의회 의원 1명, 시 자치행정실장, 재정관리과장 등 총 13명으로 구성돼 있고, 계약 심의위원회는 대학교수, 변호사, 회계사 등 회계 및 조달계약에 관한 경험과 지식이 풍부한 민간위원 11명과 포항시 자치행정실장을 포함한 12명으로 구성됐다.
지방세 심의위원회는 과세전적부심사, 이의신청, 부동산 등 시가표준액 결정 심의·의결 등의 업무를 수행하게 되며, 지방세 제도의 발전과 납세자 권익 보호를 위한 활동에 나설 예정이다.
계약심의위원회는 입찰에서 입찰참가자 자격 제한에 관한 사항, 계약체결 방법에 관한 사항, 낙찰자 결정방법에 관한 사항, 부정당업자 입찰 참가 자격 제한에 관한 사항 등 지방자치단체를 당사자로 하는 계약에 관한 중요사항을 심의하고 의결한다. 재정관리과장은 “지방세의 공정성 확보 및 납세자들의 실질적인 권리 구제를 위해 적극적으로 활동해주기를 바란다”며, “다양한 사업수행의 근간이 되는 계약업무가 공정하고 적절하게 집행될 수 있도록 노력해 신뢰받는 시 행정을 구현할 수 있도록 하겠다”고 말했다. 김재원기자",http://www.newgbnews.com/news/view.php?idx=307351
포항,포항 남·북구보건소 ‘건강한 여름나기’,일간경북신문 - 김재원 기자,2023/05/29,"포항시 남·북구보건소는 여름철 폭염으로 인한 건강 피해를 최소화하기 위해 지난 20일부터 9월 30일까지 ‘온열질환 응급실 감시체계’를 운영한다고 밝혔다.
‘온열질환 응급실 감시체계’는 지역 응급의료기관(포항성모병원, 포항세명기독병원, 에스포항병원, 포항의료원, 좋은선린병원)과 협력해 온열질환자 발생 상황을 상시 모니터링하고 정보를 신속히 공유함으로써 시민 건강 피해를 최소화하고자 마련됐다.
온열질환은 열로 인해 발생하는 급성질환으로 열사병, 열탈진, 열실신 등으로 나뉘며, 어지러움, 근육경련, 피로감, 의식 저하 등의 증상을 보이고 심각한 경우 생명까지 위태로울 수 있어 사전 예방과 신속한 조치가 중요하다.
아울러, 온열질환 예방을 위해 폭염 시에는 야외활동을 자제하고 물 자주 마시기, 더운 시간대는 휴식하기 등 폭염 대비 건강 수칙을 준수해야 한다. 환자가 발생하면 즉시 시원한 장소로 이동 후 의료기관으로 이송하거나, 의식이 없는 경우에는 신속히 119에 신고해야 한다.
김정임 남구보건소장은 “올해는 평년보다 무더운 날이 많을 것으로 전망돼 온열질환자 발생 우려가 커지는 상황”이라며, “어린이와 노약자, 만성질환자, 야외작업자 등은 특히 주의해 주시길 바란다”고 당부했다. 김재원기자",http://www.newgbnews.com/news/view.php?idx=307350
포항,"K-드라마 명소 포항, 대만 유혹",일간경북신문 - 김재원 기자,2023/05/29,,http://www.newgbnews.com/news/view.php?idx=307349
포항,포항 ‘꿈·힘’ 경북도 청년문화 페스티벌 열린다,일간경북신문 - 김재원 기자,2023/05/29,,http://www.newgbnews.com/news/view.php?idx=307348
포항,‘포항국제불빛축제’ 안전도 잡고 지역경제도 잡고,일간경북신문 - 김재원 기자,2023/05/25,,http://www.newgbnews.com/news/view.php?idx=307186
포항,"포항국제불빛축제, 27일 교통통제",일간경북신문 - 김재원 기자,2023/05/25,"포항시는 ‘2023 포항국제불빛축제’ 개최에 따라 메인 행사가 열리는 27일 행사장 주변 3개 구간 총 2.9㎞에 대한 교통통제를 실시한다고 밝혔다.
먼저 27일 오전 11시부터 오후 5시까지 퐝 거리 퍼레이드 및 퍼포먼스를 위해 운하로(송림초등학교사거리~운하관북측삼거리)에 대해 통제를 실시한다. 또한 27일 본 행사에 대비해 오후 2시부터 10시까지 희망대로(형산교차로~운하관삼거리), 형산강북로(형산교차로~문화예술회관남측삼거리)를 통제해 시민들이 안전하게 축제를 즐길 수 있도록 할 예정이다. 이와 함께 전면 통제가 이뤄지는 구간으로 연결되는 주택가 이면도로 진입 차량에 대해서도 통행 제한을 실시한다.
포항시는 올해 국제불빛축제가 4년 만에 정상 개최되는 만큼 안전 축제로 만들 수 있도록 유관기관, 포항남부경찰서 및 교통 봉사단체 등과 교통 대책에 대해 긴밀히 협의하는 등 시민과 관광객들의 교통 불편이 최소화될 수 있도록 총력을 기울일 방침이다. 이를 위해 행사장 주변 및 주요 교차로에 교통 봉사단체, 경찰, 공무원 등 총 307명을 배치하고, 송도해안로 주차장, 송림초등학교, 포항운하공영, 송도중학교, 죽도초등학교 등 총 13개소에 약 9,000여 면의 임시주차장을 마련했다. 아울러 시는 교통통제가 이뤄짐에 따라 축제장을 찾는 시민과 관광객들에게 교통편의를 제공하기 위해 27일 오후 3시부터 11시까지 임시주차장에서 행사장으로 이어지는 3개 노선에 6대의 셔틀버스를 30분 간격으로 운행한다. 김재원기자",http://www.newgbnews.com/news/view.php?idx=307166
포항,고품질 친환경 쌀 생산 ‘왕우렁이 방사’,일간경북신문 - 김재원 기자,2023/05/25,,http://www.newgbnews.com/news/view.php?idx=307165
포항,미래 신성장 산업 ‘포항 그래핀밸리’ 조성,일간경북신문 - 김재원 기자,2023/05/25,"추진 방향 등 전략 보고회
포항시는 25일 시청 중회의실에서 ‘포항 그래핀밸리 조성 전략’ 용역 착수보고회를 개최했다.
이날 보고회는 연구기관 및 유관기관 관계자 등이 참석한 가운데 용역 수행기관인 ㈜노바투스컨설팅이 과업 수행내용 및 향후 추진 방향 등을 발표했으며, 참석자들의 다양한 의견 및 건의 사항을 논의했다.
시는 이번 용역을 통해 포항테크노파크, 나노융합기술원, (재)포항산업과학연구원 등 지역의 R&D 기관과 협력해 분야별 전문가들과의 피드백을 통해 포항 그래핀밸리 조성 전략을 수립하고, 향후 정부 부처의 사업 제안 및 공모사업 등에 활용할 계획이다.
‘포항 그래핀밸리 조성 전략 수립 용역’은 올 연말까지 시행하며, 주요 내용은 △그래핀 산업 분석과 타당성 조사 △포항 그래핀밸리 중장기 발전 전략 수립 △포항 그래핀밸리 특화 전략 수립 △그래핀 기술 및 국제 표준 관련 사항 등이다.
포항시는 첨단 신소재인 그래핀 산업 육성을 위해 지난 2021년 그래핀스퀘어(주), 포스코, 포스텍, 포항산업과학연구원(RIST)과 포항그래핀밸리 조성을 위한 업무협약을 맺고 그래핀 산업 선점과 글로벌스탠다드 주도 등을 적극 추진하고 있다.
꿈의 신소재 그래핀(Graphene)은 탄소 원자들이 벌집 모양으로 연결돼 단층의 평면을 이루고 있는 첨단 나노소재로, 강철보다 200배 이상 강하고 실리콘, 구리보다 전자이동 속도가 100배 이상 빠르다. 김재원기자",http://www.newgbnews.com/news/view.php?idx=307163
포항,글로벌 네트워크 강화 ‘영일만 스타트업 데이’,일간경북신문 - 김재원 기자,2023/05/25,"포항시가 투자사·운용사·스타트업 기업이 함께하는 글로벌 네트워크의 장 ‘영일만 스타트업 데이’를 개최하며 ESG 글로벌 창업 생태계 조성에 속도를 낼 전망이다.
시는 오는 6월 4, 5일 이틀간 ‘ESG 전인적 세계시민위크 2023’을 개최한다. 이번 행사는 포항시가 지난 2021년 11월 ESG 가치 실현의 모델 도시로의 첫 신호탄인 ‘세계시민도시 ESG 포항 선포식’ 이후 ESG 실천 방향에 대한 담론을 모으고자 UNAI KOREA(유엔아카데믹임팩트 코리아), 한동대학교와 공동 주최로 마련했다.
먼저 4일 한동대학교 그레이스스쿨에서는 세계시민위크 개회 및 본회의가 열린다. 이날 회의에는 반기문 前 UN 사무총장의 기조연설을 시작으로 유중근 UNAI KOREA 이사장, 조명환 월드비전 회장, 션 승일희망재단 대표와 함께하는 라이브 토크 등이 마련돼 있다.
시는 ESG 전인적 세계시민위크 2023과 연계해 이틀간 ‘0110000(영일만) 스타트업 데이’를 개최, 한국, 실리콘밸리, 싱가포르, 이스라엘 스타트업 패널들을 초빙하는 등 ESG-스타트업 글로벌 네크워크를 구축할 방침이다.
4일 장기면 신창리 창바우마을에서는 스타트업 관계자 100명이 참석하는 스타트업 캠프가 열린다. 또한 5일 포항 체인지업그라운드에서는 투자사·운용사·스타트업 기업이 함께하는 다채로운 행사가 마련될 예정이다.
이번 스타트업 데이에는 세계 최대 글로벌 투자 플랫폼 아워크라우드(OurCrowd) 대표 데니스 반(Denes Ban)을 비롯해 이스라엘 창업 펀딩 기업 파이펠비즈(PipelBiz) 대표이자 히브리대학교 국제 MBA 교수인 마이클 미즈라히(Michael Mizrahi)가 참여해 ‘이스라엘은 어떻게 세계의 혁신을 리드하는가’를 주제로 혁신적인 이스라엘의 글로벌 스타트업 생태계에 대해 발표한다.
또한 실리콘밸리 한인 스타트업 임성원 임프리메드 대표, 이학 더닷츠대표의 멘토링과 싱가포르 임팩트 투자자인 다니엘 롱(Daniel Long)과 테란스 탄(Terrance Tan) 올리브트리 공동창업자의 멘토링이 마련돼 글로벌 스타트업, 투자자 등을 실질적으로 만날 수 있는 소중한 경험을 제공한다. 김재원기자",http://www.newgbnews.com/news/view.php?idx=307162
포항,포항 비상 구미 ‘이차전지 육성거점센터’ 선정,일간경북신문 - 김재원 기자,2023/05/24,,http://www.newgbnews.com/news/view.php?idx=307022
포항,포항 출산힐링센터 ‘행복한 출산교실’,일간경북신문 - 김재원 기자,2023/05/24,"포항시 남구보건소 출산힐링센터에서는 지난달 ‘행복한 출산교실’을 시작으로 ‘베스트맘 육아교실’, ‘다문화가정 예비맘 교실’, ‘초보 할매·할배 육아교실’ 등 임산부의 건강과 출산, 육아를 위한 다양한 프로그램을 예약제로 운영하고 있다.
프로그램은 임산부를 대상으로 힐링요가, 태교 천연비누 만들기, 모유 수유 성공법과 신생아 관리 및 아기와 엄마가 함께 하는 키 쑥쑥 머리 똑똑 베이비 마사지, 그림책 놀이, 촉감놀이 등 다양한 주제로 진행된다.
또한 예비 조부모들을 위한 신생아 관리, 올바른 손자녀 양육법과 그림책 놀이법 교육을 통해 유익한 정보를 제공하며, 최근 들어 늘어나는 다문화가정 임신부 및 가임기 여성을 대상으로 바느질 태교, 신생아 관리 등을 교육한다.
이와 함께 남·북구보건소는 건강한 출산 장려 분위기 조성을 위해 임신을 준비하는 신혼부부를 대상으로 산전(임신초기 포함) 건강검진을 예약제로 실시하고 있으며, 여성에게는 풍진 항체 및 난소 기능 검사, 남성에게는 정액 검사 비용을 지원하고 있다. 김재원기자",http://www.newgbnews.com/news/view.php?idx=307015
포항,"포항, 낭만적인 불꽃과 ‘맛앤락 퐝스토랑’",일간경북신문 - 김재원 기자,2023/05/24,,http://www.newgbnews.com/news/view.php?idx=307012
