지역명,기사제목,기자이름,날짜,내용,링크
대구,국내 최대 실내 플라워쇼 “아빠·엄마 꽃구경 가요” 대구꽃박람회 2~4일 엑스코 다양한 작품전시,일간경북신문 - 윤기영 기자,2023/05/31,"대구광역시는 국내 최대 규모의 실내 플라워쇼인 ‘제14회 대구꽃박람회’를 6월 2일부터 4일까지 3일간 엑스코에서 개최한다. 올해 14회째를 맞는 대구꽃박람회는 ‘The power of Flowers(꽃의 힘)’주제로 화훼산업 관련 172개 기관(725개 부스, 15,000㎡)과 유명 플로리스트 700여 명의 화훼 작품과 다채로운 행사들을 한자리에서 만날 수 있다.
이번 박람회는 ‘꽃의 힘’이라는 주제를 상징하는 대형 화훼조형이 전시될 ‘주제관’(꽃으로 피어나는 MBTI)과 장관상을 겨룰 엄선된 10개 작품이 조성된 ‘청라상관’, 경북도와 고양시 등 전국의 화훼 문화를 알리는 ‘지자체관’, 야생화, 희귀식물, 테라리엄, 다육식물, 생활 꽃꽂이 등이 다양하게 전시되는 ‘일반 조성관’을 비롯해 화훼 관련 상품을 체험 및 구매할 수 있는 ‘기업관’(플라워 아울렛)으로 구성된다.
특히 지역 청년 플로리스트 양성을 위해, ‘K플라워의 힘, 미래세대 그 꿈을 그리다’를 주제로 한 청년플로리스트 합동작품 전시와 청년 플로리스트 꽃꽂이 시연이 진행되며, 화훼인들의 실력을 겨루는 ‘대구생활화훼경진대회’를 개최하여 미래 화훼산업을 이끌어 갈 역량 있는 신인 발굴에도 힘쓰며, 청소년들에게는 직업 체험의 기회를 제공한다.
또한, 이케바나(일본식 꽃꽂이) 전시회, 화환문화 개선을 위한 신화환 전시, 플라워 미디어아트, 플렌테리어(꽃을 활용한 인테리어), 플라워 드로잉 쇼(Flower Drawing Show), 힐링클래스 등이 새롭게 선보여 더욱 풍성한 볼거리를 제공한다.
일반인들이 쉽게 화훼 문화를 배우고 체험할 수 있는 힐링원예종합체험존, 어린이 체험, 꽃종자 파종, 꽃 해설투어, 데몬스트레이션 등을 비롯하여 전문가들을 위한 ‘쉽고 재미있는 다육아트’, ‘꽃을 활용한 치유농업 활동사례’ 등 세미나 프로그램이 진행되어 화훼 네트워크 구축의 장이 마련된다. 이번 행사의 관람시간은 오전 10시부터 오후 6시까지이다. 입장권은 성인 기준 9,000원이며 사전예매를 통해 할인된 가격으로 만나볼 수 있다.윤기영기자",http://www.newgbnews.com/news/view.php?idx=307653
대구,"중구, 미취업청년에 취업장려금 지원",일간경북신문 - 윤기영 기자,2023/05/31,"8개 구군 중 최초 5개월간
대구 중구는 경제적으로 취약한 미취업 청년들에게 취업 준비에 필요한 활동비를 지원해 구직활동에 전념할 수 있는 환경을 제공코자 대구시 8개 구·군 중에 최초로 ‘미취업청년 취업장려금 지원사업’을 시행한다.
지원 대상은 최종학력 졸업 2년 이내 또는 학사취득 유예 중인 중구 거주(공고일 현재) 만 19 ~ 34세 미취업자 중 기준 중위소득 120~140%이하인 청년이며, 지원 항목은 구직활동을 위한 학원수강료, 교재·도서구입비, 시험 응시료 등으로 최대 100명에게 월 최대 30만원 한도 내에서 5개월 동안 지원한다.
신청 기간은 2023년 6월 9일까지로 자세한 내용은 중구청 홈페이지 공지사항이나 중구청 홍보소통실(053-661-2463, 2465)을 통해 확인할 수 있다.
류규하 중구청장은 “우리 중구는 청년들이 지역에 머물며 취·창업하기 좋은 환경을 만들기 위해 임대료 지원 사업을 비롯한 다양한 사업을 추진 중에 있으며, 올해 처음 시행하는 해당 사업에도 청년들의 많은 관심과 참여를 부탁한다”고 말했다.윤기영기자",http://www.newgbnews.com/news/view.php?idx=307595
대구,"서구청장, 마약예방 ‘NO EXIT’ 캠페인",일간경북신문 - 윤기영 기자,2023/05/31,,http://www.newgbnews.com/news/view.php?idx=307594
대구,‘너랑나랑 3삼5오 데이트’ 4커플 매칭,일간경북신문 - 윤기영 기자,2023/05/31,"대구 달서구는 지난달 26일 달서선사관에서 개최한 ‘너랑 나랑 3삼5오 데이트’에서 4커플이 매칭됐다고 밝혔다.
이번 행사는 한 번의 만남으로는 상대에 대해 알기 어렵다는 참여자의 의견을 반영해 특별히 3번의 만남자리를 마련했다. 지난달 13일과 20일은 달서목재문화관에서 전문 행사자의 사회로 첫 만남의 어색함을 깨는 ▷ 아이스 브레이킹 타임 ▷ 커플 레크리에이션 ▷ 원목피크닉테이블 만들기 체험 ▷ 미션게임을 진행했다.
지난달 26일에는 달서선사관에서 계명문화대학교 하이브 사업과 연계해 호텔항공외식관광학부 김평빈 교수의 와인클래스 수업을 진행하고 최종 커플을 선정 했다.
한 참가자는 ‘서먹하고 낯선 상황이지만, 체험프로그램을 통해 자연스럽게 대화할 수 있고 멋진 추억을 쌓을 수 있어서 좋았다’고 말했다.
달서구는 미혼남녀 대상의 만남 행사뿐만 아니라, 결혼적령기 자녀를 둔 부모님들이 자녀의 짝을 직접 찾는 ‘내 자녀 천생연분 찾는데이’ 도 운영하고 있다. 또한, 청년과 부모들의 결혼에 대한 마음을 이해하는 ‘맞춤형 결혼 공감 토크’를 오는 28일 개최할 예정이다.윤기영기자",http://www.newgbnews.com/news/view.php?idx=307593
대구,"달성청소년문화의집, 3기 환경페스티벌",일간경북신문 - 윤기영 기자,2023/05/31,"달성군청소년문화의집은 지난달 27일 환경의 달인 6월을 기념해 달성군청소년어울림마당 “3기 환경페스티벌-환경을 부탁해!”를 성황리에 개최했다.
이번 행사는 21년, 22년에 이어 3회째 진행됐고 120명의 지역 청소년이 참가해 환경문제의 심각성을 인지하고 환경보호의 실천방법을 다양한 체험활동과 워크북 작성을 통해 쉽게 접근할 수 있도록 운영됐다.
환경에 대해 생각할 수 있는 자원의 순환, 환경오염의 주범 재활용, 친환경 생활의 시작, 환경퀴즈존을 구성여 스티커 랠리 방식으로 운영했으며 모든 부스 체험자에게는 신문 재생 친환경 연필을 기념품으로 지급했다.윤기영기자",http://www.newgbnews.com/news/view.php?idx=307592
대구,"남구 앞산맛둘레길, 보훈의달 유공자 할인",일간경북신문 - 이종구 기자,2023/05/31,"대구광역시 남구는 호국보훈의 달을 맞아 국가유공자와 그 가족이 앞산맛둘레길 식당 이용 시 10%의 할인혜택 또는 음료수를 제공한다고 밝혔다.
남구는 6월 호국보훈의 달을 맞아 6월 한 달 동안 진행되는 이번 특별할인 행사는 앞산맛둘레길의 34개 식당(할인행사 포스터 부착 식당) 이용 시 국가유공자증을 제시하면 혜택을 받을 수 있다. 김영주 앞산맛둘레길 상가번영회 회장은 “이번 행사는 앞산맛둘레길 번영회에서 호국보훈의 달을 맞아 국가를 위해 헌신하신 유공자분들에게 감사의 마음을 전하고자 마련했다”며,“뜻깊은 행사를 진행하게 되어 영광이다”고 전했다. 남구청장은 “국가유공자분들의 위대한 헌신을 기억하고, 남구를 호국보훈 선진도시, 살기좋은 명품도시로 만들어가는데 최선의 노력을 다하겠다”고 말했다.이종구기자",http://www.newgbnews.com/news/view.php?idx=307591
대구,"동구, 고독사 예방 스마트돌봄플러그",일간경북신문 - 윤기영 기자,2023/05/31,,http://www.newgbnews.com/news/view.php?idx=307590
대구,6월부터 비대면 아동급식지원 플랫폼 운영,일간경북신문 - 윤기영 기자,2023/05/31,,http://www.newgbnews.com/news/view.php?idx=307589
대구,"대구, 실내 마스크 착용의무 추가 변경조정 시행",일간경북신문 - 윤기영 기자,2023/05/31,,http://www.newgbnews.com/news/view.php?idx=307588
대구,"수성알파시티, 디지털 혁신거점 청신호",일간경북신문 - 윤기영 기자,2023/05/30,"대구광역시는 비수도권 최대 SW기업 집적지인 ‘수성알파시티’가 과학기술정보통신부(이하 ‘과기정통부’)의 ‘지역 디지털 혁신거점 조성지원 시범사업’의 추진 지역으로 최종 선정됐다고 밝혔다.
과기정통부가 주관한 ‘지역 디지털 혁신거점 조성지원 시범사업’은 지역 내 디지털 생태계의 성장 잠재력이 높은 입지를 혁신거점 시범지역으로 선정해 초기 조성비(국비 63억/3년)를 지원하는 사업이다. 이번 사업 공모에는 총 10개 지역이 신청한 가운데(경쟁률 5:1), 3월부터 2개월간 민간전문가로 구성된 평가위원회를 중심으로 서면·발표평가, 현장실사 및 종합심의가 진행됐으며, 치열한 지자체 간 경쟁을 거쳐 대구광역시와 부산광역시가 최종 선정됐다. 윤기영기자",http://www.newgbnews.com/news/view.php?idx=307502
대구,"日 관광객, 수성구 한방 여행 ‘봇물’",일간경북신문 - 윤기영 기자,2023/05/30,,http://www.newgbnews.com/news/view.php?idx=307473
대구,"남구, 청소년 재활용 선별장 견학 실시",일간경북신문 - 이종구 기자,2023/05/30,"대구 남구청은 5월 한 달 동안 세 차례에 걸처 관내 청소년 시설(청소년 상담복지센터, 학교밖 청소년지원센터, 청소년 방과후아카데미) 이용 청소년들에게 남구 재활용 선별장 견학을 실시했다고 30일 밝혔다.
남구 재활용 선별장은 재활용 프로세스를 통해 폐기물을 분리하고 재활용 가능한 자원을 회수하는 중요한 시설로, 이번 견학에서 청소년들은 재활용 선별장의 작동원리와 재활용 과정에 대한 설명을 듣고, 시설내부를 직접 돌면서 실제로 폐기물 분류와 재활용 과정을 체험하며 폐기물의 분리와 처리에 대한 과정을 배우며 환경교육의 기회를 제공하고 재활용의 중요성을 알렸다.
특히 이번 견학프로그램에서는 환경교육을 위하여 청소년들이 직접 참여하는 재활용 퀴즈를 통해 재활용품으로 만든 기념품을 제공하여 재활용의 중요성과 재활용을 올바르게 분리하고 배출하는 방법에 대하여 쉽게 알 수 있는 교육을 실시하고, 학생들이 생활 속에서 재활용을 실천할 수 있도록 홍보하였다.
조재구 남구청장은“이번 견학이 청소년들에게 환경보호 의식을 심어주는데 큰 도움이 되었길 바란다”며,“청소년들 모두 자원의 유용한 재활용과 올바른 폐기물 처리의 중요성을 깨닫고 지속 가능한 환경을 위해 행동해주길 바란다”고 전했다.이종구기자",http://www.newgbnews.com/news/view.php?idx=307472
대구,달서구 “의병의 날 기념 향사례 오세요”,일간경북신문 - 윤기영 기자,2023/05/30,"대구 달서구는 오는 6월 1일 오후 4시부터 월곡 우배선 장군의 발자취가 남아 있는 월곡역사박물관에서 의병의 역사적 가치 제고와 애국정신 계승을 위한 ‘2023 의병의 날 기념 향사례(鄕射禮)’ 행사를 개최한다.
의병의 날은 의병의 역사적 가치를 일깨워 애국정신을 계승하고자 제정한 법정기념일이다. 기념일은 임진왜란 시 곽재우가 최초로 의병을 일으킨 음력 4월 22일을 양력으로 환산해 호국보훈의 달 첫째날인 오는 6월 1일로 선정해 지난 2010년 공포됐다.
달서구는 조선시대 임진왜란 당시 지역에서 의병을 일으켜 혁혁한 전공을 세웠던 월곡 우배선 장군의 구국의 혼을 계승하기 위해 이번 행사를 준비했으며, 의병의 날 의식 재현, 죽궁 진상, 활쏘기 시연 및 대회, 퓨전국악 공연 등 다채로운 프로그램이 예정돼 있다.윤기영기자",http://www.newgbnews.com/news/view.php?idx=307471
대구,‘같이 또 가치’ 플리마켓 호응,일간경북신문 - 윤기영 기자,2023/05/30,"지난 26일, ‘같이 또 가치 청소년 플리마켓’ 행사가 평리공원에서 개최됐다. 이번 행사는 “학교 밖 청소년 꿈이음 프로젝트 지원사업”중 하나로, 서구 학교 밖 청소년 지원센터 25명의 청소년을 대상으로 6주간의 배움의 과정을 거쳐 플리마켓을 작년에 이어 두 번째로 개최하게 됐다.
플리마켓에서는 청소년들이 직접만든 커피음료, 무드등, 유리컵, 향초, 천연비누, 카드지갑, 악세서리 등과 서구청소년지도협의회가 기부한 모자 등을 판매했다. 플리마켓 운영을 통해 발생한 수익은 사회적약자를 위해 전액 기부할 예정이다.윤기영기자",http://www.newgbnews.com/news/view.php?idx=307470
대구,"동구, 봉무공원 곤충페스티벌 ‘행사 풍성’",일간경북신문 - 윤기영 기자,2023/05/30,"제3회 봉무공원 곤충페스티벌이 6월 2일부터 4일까지 동구 봉무공원 일원에서 개최된다. 지난 2019년, 2022년 페스티벌 개최 후 3회를 맞아 더욱 즐겁고, 풍성한 행사로 준비했다.
대구 유일 곤충테마공간인 봉무나비생태원을 중심으로 동구의 아름다운 자연환경과 나비 및 곤충을 주제로 한 축제로 열린다. 어린이들에게 생태 보전의 중요성과 신비로운 곤충의 생태를 체험할 수 있는 다양한 체험 행사가 마련됐다. 또, 곤충인형극 공연과 함께 아이들에게 인기가 많은 유튜버의 곤충 토크콘서트도 진행된다.
봉무공원 특설무대에서는 곤충 퀴즈쇼, 매직&버블쇼, 버스킹 등이 진행되며, 축제 첫날인 2일에는 봉무 곤충 도전! 골든벨이 개최돼 곤충박사를 뽑는다. 다음달 3일에는 곤충페스티벌의 개막을 알리는 개막식과 지역의 아동들과 함께 희망의 나비를 날리는 개막퍼포먼스가 열린다.
또, 같은 날 오후에는 인기 곤충 유튜버의 토크 콘서트도 진행돼 행사의 풍성함을 더한다. 마지막 날인 4일에는 제2회 전국 어린이 생태동요제가 열려 아름다운 자연환경을 보전하고 곤충을 사랑하는 학생들의 동요제전이 펼쳐진다.
또, 축제 내내 ‘곤충 친구들과 떠나는 6월의 피크닉’을 실감할 수 있는 다양한 세계희귀곤충전, 이야기곤충전, 물속생물전, 장수하늘소 등 멸종위기 곤충전 등이 열린다.
이와 함께 축제장 전역에서는 K-2 후적지 개발과 동구의 미래 발전상을 소개하는 코너, 다양한 소품을 사고 파는 플리마켓과 동구 지역특산물 홍보부스 등도 마련되며, 누에고치 실뽑기, 장수풍뎅이 유충 나눔 등 다양한 체험활동, 아름다운 단산지 풍경을 감상하며 휴식을 취할 수 있는 봉무 힐링존, 축제의 즐거움인 먹거리존 등 다양한 즐길거리도 준비됐다.윤기영기자",http://www.newgbnews.com/news/view.php?idx=307469
대구,"중구, 내달 투명페트병 AI 무인회수기 운영",일간경북신문 - 윤기영 기자,2023/05/30,,http://www.newgbnews.com/news/view.php?idx=307468
대구,대학생·청년 ‘대구행복기숙사’ 문 열었다,일간경북신문 - 윤기영 기자,2023/05/30,,http://www.newgbnews.com/news/view.php?idx=307467
대구,"대구시, 소재부품기업 R&D 첫 걸음 지원",일간경북신문 - 윤기영 기자,2023/05/30,"대구광역시는 소재부품기업의 R&D 첫걸음을 지원하기 위한 ‘소재부품기업 경쟁력 강화 지원 사업’을 신규 추진한다. 소재부품산업을 적극 육성해온 대구광역시는 지난해 12월 ‘대구광역시 소부장 육성 및 지원조례’를 제정해 제도적 기반을 마련하는 한편, ‣나노소재부품산업 가치사슬 혁신사업, ‣소재부품2.0 기술자립지원센터 구축, ‣첨단메카닉 고분자 디지털융합 기술혁신 플랫폼 구축 등 소재부품산업 지원사업을 지속적으로 추진하고 있다.
이러한 노력은 엘앤에프(2차전지 양극재), 성림첨단산업(희토류 영구자석) 등 대한민국 소재부품산업을 이끄는 리딩기업을 탄생시키는 성과로 나타나고 있으며, 로봇·모빌리티 등 미래신산업 육성의 기반이 되고 있다.
‘소재부품기업 경쟁력 강화지원사업’은 엘앤에프, 성림첨단산업을 뒤이어 대한민국 대표 소재부품기업이 되겠다는, 규모는 작더라도 도전의식과 성장 가능성이 있는 소재부품기업을 발굴해, 성장기반 마련에 필요한 자체 역량을 한 단계 더 끌어올리고자 한다.
대구광역시는 소재부품 산업집적도가 매우 높지만 대부분 중소기업으로, 2021년 기준 매출액 120억 원 이하 또는 종사자 수 50인 이하의 기업은 총 6,382개로 전체 제조업 9,660개 중 66%를 차지한다.
이 기업 중 연구개발 전담부서가 있는 기업은 763개로 전체의 7.8%에 불과하다. 현재 대다수의 기업이 연구개발 전담부서가 없거나 연구 전담 인력 수급이 어려워서 기업의 지속 성장기반 확보를 위한 연구개발 역량 확보에 애로가 많은 실정이며, 대다수의 기업은 R&D를 하고 싶어도 무엇을 어떻게 해야 하는지 방법조차 알기 어렵다.
이에 대구광역시는 ‘소재부품기업 경쟁력 강화지원사업’을 통해 도전을 꿈꾸는 소재부품기업의 첫 번째 R&D를 맞춤 지원할 예정이다. 이 사업의 지원대상은 매출액 120억 원 이하 또는 종사자 50인 이하의 대구 소재부품기업이다. 또한 물고기를 잡아주기보다 잡는 방법을 알려주는 사업의 취지에 따라 최근 3년간 정부R&D 참여 경험이 없는 기업을 지원 대상으로 한다.
선정된 기업은 전문가 역량진단을 기반으로 기술개발 방향수립 및 아이템 도출, 맞춤형 공모사업 발굴 및 참여지원, 기술사업화 실증 및 검증 등을 지원받게 되며, 서로 다른 업종간의 협력거버넌스인 ‘소재융합유니언’의 기술·마케팅전문가 서포터즈를 통해 지속적인 컨설팅 및 사업화 기회를 제공받게 된다.
2023년 ‘소재부품기업 경쟁력 강화 지원사업’ 참여기업 모집은 오는 6월 1일부터 대구테크노파크에서 공모하며, 참여기업 및 사업 상세내용은 대구테크노파크 홈페이지(http://dgtp.or.kr)에서 확인할 수 있다. 윤기영기자",http://www.newgbnews.com/news/view.php?idx=307445
대구,"대구시, 신공항 사업대행자 연내 선정한다",일간경북신문 - 윤기영 기자,2023/05/30,"대구광역시는 31일 오후 2시 서울 공군호텔에서 공공기관, 금융기관 및 건설사 등을 대상으로 대구경북신공항 건설사업에 대한 사업설명회를 개최한다.
이번 설명회는 지난 4월 ‘대구경북통합신공항 건설을 위한 특별법’ 제정 이후 사업의 본격적인 추진을 위해 관련 기관 및 기업을 대상으로 사업전반에 대한 내용을 알리고 추후 성공적인 신공항 건설사업을 이끌어내기 위해 계획됐다.
대구경북신공항의 경우 군공항은 대구시가 기부대양여 방식으로 추진하고 민간공항은 국토부가 재정사업으로 건설하게 된다. 대구시가 기부대양여 방식으로 군공항을 건설하기 위해서는 대구시를 대신해 군공항을 건설하고 종전부지를 개발할 사업대행자(공동출자법인) 선정이 필요하다.
이에 따라 설명회에는 사업대행자로 참여가 가능한 LH, 한국공항공사, 대구도시개발공사 등 주요 공공기관들과 20여 곳의 금융기관을 비롯해 국내 50대 건설사 및 지역건설사 등 200여 명이 참석할 예정이다.
설명회에서 대구시는 대구경북신공항의 사업개요, 사업별 추진절차, 사업추진 구조, 사업대행자 구성, 향후 추진일정 및 대구경북통합신공항 특별법 등에 대한 내용을 설명하고 질의응답 시간을 가질 예정이다.
특히, 질의응답 시간에는 관련기관들로부터 사전에 접수한 질의에 대한 답변을 통해 대구경북신공항 건설사업의 사업구조와 방향 등에 대한 이해도를 높일 계획이다.
대구시는 ‘대구경북통합신공항 건설을 위한 특별법’에 따라 공공주도방식의 공동출자법인을 사업대행자로 선정할 계획이다. 이 공동출자법인의 경우 공공시행자가 지분의 50%를 초과해 구성돼야 하며 나머지 지분에 대해서는 민간참여자가 지분 참여를 할 수 있다.
대구시는 올 연말까지 사업대행자 선정을 마무리할 계획으로, 향후 추가적인 사업설명회를 개최해 국내 공공기관, 금융사, 건설사 뿐만 아니라 참여를 희망하는 해외투자자 등 다양한 기관들과 소통을 강화해 나갈 계획이다. 더불어 6월에는 지역기업을 위한 사업설명회도 별도로 개최할 예정이다.
이종헌 대구광역시 신공항건설본부장은 “대구경북신공항 특별법 제정을 통해 사업대행자의 리스크를 많이 줄인 만큼 공공과 민간 모두의 적극적인 참여와 관심이 필요하다”면서, “지역을 넘어 전 국가적인 대형 국책사업인 대구경북신공항 건설 및 종전부지 개발사업의 성공을 위해 대구광역시는 총력을 다하겠다”라고 말했다. 윤기영기자",http://www.newgbnews.com/news/view.php?idx=307441
대구,세계 최고 물 전문가들 ‘대구로~’,일간경북신문 - 윤기영 기자,2023/05/29,"대구광역시는 세계 최고 물 전문가들이 참여하는 ‘제18회 국제 선진 수처리기술 컨퍼런스(IWA LET 2023)’를 29일부터 6월 2일까지 대구엑스코에서 개최한다. 29일 대구광역시에 따르면 'IWA LET 2023'은 국제적인 상·하수도 전문학회인 국제물협회(IWA), 국제물협회 한국 위원회와 대구광역시가 공동으로 개최하는 행사로 지난 2022년 3월 대구시, 국제물협회 한국위원회, 대구컨벤션뷰로와 함께 유치했다.
이번 행사는 ‘물기술을 통한 지속가능성 확보’라는 주제로 수처리 관련분야 기업, 전문가, 연구자, 학자, 공공기관 관계자 등 31개국 450여 명이 참가할 예정이며 워크숍, 기조강연, 기술세션, 포스터세션, 산업시찰과 전시회 등으로 구성된다. 기조강연에는 5개국에서 7명의 수처리 관련 해외 기업인과 연구자 등이 강연자로 초청된다.
또한 'IWA LET 2023' 개회식 직후 세계 물문제 해결을 위한 협력강화와 선진 물기술 홍보 및 보급에 기여하고 물 분야 연구, 개발의 상호발전을 위한 지속적인 교류 및 협력을 위해 'IWA'와 업무 협약도 체결한다.윤기영기자",http://www.newgbnews.com/news/view.php?idx=307345
대구,대구교통공사 “대통령상 받았다”,일간경북신문 - 이종구 기자,2023/05/29,,http://www.newgbnews.com/news/view.php?idx=307273
대구,달성문화재단 ‘법정 문화도시’ 선포식,일간경북신문 - 윤기영 기자,2023/05/29,"200억 예산 지역 발전 사업

달성문화재단 달성문화도시센터는 누구에게나 호혜로운 문화도시 조성을 위한 달성군 법정 문화도시 선포식을 30일 오후 2시, 호텔 아젤리아 대강당에서 개최한다.
달성군은 2022년 12월 문화체육관광부가 시행하는 제4차 법정 문화도시 공모에 선정돼 금년부터 문화도시 본 사업을 추진하고 있으며, 향후 5년간 국비 100억 원을 포함한 최대 200억 원 규모의 예산을 기반으로 지역문화 발전을 위한 사업이 전개된다.
달성군 법정 문화도시 선포식은 문화도시 조성을 위한 정책적 발전과 지역문화 성장 의지를 표명해, 문화를 통해 ‘군민이 빛나는 달성’을 실현하고 ‘달성문화도시’ 조성을 다짐하는 도약의 장이 마련될 예정이다.
이번 선포식은 군정을 이끄는 최재훈 달성군수의 문화군수 선포를 통해 장기적 문화도시 발전 비전 선언과 군정의 정책적 지원 확산을 도모하고, 지속 가능한 사업 추진성 확보와 체계적 경영구조 구축을 위해 행정협의체 구성원에 대한 ‘문화 읍·면장’ 위촉과 문화도시의 주체인 시민들의 사업 참여 확대와 주체성 확보를 위한 ‘명예시민 문화 읍·면장’ 위촉을 진행한다. 윤기영기자",http://www.newgbnews.com/news/view.php?idx=307272
