지역명,기사제목,기자이름,날짜,내용,링크
영주,‘영주장날 쇼핑몰’ 17주년 기획전,일간경북신문 - 금인욱 기자,2023/05/31,,http://www.newgbnews.com/news/view.php?idx=307580
영주,영주 첨단베어링 국가산단 지정·승인 임박,일간경북신문 - 금인욱 기자,2023/05/31,"중앙토지수용위원회 심의 통과
2900억 투입…118만㎡ 조성
영주 첨단베어링 국가산업단지 조성사업의 국토교통부 지정·승인이 눈앞으로 다가왔다.
영주시는 첨단베어링 국가산업단지 조성사업이 지난 25일 개최된 중앙토지수용위원회 공익성 심의에 통과했다고 밝혔다.
중앙토지수용위원회의 공익성 심의는 국가산업단지 조성에 따른 사업의 공공성과 토지수용의 타당성을 검토하는 절차로 국가산업단지 계획 승인의 마지막 관문 중 하나다.
앞서, 시는 지난해 4월 국토교통부에 산업단지계획 승인신청서를 제출한 이후 관련기관(중앙, 道·市, 유관기관) 협의를 잇달아 완료했다. 가장 큰 난관으로 여겨졌던 농림부 농지전용 협의와 환경부 환경영향평가 협의를 지난해 12월과 올해 3월에 각각 끝마쳤다.
이번 공익성 심의까지 통과함으로써 사실상 모든 행정절차를 완료하였으며, 국토부 산업단지계획 심의 하나만을 남겨두고 있는 상태다.
산업단지계획 심의는 30인 이내의 위원들이 도시계획, 교통, 에너지, 경관 등 전 분야에 걸쳐 한꺼번에 심의하는 절차로서 오는 6월 중에 개최될 예정이다.
시는 국가산업단지가 6~7월에 지정 승인되면 올해 하반기부터 보상계획 공고, 토지 및 지장물 조서 작성, 감정평가 등 본격적인 보상을 위한 절차이행에 들어갈 방침이다. 본격적인 조성공사는 2024년 착공, 2027년 준공을 목표로 추진계획이다.
박남서 영주시장은 “지금까지 국가산단을 위해 지역 국회의원을 비롯해 영주시민 모두 하나가 되어 일궈낸 성과로써, 10만 영주시민의 오랜 염원인 국가산업단지 지정·승인이 이제 눈앞으로 다가왔다.”며, “마지막까지도 긴장의 끈을 늦추지 않고 국가산업단지 최종 승인을 위해 모든 행정력을 집중하고, 혼신의 노력을 다하겠다.”고 말했다.
한편, 영주 첨단베어링 국가산업단지는 지난 2018년 영주시가 국가산업단지 후보지로 지정되면서 본격적으로 추진해 온 사업으로 총사업비 2900여억 원을 투입해 영주시 적서동과 문수면 권선리 일대 118만㎡(약 36만평) 규모로 조성하는 사업이다.
국가산업단지가 성공적으로 조성되면 직‧간접고용 4700여 명 등 1만300여 명의 인구증가 효과와 지역 내 연간 760억 원의 경제유발 효과를 일으켜 인구소멸도시 위기 극복과 지역경제 활성화에도 크게 기여할 것으로 기대된다.금인욱기자",http://www.newgbnews.com/news/view.php?idx=307576
영주,"영주콩세계과학관, 다양한 체험 프로 ‘호응’",일간경북신문 - 금인욱 기자,2023/05/30,,http://www.newgbnews.com/news/view.php?idx=307461
영주,‘영주 죽령장승제’ 이색 볼거리 제공,일간경북신문 - 금인욱 기자,2023/05/29,,http://www.newgbnews.com/news/view.php?idx=307295
영주,“2차 공공기관 인구감소지역 우선 배치” 촉구,일간경북신문 - 금인욱 기자,2023/05/25,,http://www.newgbnews.com/news/view.php?idx=307149
영주,"영주시청 박순호, 예천실업육상 높이뛰기 1위",일간경북신문 - 금인욱 기자,2023/05/25,,http://www.newgbnews.com/news/view.php?idx=307148
영주,영주형 스마트팜 표준모델 개발,일간경북신문 - 금인욱 기자,2023/05/25,"영주시는 24일 농업기술센터 농업체험교육관에서 스마트팜 적용 희망 농업인 30여 명이 참석한 가운데 ‘영주형 스마트팜 표준모델개발 위한 세미나’를 개최했다.
이번 세미나는 현재 시가 진행 중인 ‘영주형 스마트팜 표준모델개발 연구용역’과 연계해 지역 실정에 맞는 표준모델 마련을 위해 추진됐다.
세미나에서는 먼저 △홍연웅 동양대학교 교수의 스마트팜의 국내외현황 △박선진 한국폴리텍대학 학장의 하이브리드 신재생 에너지 △스마트팜 협력업체인 모모스 김준모 대표의 노지스마트팜의 구성 등에 대한 발표가 진행됐다.
이어서 영주형 스마트팜 보급을 위한 스마트팜 현장적용 실용과정 교육생과 농업인의 질의와 관련 전문가들의 응답 및 토론으로 이날 세미나는 종료됐다.
참석자들은 이번 세미나가 스마트팜이 시설원예 및 대형화 농업에 적용된다는 선입견으로 일선 농가에서 거리감을 느껴 스마트팜 보급이 저조한 가운데 지역 실정에 맞는 표준모델을 제시한 현장 중심의 세미나였다고 입을 모았다.
스마트팜 교육생은 “이번 스마트팜 세미나를 통해 현장 적용 가능한 스마트팜에 대해 자세히 알게 됐다. 농가에서 스마트팜 적용이 가능하도록 PCL과 아듀이노교육과정이 개설되고, 신재생에너지와 연계한 스마트팜 개발이 됐으면 한다”고 세미나 참석 소감을 밝혔다.
영주형 스마트팜 표준모델 개발에 관한 자세한 사항은 영주시농업기술센터 기술지원과 기술개발팀(054-639-7386)으로 문의하면 된다.금인욱기자",http://www.newgbnews.com/news/view.php?idx=307142
영주,"영주 우수 농특산물, 북미 시장진출 나섰다",일간경북신문 - 금인욱 기자,2023/05/24,,http://www.newgbnews.com/news/view.php?idx=306957
영주,MZ세대 공직자 혁신 주니어보드 정책 기여,일간경북신문 - 금인욱 기자,2023/05/24,"예천군은 23, 24일 20대~30대 MZ세대 공직자들로 구성된 ‘혁신 주니어보드’ 역량강화 워크숍을 진행했다.
젊은 직원들의 참신한 아이디어를 행정에 접목하기 위해 27명 5개팀으로 운영 중인 혁신 주니어보드는 지난 10일 발대식을 가졌다.
△생활편의성 △공간활력/재생 △인구‧저출산 △환경교육 △문화관광 5개 분야에 대한 정책개발 및 현안 문제 해결을 위한 아이디어를 발굴할 계획이다.
이번 워크숍을 통해 중앙부처 예산 및 공모사업 대응 방법, 사업계획서 작성 등 교육을 받았으며 조직문화 개선 특강 등 예천군 행정조직의 혁신을 위한 기량을 다졌다.
또한, 전문 컨설턴트의 교육과 1대1 맞춤형 컨설팅으로 오는 7월까지 각 팀별로 선정한 분야에 대해 정책발굴을 완료하고 향후 군정에 반영할 방침이다.
김학동 군수는 “젊은 공직자들이 바쁜 업무에도 불구하고 적극적으로 군정 발전을 위해 주니어보드에 참여해 주셔서 감사드린다.”며 “톡톡 튀는 아이디어로 예천군 행정 혁신에 앞장서주시길 바란다.”고 말했다.금인욱기자",http://www.newgbnews.com/news/view.php?idx=306955
영주,"영주, 도내 첫 소상공인 ‘복합지원센터’",일간경북신문 - 금인욱 기자,2023/05/24,,http://www.newgbnews.com/news/view.php?idx=306947
영주,"영주, 공공일자리 참여자 60명 모집",일간경북신문 - 금인욱 기자,2023/05/23,"영주시는 취업·취약계층 고용 대책의 일환으로 22일 시작해 다음달 2일까지 ‘지역공동체일자리사업’과 ‘공공근로사업’ 참여자를 모집한다.
지역공동체일자리사업은 12개 사업장(△서천 수변식생공원 조성사업 △소수서원 탐방로 정비사업 △남원천 고향의 강 가꾸기 사업 △가흥1동 마을가꾸기 사업 등)에 33명을 선발한다.
공공근로사업은 24개 사업장(△영주시 근로자복지회관 환경정화사업 △ 전통시장 활성화 및 업무 지원사업 △시민운동장 환경정화사업 등)에 27명을 선발한다. 참여자격은 사업 개시일 현재 만 18세 이상의 근로능력이 있는 자로서 취업 취약계층, 무급휴직자 등 지역경제 침체로 생계지원이 필요한 영주시민이다.
두 사업 모두 7월 3일부터 10월 31일까지 4개월간 시행할 예정이다. 사업 참여를 희망하는 시민은 신분증을 지참해 주소지 읍면동 행정복지센터에서 방문 신청하면 된다. 기타 자세한 사항은 시청 홈페이지 채용공고란 및 영주시청 일자리경제과(054-639-6153)로 문의하면 된다.금인욱기자",http://www.newgbnews.com/news/view.php?idx=306861
영주,"영주, 중증장애인생산품 전시·판매",일간경북신문 - 금인욱 기자,2023/05/23,,http://www.newgbnews.com/news/view.php?idx=306857
영주,영주 “선비 만나러 갑니다” 가족 프로,일간경북신문 - 금인욱 기자,2023/05/22,,http://www.newgbnews.com/news/view.php?idx=306657
영주,영주 소백산 비로·국망봉 ‘연분홍 철쭉’ 방긋,일간경북신문 - 금인욱 기자,2023/05/22,,http://www.newgbnews.com/news/view.php?idx=306656
영주,"상주, 치매의심자 발굴… 사각지대 해소",일간경북신문 - 김학전 기자,2023/05/21,,http://www.newgbnews.com/news/view.php?idx=306573
영주,"영주, 쇼핑관광 활성화…국비 5억 확보",일간경북신문 - 금인욱 기자,2023/05/21,"영주시가 문화체육관광부 ‘쇼핑관광 활성화’ 공모사업에 최종 선정돼 전통시장을 대상으로 쇼핑관광 활성화 사업을 추진한다고 지난 19일 밝혔다.
시에 따르면 영주는 관광객이 쇼핑 매력을 느낄만한 한우, 인삼, 인견 등 지역 특산품이 다양하고 전통시장 시설이 잘 갖춰져 있어 쇼핑관광 상품 개발 가능성이 높다고 평가받아 이번 공모사업에 선정됐다.
쇼핑은 관광활동의 주요 동기이자 주요 참여 활동으로 관광 만족도 제고 및 내수경제 활성화에 중요한 역할을 한다.
시는 쇼핑관광의 중요성을 인지하고 전통시장을 중심으로 한 관광객 쇼핑편의 서비스 구축, 지역 특산품과 연계한 쇼핑관광 콘텐츠 기획 및 제작을 주요 사업계획으로 지난 4월 문화체육관광부 쇼핑관광 활성화 공모사업에 응모했다.
이번 공모사업 선정으로 5억원의 국비를 지원받아 총 10억원의 사업비로 올해 쇼핑관광 활성화 사업을 추진하게 된다. 금인욱기자",http://www.newgbnews.com/news/view.php?idx=306544
영주,"영주의 특색·매력, 릴스 영상·사진으로~",일간경북신문 - 금인욱 기자,2023/05/21,"영주시는 총 상금 600만원 규모의 ‘2023영주 릴스 영상·사진 공모전’을 개최한다.
이번 공모전은 영주를 소재로 참신한 홍보 콘텐츠를 발굴하고, 향후 홍보에 널리 활용하기 위한 목적으로 기획된 것으로 대한민국 국민 누구나 개인 또는 팀(4인 이내)으로 참여할 수 있다.
공모는 6월 19일까지 릴스 영상·사진 2분야 나눠 진행되며 개인(팀)당 타 공모전 수상 이력이 없는 순수 창작물 2편 이내 출품할 수 있다.
공모주제는 영주 특색과 매력을 표현하는 자유주제(△관광 △명소 △축제 △추억 △맛집 △일상 △체험 등)로, 릴스 영상은 15 ~ 60초 분량의 해상도 FHD(1080×1920Pixel) 이상, 사진은 길이가 짧은 쪽이 3000Pixel 이상으로 촬영해야 한다.
접수된 작품은 제출서류 및 결격 사유를 심사하는 1차 내부 심사 진행 후, 주제 적합성·완성도·창의성·대중성·활용성을 기준으로 2차 심사위원 심사를 거쳐 6월 중 수상작을 발표한다.
수상작은 총 12편(릴스 영상 6편·사진 6편)으로 릴스 영상 분야는 최우수상 1편 150만원, 우수상 2편 각 80만원, 장려상 3편 각 30만원, 사진 분야는 최우수상 1편 70만원, 우수상 2편 각 35만원, 장려상 3편 각 20만원의 상금과 영주시장 상장을 7월 중 시상한다.
수상작은 영주시 관련 사회관계망 서비스(SNS)와 홈페이지 등을 통해 영주의 매력을 알리는 홍보 콘텐츠로 활용할 계획이다.
참가 희망자는 작품 파일과 공모전 참가신청서 등 관련 서류를 작성해 이메일(yangh202@korea.kr)로 제출하면 된다.
공모전 참여 관련 서류와 자세한 사항은 영주시청 홈페이지 고시/공고(https://www.yeongju.go.kr)를 통해 확인할 수 있으며, 기타 문의는 홍보전산실 홍보기획팀(054-639-6204)으로 하면 된다.금인욱기자",http://www.newgbnews.com/news/view.php?idx=306539
영주,"영주, 방범용 CCTV 안내판 교체·현행화",일간경북신문 - 금인욱 기자,2023/05/18,,http://www.newgbnews.com/news/view.php?idx=306346
영주,SK스페셜티 ‘STAXX’ 로 지역경제 활성화,일간경북신문 - 금인욱 기자,2023/05/18,,http://www.newgbnews.com/news/view.php?idx=306341
영주,삼봉·소백산배 전국오픈탁구,일간경북신문 - 금인욱 기자,2023/05/17,"‘2023 영주시 삼봉배 및 소백산배 전국오픈탁구대회’가 19일~ 21일까지 3일간 영주국민체육센터에서 개최된다.
영주시체육회와 영주시탁구협회가 주최/주관하고 영주시가 후원하는 이번 대회에는 전국의 생활체육 탁구동호인 800여 명이 참가한다.
올해부터는 2014년부터 개최된 삼봉배 라지볼 탁구대회와 2019년 첫 개최 이래 올해로 5년째인 소백산배 전국오픈탁구대회를 함께 개최해 전국 규모 대회에 참가하고자 하는 탁구 동호인들의 기대가 더욱 커졌다.
대회 첫날인 19일에 열리는 라지볼 탁구대회는 탁구를 변형해서 만든 종목으로 일반 탁구공보다 크면서 노란색 공을 사용하고, 네트 높이도 20mm 높여 초보자나 어르신들도 쉽게 배울 수 있다.금인욱기자",http://www.newgbnews.com/news/view.php?idx=306210
영주,"영주, 건강검진부터 문화공연까지 ‘호응’",일간경북신문 - 금인욱 기자,2023/05/17,"영주 시민건강 체험마당이 16일 저녁 개막해 18일까지 서천 배고개둔치에서 펼쳐진다.
코로나19로 4년 만에 재개된 시민건강 체험마당은 시민들의 편의와 접근성을 높이기 위해 저녁 7시부터 진행된다.
올해는 영주시의사회, 한의사회, 치과의사회, 약사회, 안경사회, 간호사회 등 지역보건 의료단체와 대학·병원·국민건강보험공단 영주봉화지사·영주시걷기협회 등 34개 기관단체가 참여해 다양한 체험 부스를 운영한다.
14회째를 맞는 이번 행사에서는 진료상담, 건강검사, 건강생활실천 등 30여 개 체험관을 운영하고 걷기 활성화를 위한 야간 걷기행사도 진행된다.
주요 프로그램으로는 갑상선초음파, 한방진료, 구강진료, 약물 오남용 상담 등 진료상담과 혈압 및 당뇨, 빈혈, 체성분검사, 시력검사 등 평소 소홀할 수 있는 기본적인 건강검사, 올바른 걷기체험, 금연·절주, 치매검진, 감염병예방 등 건강생활실천 체험, 심폐소생술, 구강관리 등 생활 속에서 실천할 수 있는 건강관리체험 등이 진행된다.
행사기간 중 3개 어린이집 원아들의 율동, 드럼북, 댄스 시연과 걷기체조 및 의용소방대원들의 심폐소생술 시연 등 공연, 야간 서천걷기행사 등도 진행된다.
특히 야간 서천걷기행사는 17일 저녁 8시 영주시걷기협회와 걷기동호회의 협조로 참여 행사장에서 제2가흥교까지 코스를 시민들과 함께 걷는다. 시는 이번 행사로 걷기의 중요성을 홍보하고 시민들이 일상생활에서 걷기를 실천할 수 있는 계기를 마련하고자 한다.금인욱기자",http://www.newgbnews.com/news/view.php?idx=306207
영주,‘영주 풍기인견’ 4년만의 서울나들이,일간경북신문 - 금인욱 기자,2023/05/17,"‘영주 풍기인견’ 4년만의 서울나들이
영주시가 주최하고 사단법인 풍기인견발전협의회가 주관하는 ‘2023 영주 풍기인견 서울페스티벌’이 다음달 2, 3일 서울 ‘광화문광장’에서 열린다.
매년 본격적인 무더위가 시작되는 6월 서울을 찾는 ‘영주 풍기인견 서울페스티벌’은 ‘에어컨 원단’, ‘아이스 실크(ice silk)’로 불리는 풍기인견의 우수성을 서울 시민들에게 소개하고 알리는 행사다.
코로나19 팬데믹 이후 4년 만에 재개되는 만큼 더욱 다양하고 풍성한 볼거리를 준비하고 있어 풍기인견을 애용하는 소비자들에게는 더없이 반가운 소식일 것이다.
행사기간 동안 전시‧홍보 및 체험 부스를 운영해 여러 브랜드의 다양한 풍기인견 제품을 접할 수 있으며, 풍기인견 제품들로 꾸민 포토존을 만들어 행사장을 찾는 방문객에게 ‘풍기인견 인생샷’ 즉석사진 촬영 기회를 제공한다.
또, 2일 오후 7시 30분 개막식과 함께 개최되는 풍기인견 패션쇼에서는 새롭게 개발된 인견과 대마의 복합직물 원단을 이용해 제작한 의상을 선보일 예정이다.
박남서 영주시장은 “여름에 특히 인기 있는 풍기인견을 대도시 소비자에게 직접 홍보해 침체된 풍기인견 산업의 새로운 판로를 개척하고자 이번 행사를 준비했다”며 “새롭게 단장한 광화문광장에서 풍기인견과 함께 시원하고 신나는 도심 속 축제를 즐기시길 바란다”고 전했다. 풍기인견은 나무에서 추출한 실로 만든 순수 식물성 자연섬유로 가볍고 시원하며 착용 시 촉감이 상쾌하고 땀 흡수력이 탁월한 친환경 섬유다. 무더운 여름철이면 피부가 여린 갓난아이부터 알레르기성 피부, 아토피성 피부 등 피부가 약한 사람에게 잘 맞다. 연로하신 노인 분들에게는 더 없는 효도 상품이기도 하다.금인욱기자",http://www.newgbnews.com/news/view.php?idx=306203
영주,"영주, 동양대서 ‘찾아가는 전입창구’",일간경북신문 - 금인욱 기자,2023/05/16,"영주시는 5월 대학교 축제 시즌을 맞아 16일 동양대학교에서 ‘찾아가는 전입창구’를 운영했다.
찾아가는 전입창구는 평소 바쁜 일상으로 행정복지센터 방문이 어려운 대상자가 다수인 곳을 방문해, 영주시 인구정책 홍보와 함께 현장에서 전입신고 행정서비스를 제공하고 있는 시책사업이다.
특히, 학업을 위해 타 지역에서 이동해 영주시에 실거주하고 있는 학생 중 일부는 전입신고 의무를 몰라 전입신고를 미루는 경우가 있다. 전입신고는 주택임대차보호법상의 권리 보호와 지원금 혜택을 위해서 필수적인 절차이다.
시는 16일 동양대학교 대동제에서 학생과 교직원들에게 전입신고와 지원금 접수, 건강보험 추가증 신청을 대행하는 편의를 제공했다.
이와 함께 시가 추진하는 지역대학 재학생 지원사업과 전입 시책 등을 집중적으로 홍보했다.
특히, 이날은 축제 분위기에 맞게 전입 창구 내에 각종 미니게임 등 즐길거리를 갖춰 축제를 참가한 학생들이 전입 창구에 보다 쉽게 접근할 수 있게했다.금인욱기자",http://www.newgbnews.com/news/view.php?idx=306019
영주,영주 “안전체험관 후보지 탈락” 아쉬움,일간경북신문 - 금인욱 기자,2023/05/16,,http://www.newgbnews.com/news/view.php?idx=306018
영주,상주 ‘도시재생사업’ 주민의견 적극 수렴,일간경북신문 - 김학전 기자,2023/05/15,"상주시는 지난 12일 14시 상주시 도시재생지원센터 2층 회의실에서 한국농어촌공사 상주지사의 주최로 도시재생 뉴딜사업(중심시가지형) 실시설계 착수보고회를 개최했다.
중심시가지형 사업은 2021년 국토교통부 공모사업에 선정되어 총 250억 원(국비 150, 도비 25, 시비 75)의 예산으로 왕산역사공원 일원에 시행되는 사업이다. 이번 실시설계 착수보고회에서는 본격적인 실시설계에 앞서 설계업체의 착수보고를 듣고 상주시 관계 부서 담당자와 왕산지구 도시재생추진위원회 구성원 등 30여 명이 모여 의견을 나누는 시간을 가졌다.
강영석 상주시장은 “많은 주민분들의 협조와 노력으로 선정된 도시재생사업의 원활한 추진을 위해 관계부서와 주민의 의견을 적극 수렴하는 시간이 되었으면 한다.”고 말했다. 김학전기자",http://www.newgbnews.com/news/view.php?idx=305914
영주,"마지막 봄꽃, 연분홍빛 향연…‘영주 소백산철쭉제’ 27일",일간경북신문 - 금인욱 기자,2023/05/15,,http://www.newgbnews.com/news/view.php?idx=305878
영주,손성호·우충무 영주시의원 5분 발언 ‘눈길’,일간경북신문 - 금인욱 기자,2023/05/15,"영주시의회는 15일 제2차 본회의를 끝으로 5일간의 제272회 임시회 일정을 마무리했다.
제2차 본회의에서는 ▲영주시 소수박물관 관리 및 운영 조례 전부개정조례안 ▲영주시 인삼박물관 관리 및 운영 조례 전부개정조례안 ▲영주시 가축사육 제한에 관한 조례 일부개정조례안을 의결하였으며, 특히 손성호(국민의힘, 라 선거구, 이산면․평은면․문수면․장수면․휴천1동), 우충무(무소속, 다 선거구, 가흥1․2동) 의원이 5분 자유발언을 펼치며 활발한 의정활동을 펼쳤다.
손성호 의원은 5분 자유발언을 통해 ‘본격적인 행락철에 앞서 영주시 관광의 문제점을 분석하고, 개선방안’에 대해 제안했다.
손성호 의원은 “영주시는 숙박 및 교통체계 부족으로 체류형 관광객이 부족하고, 관광 소비 촉진을 위한 유인이 부족한 상황”이라고 지적하며 이를 위해 ‘「체험형 문화재 야행(夜行)」 정기 운영 콘텐츠 개발을 통한 야간관광 활성화 정책추진, 아동친화도시 영주시의 강점을 살려 <아이와 함께 한달살기 좋은 도시 영주>로 체류형 관광객 유치, 단체 관광객의 365시장 접근성 향상을 위한 대형 주차 공간 조성과 전통시장 활성화 방안 마련 등’을 제안했다.
손성호 의원은 “우리 지역의 강점은 살리고 약점은 보완하여 영주시가 거쳐 가는 도시가 아닌 체류형 관광 도시로서 고부가가치를 창출하고, 방문자 경제 활성화로 인구 활력이 넘쳐날 수 있도록 모두 최선을 다해 주시길 바란다”며 5분 자유발언을 마쳤다.
우충무 의원은 ‘지역의 산림자원 활용을 통한 체류형 지역 관광객 유치 방안’에 대해 5분 자유발언을 펼쳤다.
우충무 의원은 “영주는 ‘선비’라는 정신문화를 관광과 축제 등에 접목하다 보니 현재의 관광트렌드와 수요자의 관광 욕구에 부응하지 못한 채 정체된 도시 이미지로 외부인들에게 각인되어 관광 매력도와 도시 인지도를 잃어가고 있다”고 지적하며 “지금이라도 한옥으로 가득한 관광개발 방식의 틀에서 벗어나 우수한 우리시의 관광자원을 활용한 다양한 정책개발을 시작해야 할 때라고 생각한다”고 밝혔다.
이에 우충무 의원은 ‘국립산림치유원 인근 관련 인프라와 연계한 체류형 치유시설의 확충을 지방소멸대응기금 투자계획안에 포함하여 진행할 것과 워케이션, 디지털노마드 등 최근 변화하는 근로 여건 및 시대적 트렌드와 연계한 체류형 기반 및 프로그램의 개발과 홍보를 위한 다각적인 대응 등’을 요청했다.
심재연 의장은 “이번 회기 동안 조례안 심사와 5분 자유발언, 주요 사업장 현장방문 등 시민의 복리 증진에 힘써주신 동료 의원님들께 감사드리며, 집행부에서는 동료의원들이 안건 심사에서 지적한 사항들과 5분 자유발언 내용들을 적극 검토하여 시정에 반영해 줄 것을 당부드린다”고 말했다.금인욱기자",http://www.newgbnews.com/news/view.php?idx=305868
영주,"영주시의회, 주요사업장 6개소 점검",일간경북신문 - 금인욱 기자,2023/05/14,"영주시의회는 지난 12일 제272회 임시회 기간 중 효율적인 지역발전 방안을 모색하기 위해 귀농귀촌인 정착준비 보금자리를 비롯한 총 6개소의 사업장을 방문하여 주요 현안을 점검했다.
먼저 귀농귀촌인 정착 준비 보금자리 현장에 방문하여 관계 공무원과 사업현장의 추진상황을 점검하고 관계자로부터 문제점과 건의사항을 수렴하고 향후 개선사항과 발전방향을 논의했다. 이후 순흥면 소재의 코레일 인재개발원 조성지, 배점분교 오토캠핑장 부지를 방문하여 현장을 점검하고 관광객 확보와 지역경제 활성화에 기여할 수 있도록 노력해달라고 당부했다.
이밖에도 장수면의 영주시 거점 세척 소독시설, 베어링 제조기술센터, 평은면의 영주호 오토캠핑장을 방문하여 시민들의 불편함이 없도록 철저한 공사 진행을 주문했다. 금인욱기자",http://www.newgbnews.com/news/view.php?idx=305722
