지역명,기사제목,기자이름,날짜,내용,링크
영주,영양취약계층 체계적 관리 서비스 제공,일간경북신문 - 금인욱 기자,2023/05/14,"영주시보건소는 영양플러스사업 신규대상자의 건강한 식생활에 대한 이해도를 높이기 위해 지난 12일 임산부 및 영유아 105명을 대상으로 ‘2023년 영양플러스사업 신규대상자 사업설명회’를 개최했다.
이번 사업설명회는 영양플러스 사업 추진방향 및 목적, 보충식품 지원내용, 정기적 영양평가 등의 사업 설명과 함께 식생활 관리능력 향상을 위한 평소 궁금했던 것에 대한 안내도 병행했다.
영양플러스 사업은 생리적 요인과 환경 여건 등으로 영양상태가 상대적으로 취약한 대상자에게 일정 기간 영양교육과 보충 식품을 제공하여 영양 섭취 상태를 개선하고, 식생활 인식을 제고시키기 위한 사업으로 시 보건소는 지난달 3일부터 14일까지 신규대상자 105명(91가구)을 모집했다.
신규대상자들에게는 6개월에서 12개월까지 대상자별 맞춤형 식품패키지(분유, 우유, 검정콩, 미역, 김, 달걀, 현미 등)를 월 2회 가정으로 배송되고, 체계적인 영양관리와 보충식품 보관방법 등에 대한 정기적인 교육도 월 1회 실시된다.
관계자는 “개인별 유형에 맞는 맞춤형 영양교육을 강화해 영양취약계층 대상자의 영양불량문제 해소와 식생활 개선에 많은 도움이 되기를 바라며, 시민의 건강을 위한 사업 발굴 추진에 최선을 다하겠다”고 말했다.금인욱기자",http://www.newgbnews.com/news/view.php?idx=305700
영주,마스터즈 사이클 영주투어…전국서 550명 달렸다,일간경북신문 - 금인욱 기자,2023/05/14,,http://www.newgbnews.com/news/view.php?idx=305699
영주,KTX타고 떠나는 영주 하루 ‘로컬투어’,일간경북신문 - 금인욱 기자,2023/05/11,"영주시가 카카오 메이커스에서 판매 중인 ‘KTX 타고 떠나는 영주 하루 로컬 투어 상품’이 판매 10일 만에 417명이 신청해 대박 행진을 펼치고 있다.
11일 영주시에 따르면 열차 전문 여행사(해밀여행사)와 함께 기획한 KTX-이음과 영주시 관광지·먹거리를 연계한 로컬 투어 상품은 ‘영주 한우열차 관광상품’으로 불리며 경상북도 하루여행 전체 상품 중 11일 기준 현재 단연 판매실적 1위를 기록 중이다.
여행은 오전 8시 30분 청량리역 여행센터에 집결해 KTX를 타고 1시간 30분을 달려 풍기역에 도착, △소백산 국립산림치유원, 부석사 △소수서원(선비촌) △영주 관사골을 여행하는 코스로 KTX 이음 열차(왕복), 연계 차량비 입장료, 점심 및 저녁 식사(한우), 인솔가이드가 제공된다.
운영 기간은 13일부터 내달 29일까지(매주 화, 목, 토, 일)이며 판매가격은 성인 13만 9000원, 소인(만 5세~초등학생) 11만 9000원이다.
유네스코 세계유산 영주 부석사와 소수서원(선비촌) 관람, 소백산 숲속에서 체험하는 자연치유 프로그램, 현지인 추전 맛집에서 즐기는 한우 디너세트(1인당 200g)와 간고등어 점심과 감자전 정식 한상, 가이드 동행 및 지역별 대형버스 연계 차량 등이 제공돼 힐링과 먹거리 투어를 함께 할 수 있는 것이 영주 여행상품의 매력이다.금인욱기자",http://www.newgbnews.com/news/view.php?idx=305551
영주,"풍기 성내공원, 도심형 어린이 놀이터 착공",일간경북신문 - 금인욱 기자,2023/05/11,"영주시가 ‘2022년 경북도 어린이놀이터 공모사업’에 선정돼 세이브더칠드런 동부지역본부와 함께 추진 중인 풍기성내공원 어린이 놀이터 조성사업이 오는 9월 준공을 목표로 최근 공사에 들어갔다.
총사업비 10억 2000만원이 투입된 어린이 놀이터는 설계에서부터 지역주민들과 어린이들의 의견을 반영해 기존 놀이터의 정형화된 틀을 깨고, 어린이들의 창의력 증진 및 모험심과 호기심을 높여주는 아동 친화 놀이 공간으로 풍기의 랜드마크 놀이터로 자리 잡을 것으로 기대를 모으고 있다.
주요 시설은 어린이 놀이기구 및 주민휴양 시설 등이 설치되며, 놀이기구는 2층으로 구성된 미끄럼틀 및 네트놀이, 유아 놀이터 및 6인용 그네 등으로 조성된다.
김동택 문화복지국장은 “안전에 유의해 공사를 진행하고, 공사 추진으로 인근 주민들의 불편하지 않도록 심혈을 기울일 것”이라고 말했다.
금인욱기자",http://www.newgbnews.com/news/view.php?idx=305549
영주,"영주, 개인정보관리 2년 연속 ‘최고등급’",일간경북신문 - 금인욱 기자,2023/05/10,"영주시는 공공기관 개인정보 관리수준진단에서 2년 연속 최고등급을 받았다고 10일 밝혔다. 시는 개인정보보호위원회가 중앙부처‧지자체‧공기업 등 799개 공공기관을 대상으로 실시한 ‘2022년 개인정보 관리수준진단’ 평가에서 최우수(S등급) 평가를 받아 지난해에 이어 2년 연속적으로 최고등급을 받았다.
이번 평가는 법적 의무사항 이행에 대한 정량지표(61개)와 혁신‧정책업무의 적절성에 대한 정성지표(5개)에 대해 진단해 S(90점 이상)부터 D(60점 미만)까지 5등급을 부여했다.
시는 61개 지표에서 만점을 받아 총점 94점으로 S등급을 받아 개인정보 관리수준이 매우 우수한 것으로 평가받았다.
시는 올해 ‘개인정보보호 배상책임보험’에 신규로 가입해 시에서 취급하는 개인정보가 유출‧분실‧도난 등의 사고로 시민들에게 피해가 발생하였을 때 손해를 배상해주기 위한 기반을 마련했다.
매년 전 직원을 대상으로 개인정보보호 교육을 실시하고, 개인정보처리시스템 접속기록을 매월 점검하며, 개인정보 처리업무 수탁업체를 교육‧감독하고 있다.금인욱기자",http://www.newgbnews.com/news/view.php?idx=305410
영주,"영주, 소백산국립공원 구역 1.705㎢ 해제",일간경북신문 - 금인욱 기자,2023/05/10,,http://www.newgbnews.com/news/view.php?idx=305405
영주,"영주, 경북도 첫 청년 이사비 최대 50만원",일간경북신문 - 금인욱 기자,2023/05/09,"영주시가 청년들의 주거 안정을 위해 최대 50만 원까지 이사비용을 지원한다.
경북도 최초로 시행하는 청년 이사비 지원사업은 이삿짐 운반·포장비뿐만 아니라 부동산 중개수수료, 입주청소비 등 이사에 소요되는 실비를 지원하는 사업이다. 사업대상은 올해 1월 1일 이후 주택을 임차(전·월세) 또는 매수해 영주시로 전입 또는 이사해 3개월 이상 거주하면서 건강보험료가 기준 중위소득 150% 이하인 청년 세대주(만 19~39세)이다.
신청은 12월 20일까지 주택 매매계약서 또는 임대차계약서 사본, 이사 실비 지출 증빙서류 등을 첨부해 가까운 읍면동 행정복지센터나 시청 일자리경제과로 방문하면 된다.
주민등록등본상 동거인(부모, 배우자, 형제·자매 등)이 있어도 지원할 수 있으나 매수(임차)인은 청년 세대주 본인일 경우만 신청가능하다. 단, 부모 소유 주택을 매수하거나 임차하는 경우는 대상에서 제외한다.
김영수 일자리경제과장은 “영주시에 이사 및 전입하는 외지 청년들에게 이사비용을 지원함으로써 경제적 부담을 완화해주고, 관내 청년인구 증대 효과도 기대한다”고 말했다.금인욱기자",http://www.newgbnews.com/news/view.php?idx=305237
영주,"영주, 구도심·신도시 연결도로 추가 개설",일간경북신문 - 금인욱 기자,2023/05/09,"영주시 가흥신도시와 구도심을 잇는 도로와 교량이 추가로 개설된다.
시는 총사업비 470억원을 투입해 가흥신도시와 세무서사거리를 연결하는 1.06km 규모의 도로개설 사업을 확정하고 기본 및 실시설계용역을 착수했다고 9일 밝혔다.
이번 사업은 가흥택지 준공 이후, 교통 체증이 심각해지고 있는 가운데 가흥공원개발사업 일환으로 LH(한국토지주택공사) 가흥 공공지원민간임대아파트 공급이 확정돼 교통량 분산을 위해 추진된다. 현재 서천을 가로지르는 교량은 서천교, 영주교, 가흥교, 가흥2교 4곳이다. 영주교와 가흥교는 아파트와 다세대주택이 밀집한 가흥신도시와 직접 연결된 교량으로 폭이 협소해 출‧퇴근 시 극심한 정체를 빗고 있다.
이 도로가 개설되면 영주교와 가흥교 일대 교통량을 우회시키는 분산효과를 가져와 도심 교통흐름을 획기적으로 개선함은 물론 구도심 활성화로 균형발전에 크게 기여할 것으로 전망된다.
시는 상반기 중 착수보고회를 개최, 시민들의 다양한 의견을 수렴해 기본 및 실시계획에 반영하고 교량은 은은한 야간 경관조명을 설치해 서천의 또 하나의 볼거리로 추진할 계획이다.
또한, LH(한국토지주택공사)와 영주 가흥 공공지원 민간임대아파트 공급 구간에 대한 사업비 분담 협의를 계속하면서 국토교통부 사업 공모를 통해 국비 확보에도 총력을 다 할 예정이다.
박남서 영주시장은 “구도심·신도시 연결도로가 추가 개설되면 교통정체 해소는 물론 영주시 전체 균형발전이 가능해져 지역경제 활성화에 크게 도움 될 것”이라고 말했다.금인욱기자",http://www.newgbnews.com/news/view.php?idx=305235
