지역명,기사제목,기자이름,날짜,내용,링크
대구,중구 ‘어린이보호구역’ 교통지도 캠페인,일간경북신문 - 윤기영 기자,2023/05/29,"대구 중구청은 중부경찰서, 남산초등학교, 모범운전자회, 녹색어머니회와 함께 지난 26일 남산초등학교 어린이보호구역 및 통학로 안전시설을 점검하고 등굣길 어린이 교통안전지도 캠페인을 실시했다.
또한 최근 타 시도 어린이보호구역 내 어린이 사망사고 발생 관련 간담회를 통해 유관기관 협조 및 안전대책을 논의했다.
류규하 중구청장은 “어린이보호구역 사각지대에 대한 안전점검을 강화하고 유관기관 간 협력해 시설개선을 적극 추진해 나가겠다”고 했다. 윤기영기자",http://www.newgbnews.com/news/view.php?idx=307271
대구,공연 즐기고 온누리상품권 받아가세요,일간경북신문 - 윤기영 기자,2023/05/29,"중소벤처기업부 대구․경북지방중소벤처기업청과 대구전통시장진흥재단은 지난 26일 오후 2시부터 칠성종합시장 일대에서 ‘별별상상 야외무대’ 개장 기념식을 개최했다고 밝혔다.
이날 행사는 대구전통시장진흥재단이 주최하며 중소벤처기업부 대구경북지방중소벤처기업청을 비롯해 양금희 국회의원(대구북구갑, 국민의힘), 중소기업유통센터이사장(이태식), 소상공인시장진흥공단 지역본부장(노화봉), 상인, 시민 등 100여 명이 참석한 가운데 기념식과 축하공연 등의 행사가 마련될 예정이다.
이번 행사는 상권활성화사업으로 ‘별별상상 야외무대’를 조성해, 칠성종합시장 브랜드 이미지를 개선하고 지역 문화예술인과 단체에 무대를 제공해, 상시 문화공연 등을 통해 시장 내 볼거리와 즐길거리를 제공하고자 한다.
앞서 양금희 의원은 이날 오후 1시 30분 칠성종합시장 복합커뮤니티센터 8층에서 대구전통시장진흥재단 팀장으로부터 지역 현안 및 상권활성화사업 추진현황을 보고 받고, 칠성종합시장 활성화를 위해 중소벤처기업청(청장 원영준), 소상공인시장진흥공단(본부장 노화봉)과 함께 칠성종합시장 상인회(회장 장상훈)로부터 다양한 의견을 들을 계획이다. 윤기영기자",http://www.newgbnews.com/news/view.php?idx=307270
대구,국토부 혁신도시 종합발전계획 이행실적 ‘우수’,일간경북신문 - 윤기영 기자,2023/05/29,"대구광역시가 혁신도시 발전을 위해 추진 중인 2개 사업이 국토교통부에서 실시한 혁신도시 종합발전계획 이행실적 평가에서 우수사업으로 선정됐다.
국토교통부는 전국 10개 혁신도시를 대상으로 종합발전계획에 포함된 주요 사업의 2022년도 추진실적을 평가해, 특화발전, 정주여건, 상생발전 등 3개 분야에서 9개 사업을 우수사업으로 선정했다. 특화발전분야에서 선정된 대구광역시의 지역선도대학 육성사업은 2019년부터 국비 70%를 지원받는 연간 11억 원 사업으로 5개 대학과 21개 공공기관 그리고 300여 개 산업체가 참여하는 대규모 산학 연계 프로젝트로 2022년에 343명이 취업하고, SW융합과정에 2,223명 이수 등이 높은 평가를 받았다. 또한, 정주여건분야에서 선정된 산업단지형 공동직장어린이집 건립사업은 대구광역시가 부지를 제공하고, 고용노동부와 11개 기업이 50여억 원을 분담하는 등 공동의 노력을 통해 이전공공기관과 기업 직원들의 어린 자녀들을 안심하고 맡길 수 있게 되었다는데 높은 평가를 받았다.
그동안 대구광역시는 혁신도시발전위원회, 공공기관협의체 등 다양한 네트워크를 구축하고 혁신도시 발전을 위해 노력해 왔는데, 특히, 이번 성과는 공공기관, 지역대학, 기업체, 시민과 함께 머리를 맞대고 대구혁신도시의 특성에 맞춘 다양한 사업을 발굴하고 추진한 결과라 할 것이다.
황순조 대구광역시 기획조정실장은 “혁신도시와 관련한 그간의 노력이 중앙정부로부터 좋은 평가를 받아 기쁘게 생각하며, 앞으로도 공공기관, 지역대학, 기업체 등과의 협력을 더욱 강화하고, 다양한 사업을 지속적으로 발굴하여 혁신도시 발전을 내실 있게 추진해 나가겠다”라고 말했다. 윤기영기자",http://www.newgbnews.com/news/view.php?idx=307269
대구,"북구, 지리산 청정골서 청렴 배우다",일간경북신문 - 윤기영 기자,2023/05/29,,http://www.newgbnews.com/news/view.php?idx=307268
대구,"대구, ABB 고성장기업 50개사 본격 육성",일간경북신문 - 윤기영 기자,2023/05/29,"(재)대구테크노파크(이하 ‘대구TP’)는 2023년 ‘ABB 고성장기업 50 육성사업’에 참여할 미래 성장 가능성이 높은 지역 ABB(AI, Big-data, Block-chain) 기업을 모집한다.
‘ABB 고성장기업 50 육성사업’은 미래 50년 대구산업 기반 마련을 위해 미래 성장 가능성이 있는 ABB 기업을 2026년까지 50개사를 발굴하여, 지역 ABB 혁신생태계 조성과 지역 경제발전을 견인할 지역 대표 ABB 기업으로 육성하기 위해 올해 최초로 추진하는 사업이다.
대구광역시는 ‘ABB 고성장기업 50 육성사업’에 선정된 ABB 기업을 단기간에 고성장시켜 지역 대표기업으로 육성하기 위해 ABB 관련 학·연으로 구성된 산업융합 얼라이언스(10개 기관)를 지난 4월 발족했으며 정기적 협의회를 통해 정보 공유 및 기업에 필요한 AtoZ까지 밀착지원을 할 예정이다.
올해는 성장단계별로 ‘유망벤처기업’ 7개사, ‘고성장기업’ 5개사, ‘선도기업’ 3개사를 포함해 총 15개사를 선정할 계획으로 오는 6월 5일부터 6월 16일까지 대구TP로 신청할 수 있으며 상세 내용은 대구광역시와 대구TP 홈페이지에서 확인이 가능하다.
신청은 대구광역시 내(內) 본사가 소재하거나 선정 후 3개월 이내 본사 이전 계획이 있고, 지역산업과의 동반성장을 견인할 미래 성장 가능성이 있는 ABB 기업이면 가능하다.
선정된 기업에는 기업수요 맞춤형 파워풀 패키지(비R&D, 성장단계별 기업당 최대 6천만 원~1억 원)과 ABB 특화 서비스 개발을 지원하는 파워풀 서비스 발굴(R&D, 기업당 최대 2억 원), R&D 기획(국가 R&D 과제 신청) 등을 지원한다.
또한 지역 ABB 기업의 해외 투자유치 및 시장진출을 위해 ‘글로벌 飛上 프로젝트’(해외투자 유치)사업도 진행되며, 이외에도 전국 단위 분야별 전문가 Pool을 구축·운영하여 기업 애로사항 해결을 위한 ‘솔루션 탱크’, ABB 고성장기업 후보기업 발굴·육성을 위한 ‘시그니처 사업’ 등 다양한 기업지원 사업을 추진할 계획이다.
이종화 대구광역시 경제부시장은 “미래 성장 가능성이 있는 ABB 기업을 집중 발굴해 지역을 대표하는 기업으로 육성함으로써 다가오는 대구 미래 50년을 위한 지역 ABB산업 생태계가 더욱 발전할 수 있도록 최선을 다하겠다”라고 말했다. 윤기영기자",http://www.newgbnews.com/news/view.php?idx=307267
대구,대구시의회 농번기 농촌일손돕기,일간경북신문 - 이종구 기자,2023/05/25,"대구시의회는 25일 오전 8시부터 달성군 유가읍 한정리 소재 마늘, 양파 수확 현장에서 일손이 부족한 농촌 돕기에 나섰다. 이날 농촌일손돕기에는 이만규 의장, 이영애 부의장 등 대구시의원들과 대구시의회 사무처 직원 40여 명이 달성군 유가읍 한정리 소재 농장을 방문하여 농민들과 함께 마늘, 양파 수확에 힘을 보태며 구슬땀을 흘렸다. 대구시의회는 농촌 인력 부족문제와 도시 유휴 인력을 활용한 지역 농업활성화를 위해 대구농협에서 추진 중인 농촌일손돕기 행사에 뜻을 같이 하고자 이번 일손돕기에 참여하게 되었다. 대구시의회 농촌일손돕기 참여단은 농번기 바쁜 농가를 효율적으로 돕기 위해 아침 일찍 현장에 도착하여 부족한 일손을 보태고, 한참 수확 시기인 마늘을 주민들과 함께 수확하며 농업 근로현장을 생생하게 체험하고 농민들의 현장의 목소리를 수렴했다. 이종구기자",http://www.newgbnews.com/news/view.php?idx=307153
대구,"동구, 팔공메아리 명예·SNS기자단 모집",일간경북신문 - 윤기영 기자,2023/05/25,"대구 동구청이 동구 소식지 ‘팔공메아리’ 명예기자와 제11기 동구 블로그 기자단 그리고 올해 신설된 유튜브 기자단을 모집한다.
동구 대표 소식지 ‘팔공메아리’ 명예기자는 동구 구석구석 구민의 생생한 목소리를 소식지에 담는 역할을 한다. 총 5명을 모집하며, 오는 7월1일부터 2년간 활동을 하게 된다. 원고료 및 취재비로 1건당 6만원을 지급한다. 오는 6월 16일까지, e메일(dong2161@korea.kr)로 지원신청서, 자기소개서, 자유기고 1편 등을 첨부해 신청하면 된다. 공고일 기준 대구 동구에 거주하거나 동구 소재 직장에서 직장생활을 하는 사람이면 누구나 신청할 수 있다. 제11기 동구 블로그기자단은 구청의 주요행사, 명소, 축제, 맛집, 인물 등을 월 1회 이상 취재 후 블로그에 올리면 된다.
채택된 기사에 대한 원고료로 월 6만원을 지급하며, 월별 우수기사로 선정되면 3만원을 추가로 지급한다. 총 10명을 모집하며, 오는 7월1일부터 1년간 활동을 하게 된다.
올해 처음 운영하는 유튜브 기자단은 동구와 관련된 내용으로 유튜브 영상 콘텐츠를 제작하게 되며, SNS 모니터링 및 홍보활동도 한다. 채택된 영상에 대한 지원비로 월 15만원을 지급하며, 우수 영상에 선정되면 10만원을 추가로 받을 수 있다. 총 5명 모집하며, 블로그 기자단과 마찬가지로 7월1일부터 1년간 활동한다.
블로그 기자와 유튜브 기자 모두 지역 제한은 없으나, 대구 동구에 거주하는 사람을 우대한다.
신청은 오는 6월 16일까지 e메일(dgdonggu2102@daum.net)로 지원서 등을 첨부해 제출하면 된다. 동구청장은 “팔공메아리 및 SNS기자단 모집에 역량있는 분들의 많은 참여와 관심을 바란다”고 전했다.윤기영기자",http://www.newgbnews.com/news/view.php?idx=307109
대구,"북구, 재난관리평가 ‘우수기관’ 선정",일간경북신문 - 윤기영 기자,2023/05/25,"대구 북구청은 행정안전부 주관 2023년 재난관리평가 결과 우수기관으로 선정돼, 재난대응 역량이 뛰어난 도시로 이름을 알리게 됐다.
재난관리평가는 총 338개 재난관리책임기관을 대상으로 지난해에 추진한 재난관리 전반에 대해 평가하며, 예방·대비·대응·복구의 재난관리 핵심역량 및 주요 재난안전정책 추진실적 등의 항목을 바탕으로 중앙재난관리평가단의 종합적인 평가에 따라 우수, 보통, 미흡 3개 등급으로 나누어진다.
북구청은 지표 전 영역에 걸쳐 골고루 우수한 평가를 받았으며 특히 재난관리기금 실적, 재난 및 안전관리 업무담당자 전문교육 실적, 지진 안전성 확보, 재난유형별 위기관리 매뉴얼 개선 실적, 재난발생 시 신속한 초동대응 역량 배양 실적 등에서 우수한 성적을 거뒀으며, 특별교부세 등의 인센티브를 받는다.
배광식 북구청장은 “앞으로도 북구 주민이 안전한 일상을 누릴 수 있도록 재난관리분야에 최선을 다하겠다”고 말했다.윤기영기자",http://www.newgbnews.com/news/view.php?idx=307108
대구,"수성구, 고위직 간부 공무원 폭력예방교육",일간경북신문 - 윤기영 기자,2023/05/25,"대구 수성구는 기관장 및 5급 이상 고위직 간부 공무원 70여 명을 대상으로 ‘폭력 예방 교육’을 총 5회 실시했다.
폭력 사건이 매년 사회적 이슈로 부각되고, 조직의 변화를 끌어낼 수 있는 중요한 위치에 있는 고위직들이 문제를 적극적으로 예방할 수 있는 능력을 갖추는 것이 무엇보다 중요하기에 올해는 소규모 토론식 교육을 진행했다.
성희롱·성폭력 사건 발생의 사전 예방과 친밀한 관계 속에서 폭력이 발생하는 구조와 원인 등을 실제 사례 중심으로 다뤄 성 인지 감수성 향상을 강조했다.
김대권 수성구청장은 “건강한 직장 내 평등한 조직 문화 조성을 위해서는 자신의 책임과 역할 인식을 통한 상호 배려와 존중이 중요하다”며 “고위직일수록 경각심을 가지고 솔선수범해 건강한 직장문화를 조성해 구민들에게 모범적인 모습을 보일 수 있도록 노력하겠다”고 말했다.
수성구는 또한 성평등 인식 제고를 위해 전 직원을 대상으로 대면·비대면 4대 폭력 예방 교육을 지속해 실시할 예정이며, 직장 내 성희롱·성폭력 예방과 관련해 고충 상담창구를 운영해 철저한 예방책을 마련할 방침이다.윤기영기자",http://www.newgbnews.com/news/view.php?idx=307107
대구,"중구, 깨끗한 공직문화 조성 ‘청렴교육’",일간경북신문 - 윤기영 기자,2023/05/25,"대구 중구는 지난 23일 중구청 대강당에서 고위공직자 등 100여 명을 대상으로 투명하고 깨끗한 공직문화 조성을 위해 청렴교육을 실시했다.
국민권익위원회 청렴연수원 정승호 전문강사는 류규하 중구청장, 김오성 중구의회 의장 등 고위공직자와 6급 이상 직원을 대상으로 ‘직무권한 등을 행사한 부당행위 등 공공기관의 불공정 갑질 관행 근절 방안’에 대해 강의했다.
또한, 직장에서 빈번히 발생할 수 있는 괴롭힘에 대한 구체적인 사례를 들어가며 갑질 예방과 조직문화 개선은 고위공직자의 배려와 소통의 자세가 가장 중요하다고 강조했다.
류규하 중구청장은 “이번 교육을 통해 ‘갑질’에 대한 인식개선으로 서로 배려하고 존중하는 공직문화가 정착됐으면 한다”고 했다.윤기영기자",http://www.newgbnews.com/news/view.php?idx=307106
대구,"대구, DGIST AI·SW 교육연구센터 개소",일간경북신문 - 윤기영 기자,2023/05/25,"대구광역시는 25일, 대구경북과학기술원(DGIST) 산하 DGIST AI·SW 교육연구센터(이하 센터)를 ‘대구 디지털 혁신거점 조성’사업이 한창 추진 중인 수성알파시티 내(內)에 개소했다.
본 센터는 대구광역시가 미래 신산업으로 집중 육성하고 있는 ABB(AI·빅데이터·블록체인) 산업분야 우수 인재 양성 및 관련 기업들과 협업을 통한 연구개발, 학생창업 등을 지원하기 위해 조성됐다.
센터를 통해 국내 융복합 교육·연구 핵심 기관인 DGIST와 산·학·연 협력 모델을 구축·운영함으로써 지역 ABB산업 활성화를 위한 교두보를 마련했다고 할 것이다.
본 센터는 수성알파시티 내(內) 대구스마트시티센터 건물 3층에 위치하며, 총 176평 규모로 실시간 양방향 강의실, 연구실, 공유오피스, 회의실 등 공간으로 조성됐다.
센터가 위치한 수성 알파시티는 제2의 판교밸리를 꿈꾸는 비수도권 최대 ICT/SW 집적단지로 대구광역시가 디지털 인프라, 기업지원, 인재양성 기능을 한곳에 집적한 디지털 혁신거점으로 조성하고 있어 더 큰 시너지 효과가 기대된다.
지난 2월 대구광역시와 DGIST는 ‘DGIST AI·SW 교육연구센터 구축 및 운영’을 위한 업무협약을 체결했고, 준비절차를 거쳐 이번에 센터를 개소하게 됐으며, 개소식에는 이종화 대구광역시 경제부시장, 국양 DGIST 총장, 김유현 DIP원장 등을 비롯해 지역 ICT/SW 기업 대표 등 30여 명이 참석했다.
향후, 센터는 지역 ABB기업들이 DGIST의 우수한 인재를 활용하여 다양한 연구개발(R&D) 협업을 통해 성공적인 사업화를 이룰 수 있도록 지속적인 지원을 제공할 것이며, 기업과 협력해 산업현장에서 필요한 기업 맞춤형 인력양성, 이론과 실습이 겸비된 실질적 교육, 기술기반 창업지원 등 지역 ABB산업 발전에 큰 도움을 줄 것으로 기대된다.
이종화 대구광역시 경제부시장은 “ABB기반 미래디지털 기술 중심 산업구조 대전환과 지역산업 육성을 위해 함께 협력해 줄 것을 당부하며, 앞으로도 지역기업의 혁신성장과 ABB산업 활성화를 위해 산·학·연 협력 지원을 강화해 나가겠다”라고 말했다.윤기영기자",http://www.newgbnews.com/news/view.php?idx=307105
대구,‘확실한 지방시대’ 대구·군위 상생협력 강화,일간경북신문 - 윤기영 기자,2023/05/25,,http://www.newgbnews.com/news/view.php?idx=307104
대구,"글로벌시대, 대구 스타트업 생태계 나아갈 길",일간경북신문 - 윤기영 기자,2023/05/24,,http://www.newgbnews.com/news/view.php?idx=307006
대구,"달성군, 논공읍 위천리 파크골프장 개장",일간경북신문 - 윤기영 기자,2023/05/24,,http://www.newgbnews.com/news/view.php?idx=306946
대구,"중구, 8천600만원 들여 야간 경관조명",일간경북신문 - 윤기영 기자,2023/05/24,"대구 중구는 주민들의 보행로 경관개선사업의 일환으로 총 8천600만원의 예산을 투입했다.
또한, 반월당 인근에 조형펜스 및 야간 경관조명을 설치해 아름다운 밤 풍경을 연출하며 시민들과 관광객들의 발길을 잡고 있다.
이번 사업은 반월당역 인근 통행로에 있는 환기구 벽면이 노후됐고, 불법 현수막 게시 등으로 도시미관을 해치고 있어 주변 경관개선 및 쾌적한 보행환경을 마련하고자 추진됐다.
류규하 중구청장은 “원도심과 유동 인구가 많은 지역의 경관개선을 통해 쾌적한 환경을 조성하고 주민들에게 실질적인 도움이 될 수 있도록 하겠다.”며 “앞으로도 도시경관 개선에 최선을 다하겠다.”고 말했다.윤기영기자",http://www.newgbnews.com/news/view.php?idx=306945
대구,서구지역아동센터협의회 ‘한마음 대회’,일간경북신문 - 윤기영 기자,2023/05/24,"대구 서구지역아동센터협의회는 지난 20일 서구 국민체육센터에서 관내 33개 지역아동센터 아동과 종사자 등 500여 명이 참석한 가운데 한마음대회를 개최했다.
이번 한마음대회는 친구들과 함께 그리는 작품 활동을 통해 협동심과 배려심을 배울 수 있는 계기를 마련하고 지역아동센터 아이들의 상상력을 마음껏 펼칠 수 있는 기회를 제공하기 위해 개최됐다.
이날 나의 꿈, 지역아동센터에서 가장 행복했던 순간 및 환경보호와 관련한 살기 좋은 서구 만들기를 주제로 그림솜씨를 뽐냈으며, 협의회에서는 최우수 1점, 우수 2점, 장려 3점을 선정해 입상한 아동들에게 상장을 수여하고 격려했다.
성효순 서구 지역아동센터협의회장은 “아이들이 행복해야 부모들이 행복하고 부모들이 행복해야 건강한 도시를 만들 수 있다”면서 “아이들이 즐거워하는 모습을 보니 기쁘고 보람을 느꼈다”고 전했다.윤기영기자",http://www.newgbnews.com/news/view.php?idx=306944
대구,"북구, 엄홍길 대장 강연 열기 ‘후끈 후끈’",일간경북신문 - 윤기영 기자,2023/05/24,"대구 북구청은 구민들의 배움의 기회 확대 등을 위해 코로나19 이후 3년 만에 마련한 ‘행복북구 명사초청 아카데미’를 주민 400여 명이 참석한 가운데 성황리에 마쳤다.
지난 22일 오후 2시 대구과학대학교 영송홀에서 열린 명사초청 특강에는 세계 최초로 히말라야 8,000m급 16좌 완등에 성공한 세계적인 산악인 엄홍길 대장이 강연자로 나와서 ‘불굴의 도전 정신’이라는 주제로 영광 뒤에 적지 않은 좌절과 실패가 있었고, 그것을 극복해 온 과정을 참석자들에게 생생하게 들려줬다.
강연 후에는 질의응답과 사진 촬영 시간이 이어졌으며, 주민들은 엄홍길 대장에게 히말라야 등반 준비 과정, 등반 중의 어려움, 의미 등에 대한 질문을 하며 뜨거운 관심을 보였다. 엄홍길 대장은 주민들의 질문 하나하나에도성실히 답변하며 진솔한 모습을 보여줬다.
강연이 끝난 후 참석한 주민은 “엄홍길 대장님의 강연을 듣고 큰 감동을 받았다.
그리고 이번 강연을 통해 진정한 삶의 아름다움과 불굴의 도전 정신을 배우고 그동안 코로나19로 지친 마음에 희망과 용기를 되새길 수 있는 아주 유익한 최고의 강연이었다”며 큰 만족감을 나타냈다.
이날 강연에 참석한 배광식 북구청장은 “엄홍길 대장님의 강연을 통해 주민들이 큰 위안과 용기를 얻었을 것”이라며, “앞으로도 북구 주민들에게 꿈과 희망을 전할 수 있는 다양한 프로그램을 마련하겠다”고 밝혔다.
한편, 코로나19 이후 3년 만에 개최된 ‘행복북구 명사초청 아카데미’는 5월 강연을 시작으로 총 5회가 예정돼 있다.윤기영기자",http://www.newgbnews.com/news/view.php?idx=306943
대구,망월지 두꺼비 캐릭터 그리기 공모 시상,일간경북신문 - 윤기영 기자,2023/05/24,,http://www.newgbnews.com/news/view.php?idx=306942
대구,"대구, 블록체인 기술혁신지원센터 유치 확정",일간경북신문 - 윤기영 기자,2023/05/24,"대구광역시가 과학기술정보통신부(한국인터넷진흥원)에서 전국 지방자치단체를 대상으로 공고한 ‘2023년 지역 블록체인 기술혁신지원센터’ 구축사업에 최종 선정됐다.
대구광역시는 민선 8기 ABB(AI, Block chain, Big Data)를 미래핵심 산업으로 선정, 전담부서 신설(2022.7.22)과 블록체인 기술 확보를 위한 2023년 자체 예산 78억 원을 마련해 집중 육성 중이다.
대구광역시는 공모 선정에 따라 사업비 38억 원을 투입하여 수성알파시티 내 스마트시티센터 2층에 블록체인 산업육성의 컨트롤타워 역할을 할 블록체인 기술혁신지원센터(이하 지원센터)를 구축한다.
지원센터는 블록체인을 선도할 수 있는 지역혁신거점의 구심적 확보를 목표로 대구광역시, 한국인터넷진흥원, (재)대구디지털혁신진흥원과 5월 24일(수) 사업협약을 체결하고 본격적으로 추진할 예정이다. 지원센터에서는 ▲블록체인 개발 인프라 및 플랫폼 구축 ▲지역 특화산업과 융합한 블록체인 서비스 발굴 ▲블록체인 융합기술개발 및 컨설팅 지원 ▲블록체인 기업 입주공간 및 품질테스트·인증 지원 등 지역 블록체인 산업 육성을 위해 A ~ Z까지 체계적으로 지원할 계획이다.
류동현 대구광역시 AI블록체인과장은 “ABB 미래전략 중 A(AI, 인공지능)는 인공지능 기반 공정혁신 시뮬레이션센터 구축(총 연구비 258억 원)사업 선정으로 첫 단추를 끼었고, 두 번째 단추인 B(Block chain, 블록체인)산업 육성을 위한 블록체인 기술혁신지원센터 사업이 선정돼 ABB 미래전략 산업육성의 퍼즐이 하나씩 맞춰지고 있다”라고 말했다. 앞으로 대구광역시는 그동안 추진해온 블록체인 시민체감서비스(대구ID, D마일)의 실증경험과 강력한 정책의지를 바탕으로, 사업 참여에 동참한 24개 블록체인 기업 등 산학연 협력을 통해 블록체인 생태계를 완성할 예정이다.
미래혁신성장실장은 “블록체인 기술혁신지원센터가 지역산업과 연계한 융합서비스 발굴 등 지역 혁신의 성장거점으로 발전할 수 있도록 지속적으로 지원하겠다”라며 블록체인 산업육성의 의지를 강조했다.윤기영기자",http://www.newgbnews.com/news/view.php?idx=306941
